{
  "roundId": "5373fcbf-1376-4e9c-896a-3d310a6379f2",
  "date": "8/29/2025, 7:25:21 PM",
  "totalResponses": 3,
  "responses": [
    {
      "timestamp": "2025-08-29T15:24:32.386Z",
      "role": "fundamental",
      "context": {
        "universe": [
          "BTC",
          "ETH"
        ],
        "marketStats": 2,
        "facts": 11,
        "news": 0
      },
      "response": {
        "claims": [
          {
            "id": "BTC_fundamental_1756480993490_0",
            "ticker": "BTC",
            "agentRole": "fundamental",
            "claim": "HOLD",
            "confidence": 0.7,
            "evidence": [
              "BTC_market_1756481072384",
              "BTC_market_1756481072384",
              "BTC_market_1756481072384"
            ],
            "timestamp": 1756480993490,
            "riskFlags": [
              "low_liquidity"
            ],
            "direction": "neutral",
            "magnitude": 0.5,
            "rationale": "While BTC shows strong institutional backing (market_cap_health = 1.000) and positive social sentiment (social_sentiment = 0.823), the relatively low liquidity (liquidity_score = 0.587) and moderate on-chain health (on_chain_health = 0.677) suggest a cautious approach. The moderate risk (risk_adjustment = 0.609) further supports a HOLD recommendation.",
            "signals": [
              {
                "name": "liquidity_score",
                "value": 0.587
              },
              {
                "name": "on_chain_health",
                "value": 0.677
              },
              {
                "name": "social_sentiment",
                "value": 0.823
              },
              {
                "name": "market_cap_health",
                "value": 1
              },
              {
                "name": "risk_adjustment",
                "value": 0.609
              },
              {
                "name": "network_activity",
                "value": 0.697
              },
              {
                "name": "transaction_efficiency",
                "value": 0.01
              },
              {
                "name": "address_growth",
                "value": 1
              },
              {
                "name": "utxo_health",
                "value": 1
              },
              {
                "name": "network_security",
                "value": 1
              },
              {
                "name": "social_volume",
                "value": 1
              },
              {
                "name": "social_engagement",
                "value": 1
              },
              {
                "name": "sentiment_score",
                "value": 0.79
              },
              {
                "name": "community_health",
                "value": 0.481
              },
              {
                "name": "volatility_score",
                "value": 0
              },
              {
                "name": "correlation_score",
                "value": 0
              },
              {
                "name": "drawdown_risk",
                "value": 0.095
              },
              {
                "name": "profit_taking_pressure",
                "value": 0.4
              }
            ]
          },
          {
            "id": "ETH_fundamental_1756480993490_1",
            "ticker": "ETH",
            "agentRole": "fundamental",
            "claim": "HOLD",
            "confidence": 0.52,
            "evidence": [
              "ETH_market_1756481072384",
              "ETH_market_1756481072384",
              "ETH_market_1756481072384"
            ],
            "timestamp": 1756480993490,
            "riskFlags": [
              "weak_onchain"
            ],
            "direction": "neutral",
            "magnitude": 0.3,
            "rationale": "ETH exhibits excellent liquidity (liquidity_score = 0.851) and positive social sentiment (social_sentiment = 0.819). However, the weak on-chain health (on_chain_health = 0.379) and low market cap health (market_cap_health = 0.523) are significant concerns.  The moderate risk (risk_adjustment = 0.687) further supports a HOLD recommendation. More investigation into the low on-chain health is needed before considering a buy.",
            "signals": [
              {
                "name": "liquidity_score",
                "value": 0.851
              },
              {
                "name": "on_chain_health",
                "value": 0.379
              },
              {
                "name": "social_sentiment",
                "value": 0.819
              },
              {
                "name": "market_cap_health",
                "value": 0.523
              },
              {
                "name": "risk_adjustment",
                "value": 0.687
              },
              {
                "name": "network_activity",
                "value": 0.689
              },
              {
                "name": "transaction_efficiency",
                "value": 0.026
              },
              {
                "name": "address_growth",
                "value": 1
              },
              {
                "name": "utxo_health",
                "value": 0
              },
              {
                "name": "network_security",
                "value": 0
              },
              {
                "name": "social_volume",
                "value": 0.963
              },
              {
                "name": "social_engagement",
                "value": 1
              },
              {
                "name": "sentiment_score",
                "value": 0.82
              },
              {
                "name": "community_health",
                "value": 0.445
              },
              {
                "name": "volatility_score",
                "value": 0
              },
              {
                "name": "correlation_score",
                "value": 0
              },
              {
                "name": "drawdown_risk",
                "value": 0.089
              },
              {
                "name": "profit_taking_pressure",
                "value": 0.8
              }
            ]
          }
        ],
        "textPart": "FUNDAMENTAL ANALYSIS:\n\nBTC shows a moderate fundamental score of 0.741, despite a high market cap health score of 1.000. This indicates strong institutional backing but is tempered by a relatively low liquidity score (0.587) and a moderate on-chain health score (0.677).  High social sentiment (0.823) suggests positive community engagement, although community health (0.481) is a concern.  Risk is moderate (risk_adjustment = 0.609), with low drawdown risk (0.095).  The relatively low liquidity and moderate on-chain activity raise concerns regarding the sustainability of the current trend.  While institutional support is strong, the lower liquidity could lead to price instability.\n\nETH shows a moderate fundamental score of 0.675.  Liquidity is excellent (0.851), suggesting stable pricing. However, on-chain health is weak (0.379), indicating potential underlying network issues. This is concerning and needs further investigation.  Social sentiment is high (0.819), pointing to positive community engagement. Market cap health is low (0.523), implying potentially weaker institutional interest.  Risk is moderate (risk_adjustment = 0.687), with low drawdown risk (0.089). The low on-chain health and weak market cap health are significant negative factors, despite excellent liquidity and positive social sentiment.\n\nNo text analysis available\n\nTECHNICAL ANALYSIS:\n\nBTC shows a neutral RSI at 33.84, indicating neither oversold nor overbought conditions. However, the MACD is significantly bearish at -580.14, suggesting strong downward momentum.  The Bollinger Bands show the price is relatively low, suggesting potential for upward movement. The Stochastic oscillator at 9.99 indicates oversold conditions, suggesting a potential bullish reversal. Volatility is low at 0.205, indicating relatively low price swings. The signal strength is moderately positive at 0.42. Overall, the technical picture is mixed, with bearish MACD and stochastic being the most compelling signals. While the low RSI and Bollinger Bands could support upward correction, the strength of the negative MACD signals suggests caution.\n\nETH displays a neutral RSI at 36.17, similar to BTC, showing no strong overbought or oversold conditions.  The MACD is also bearish at -47.31, although less extreme than BTC's MACD. The Stochastic oscillator at 10.23 signals oversold conditions, potentially indicating a bullish reversal.  Bollinger Bands show the price is relatively low, just as with BTC.  Volatility is low at 0.17, again indicating smaller price swings. The signal strength is also moderately positive at 0.42. Overall, similar to BTC, the technical picture for ETH is mixed, with a bearish MACD but bullish stochastic and low price relative to Bollinger Bands potentially indicating a pending bullish reversal.\n\n",
        "openaiResponse": "FUNDAMENTAL ANALYSIS:\n\nBTC shows a moderate fundamental score of 0.741, despite a high market cap health score of 1.000. This indicates strong institutional backing but is tempered by a relatively low liquidity score (0.587) and a moderate on-chain health score (0.677).  High social sentiment (0.823) suggests positive community engagement, although community health (0.481) is a concern.  Risk is moderate (risk_adjustment = 0.609), with low drawdown risk (0.095).  The relatively low liquidity and moderate on-chain activity raise concerns regarding the sustainability of the current trend.  While institutional support is strong, the lower liquidity could lead to price instability.\n\nETH shows a moderate fundamental score of 0.675.  Liquidity is excellent (0.851), suggesting stable pricing. However, on-chain health is weak (0.379), indicating potential underlying network issues. This is concerning and needs further investigation.  Social sentiment is high (0.819), pointing to positive community engagement. Market cap health is low (0.523), implying potentially weaker institutional interest.  Risk is moderate (risk_adjustment = 0.687), with low drawdown risk (0.089). The low on-chain health and weak market cap health are significant negative factors, despite excellent liquidity and positive social sentiment.\n\n\n{\n  \"claims\": [\n    {\n      \"ticker\": \"BTC\",\n      \"agentRole\": \"fundamental\",\n      \"claim\": \"HOLD\",\n      \"confidence\": 0.7,\n      \"direction\": \"neutral\",\n      \"magnitude\": 0.5,\n      \"rationale\": \"While BTC shows strong institutional backing (market_cap_health = 1.000) and positive social sentiment (social_sentiment = 0.823), the relatively low liquidity (liquidity_score = 0.587) and moderate on-chain health (on_chain_health = 0.677) suggest a cautious approach. The moderate risk (risk_adjustment = 0.609) further supports a HOLD recommendation.\",\n      \"signals\": [\n        {\"name\": \"liquidity_score\", \"value\": 0.587},\n        {\"name\": \"on_chain_health\", \"value\": 0.677},\n        {\"name\": \"social_sentiment\", \"value\": 0.823},\n        {\"name\": \"market_cap_health\", \"value\": 1.000},\n        {\"name\": \"risk_adjustment\", \"value\": 0.609},\n        {\"name\": \"network_activity\", \"value\": 0.697},\n        {\"name\": \"transaction_efficiency\", \"value\": 0.010},\n        {\"name\": \"address_growth\", \"value\": 1.000},\n        {\"name\": \"utxo_health\", \"value\": 1.000},\n        {\"name\": \"network_security\", \"value\": 1.000},\n        {\"name\": \"social_volume\", \"value\": 1.000},\n        {\"name\": \"social_engagement\", \"value\": 1.000},\n        {\"name\": \"sentiment_score\", \"value\": 0.790},\n        {\"name\": \"community_health\", \"value\": 0.481},\n        {\"name\": \"volatility_score\", \"value\": 0.000},\n        {\"name\": \"correlation_score\", \"value\": 0.000},\n        {\"name\": \"drawdown_risk\", \"value\": 0.095},\n        {\"name\": \"profit_taking_pressure\", \"value\": 0.400}\n      ],\n      \"evidence\": [\"ON-CHAIN METRICS\", \"SOCIAL METRICS\", \"RISK METRICS\"],\n      \"riskFlags\": [\"low_liquidity\"]\n    },\n    {\n      \"ticker\": \"ETH\",\n      \"agentRole\": \"fundamental\",\n      \"claim\": \"HOLD\",\n      \"confidence\": 0.52,\n      \"direction\": \"neutral\",\n      \"magnitude\": 0.3,\n      \"rationale\": \"ETH exhibits excellent liquidity (liquidity_score = 0.851) and positive social sentiment (social_sentiment = 0.819). However, the weak on-chain health (on_chain_health = 0.379) and low market cap health (market_cap_health = 0.523) are significant concerns.  The moderate risk (risk_adjustment = 0.687) further supports a HOLD recommendation. More investigation into the low on-chain health is needed before considering a buy.\",\n      \"signals\": [\n        {\"name\": \"liquidity_score\", \"value\": 0.851},\n        {\"name\": \"on_chain_health\", \"value\": 0.379},\n        {\"name\": \"social_sentiment\", \"value\": 0.819},\n        {\"name\": \"market_cap_health\", \"value\": 0.523},\n        {\"name\": \"risk_adjustment\", \"value\": 0.687},\n        {\"name\": \"network_activity\", \"value\": 0.689},\n        {\"name\": \"transaction_efficiency\", \"value\": 0.026},\n        {\"name\": \"address_growth\", \"value\": 1.000},\n        {\"name\": \"utxo_health\", \"value\": 0.000},\n        {\"name\": \"network_security\", \"value\": 0.000},\n        {\"name\": \"social_volume\", \"value\": 0.963},\n        {\"name\": \"social_engagement\", \"value\": 1.000},\n        {\"name\": \"sentiment_score\", \"value\": 0.820},\n        {\"name\": \"community_health\", \"value\": 0.445},\n        {\"name\": \"volatility_score\", \"value\": 0.000},\n        {\"name\": \"correlation_score\", \"value\": 0.000},\n        {\"name\": \"drawdown_risk\", \"value\": 0.089},\n        {\"name\": \"profit_taking_pressure\", \"value\": 0.800}\n      ],\n      \"evidence\": [\"ON-CHAIN METRICS\", \"SOCIAL METRICS\", \"RISK METRICS\"],\n      \"riskFlags\": [\"weak_onchain\"]\n    }\n  ]\n}\n\n\n```json\n{\n  \"claims\": [\n    {\n      \"ticker\": \"BTC\",\n      \"agentRole\": \"sentiment\",\n      \"claim\": \"HOLD\",\n      \"confidence\": 0.343,\n      \"direction\": \"neutral\",\n      \"magnitude\": 0.0,\n      \"rationale\": \"Mixed sentiment in news articles regarding BTC, with some positive news about large-scale acquisitions and government holdings offset by negative news concerning price drops and economic uncertainty.  Low freshness score and GalaxyScore below 50 significantly reduce confidence.\",\n      \"signals\": [\n        {\"name\": \"sentiment_score\", \"value\": 0.238},\n        {\"name\": \"news_coverage\", \"value\": 20},\n        {\"name\": \"freshness_score\", \"value\": 0.0},\n        {\"name\": \"consistency\", \"value\": 0.558},\n        {\"name\": \"credibility\", \"value\": 0.657},\n        {\"name\": \"coverage_norm\", \"value\": 0.774},\n        {\"name\": \"market_mood_factor\", \"value\": 1.0},\n        {\"name\": \"social_volume\", \"value\": 135986},\n        {\"name\": \"galaxyscore\", \"value\": 48.1},\n        {\"name\": \"social_engagement\", \"value\": 0.73}\n      ],\n      \"evidence\": [\n        {\"kind\": \"news\", \"source\": \"Unspecified\", \"url\": null, \"publishedAt\": null, \"snippet\": \"Various news articles reporting on BTC price fluctuations, large-scale purchases, and regulatory developments.\"},\n        {\"kind\": \"index\", \"name\": \"fear_greed\", \"value\": 51, \"observedAt\": null},\n        {\"kind\": \"social\", \"source\": \"signals\", \"metric\": \"galaxyscore\", \"value\": 48.1, \"observedAt\": null}\n      ],\n      \"riskFlags\": [\"low_freshness\", \"inconsistent_sentiment\"]\n    },\n    {\n      \"ticker\": \"ETH\",\n      \"agentRole\": \"sentiment\",\n      \"claim\": \"HOLD\",\n      \"confidence\": 0.336,\n      \"direction\": \"neutral\",\n      \"magnitude\": 0.0,\n      \"rationale\": \"Similar to BTC, ETH news shows mixed sentiment. Positive news about acquisitions and tokenized notes are counterbalanced by negative reports on ETF outflows and hacking incidents. Low freshness score and GalaxyScore below 50 significantly reduce confidence.\",\n      \"signals\": [\n        {\"name\": \"sentiment_score\", \"value\": 0.23},\n        {\"name\": \"news_coverage\", \"value\": 20},\n        {\"name\": \"freshness_score\", \"value\": 0.0},\n        {\"name\": \"consistency\", \"value\": 0.521},\n        {\"name\": \"credibility\", \"value\": 0.657},\n        {\"name\": \"coverage_norm\", \"value\": 0.774},\n        {\"name\": \"market_mood_factor\", \"value\": 1.0},\n        {\"name\": \"social_volume\", \"value\": 96307},\n        {\"name\": \"galaxyscore\", \"value\": 44.5},\n        {\"name\": \"social_engagement\", \"value\": 0.73}\n      ],\n      \"evidence\": [\n        {\"kind\": \"news\", \"source\": \"Unspecified\", \"url\": null, \"publishedAt\": null, \"snippet\": \"News articles covering ETH price movements, institutional investment, and DeFi events.\"},\n        {\"kind\": \"index\", \"name\": \"fear_greed\", \"value\": 51, \"observedAt\": null},\n        {\"kind\": \"social\", \"source\": \"signals\", \"metric\": \"galaxyscore\", \"value\": 44.5, \"observedAt\": null}\n      ],\n      \"riskFlags\": [\"low_freshness\", \"inconsistent_sentiment\"]\n    }\n  ]\n}\n```\n\n\nTECHNICAL ANALYSIS:\n\nBTC shows a neutral RSI at 33.84, indicating neither oversold nor overbought conditions. However, the MACD is significantly bearish at -580.14, suggesting strong downward momentum.  The Bollinger Bands show the price is relatively low, suggesting potential for upward movement. The Stochastic oscillator at 9.99 indicates oversold conditions, suggesting a potential bullish reversal. Volatility is low at 0.205, indicating relatively low price swings. The signal strength is moderately positive at 0.42. Overall, the technical picture is mixed, with bearish MACD and stochastic being the most compelling signals. While the low RSI and Bollinger Bands could support upward correction, the strength of the negative MACD signals suggests caution.\n\nETH displays a neutral RSI at 36.17, similar to BTC, showing no strong overbought or oversold conditions.  The MACD is also bearish at -47.31, although less extreme than BTC's MACD. The Stochastic oscillator at 10.23 signals oversold conditions, potentially indicating a bullish reversal.  Bollinger Bands show the price is relatively low, just as with BTC.  Volatility is low at 0.17, again indicating smaller price swings. The signal strength is also moderately positive at 0.42. Overall, similar to BTC, the technical picture for ETH is mixed, with a bearish MACD but bullish stochastic and low price relative to Bollinger Bands potentially indicating a pending bullish reversal.\n\n{\n  \"claims\": [\n    {\n      \"ticker\": \"BTC\",\n      \"agentRole\": \"technical\",\n      \"claim\": \"BUY\",\n      \"confidence\": 0.75,\n      \"direction\": \"bullish\",\n      \"magnitude\": 0.6,\n      \"rationale\": \"Despite a bearish MACD (-580.14), the oversold conditions indicated by the Stochastic (9.99) and low Bollinger Bands suggest a potential bullish reversal. The low volatility (0.205) and moderately positive signal strength (0.42) support a cautiously optimistic outlook.\",\n      \"signals\": [\n        {\"name\": \"rsi\", \"value\": 33.84},\n        {\"name\": \"macd\", \"value\": -580.14},\n        {\"name\": \"volatility_30d\", \"value\": 0.205},\n        {\"name\": \"stochastic\", \"value\": 9.99},\n        {\"name\": \"signal_strength\", \"value\": 0.421},\n        {\"name\": \"bollinger_bands\", \"value\": -2690.27}\n      ],\n      \"evidence\": [\"rsi\", \"macd\", \"stochastic\", \"bollinger_bands\"],\n      \"riskFlags\": [\"bearish_macd\"]\n    },\n    {\n      \"ticker\": \"ETH\",\n      \"agentRole\": \"technical\",\n      \"claim\": \"BUY\",\n      \"confidence\": 0.70,\n      \"direction\": \"bullish\",\n      \"magnitude\": 0.5,\n      \"rationale\": \"Similar to BTC, ETH shows a bearish MACD (-47.31), but the Stochastic (10.23) indicates oversold conditions, suggesting a potential bullish reversal. Low volatility (0.17) and moderately positive signal strength (0.42) support a cautious buy signal.  The relatively low price compared to its Bollinger Bands further suggests a potential upward trend.\",\n      \"signals\": [\n        {\"name\": \"rsi\", \"value\": 36.17},\n        {\"name\": \"macd\", \"value\": -47.31},\n        {\"name\": \"volatility_30d\", \"value\": 0.17},\n        {\"name\": \"stochastic\", \"value\": 10.23},\n        {\"name\": \"signal_strength\", \"value\": 0.421},\n        {\"name\": \"bollinger_bands\", \"value\": -218.49}\n      ],\n      \"evidence\": [\"rsi\", \"macd\", \"stochastic\", \"bollinger_bands\"],\n      \"riskFlags\": [\"bearish_macd\"]\n    }\n  ]\n}\n\n\n"
      }
    },
    {
      "timestamp": "2025-08-29T15:24:47.409Z",
      "role": "sentiment",
      "context": {
        "universe": [
          "BTC",
          "ETH"
        ],
        "marketStats": 2,
        "facts": 11,
        "news": 0
      },
      "response": {
        "claims": [
          {
            "id": "BTC_sentiment_1756480993490_0",
            "ticker": "BTC",
            "agentRole": "sentiment",
            "claim": "HOLD",
            "confidence": 0.3,
            "evidence": [],
            "timestamp": 1756480993490,
            "riskFlags": [
              "low_freshness",
              "inconsistent_sentiment",
              "low_galaxyscore"
            ],
            "direction": "neutral",
            "magnitude": 0,
            "rationale": "Mixed news sentiment with low freshness and below-threshold GalaxyScore. Insufficient data for strong directional call.",
            "signals": [
              {
                "name": "sentiment_score",
                "value": 0
              },
              {
                "name": "news_coverage",
                "value": 20
              },
              {
                "name": "freshness_score",
                "value": 0
              },
              {
                "name": "consistency",
                "value": 0.558
              },
              {
                "name": "credibility",
                "value": 0.657
              },
              {
                "name": "coverage_norm",
                "value": 0.774
              },
              {
                "name": "market_mood_factor",
                "value": 1
              },
              {
                "name": "social_volume",
                "value": 135986
              },
              {
                "name": "galaxyscore",
                "value": 48.1
              },
              {
                "name": "social_engagement",
                "value": 0.73
              }
            ]
          },
          {
            "id": "ETH_sentiment_1756480993490_1",
            "ticker": "ETH",
            "agentRole": "sentiment",
            "claim": "HOLD",
            "confidence": 0.3,
            "evidence": [
              "ETH_news_1756481084428",
              "ETH_news_1756481084428",
              "ETH_news_1756481084428"
            ],
            "timestamp": 1756480993490,
            "riskFlags": [
              "low_freshness",
              "inconsistent_sentiment",
              "low_galaxyscore"
            ],
            "direction": "neutral",
            "magnitude": 0,
            "rationale": "Mixed news sentiment with low freshness and below-threshold GalaxyScore. Insufficient data for strong directional call.",
            "signals": [
              {
                "name": "sentiment_score",
                "value": 0
              },
              {
                "name": "news_coverage",
                "value": 20
              },
              {
                "name": "freshness_score",
                "value": 0
              },
              {
                "name": "consistency",
                "value": 0.521
              },
              {
                "name": "credibility",
                "value": 0.657
              },
              {
                "name": "coverage_norm",
                "value": 0.774
              },
              {
                "name": "market_mood_factor",
                "value": 1
              },
              {
                "name": "social_volume",
                "value": 96307
              },
              {
                "name": "galaxyscore",
                "value": 44.5
              },
              {
                "name": "social_engagement",
                "value": 0.73
              }
            ]
          }
        ],
        "textPart": "FUNDAMENTAL ANALYSIS:\n\nBTC exhibits a fundamental score of 0.741, indicating a relatively healthy state.  However, a closer look reveals a mixed bag. While its market cap health is excellent (score of 1.000), reflecting strong institutional interest and market efficiency, its liquidity score is only 0.587, suggesting relatively lower trading volume compared to its market cap.  This could lead to price instability during periods of increased trading activity. On-chain health is moderate (0.677), showing reasonable network activity but with room for improvement in transaction efficiency (0.010). Social sentiment is positive (0.823), suggesting a generally positive community outlook, despite a relatively low community health score (0.481). Risk factors, including profit-taking pressure (0.400) and drawdown risk (0.095), appear manageable at this time. Overall, BTC presents a moderate investment opportunity, hampered somewhat by its liquidity constraints.\n\n\nETH shows a fundamental score of 0.675, indicating a less robust fundamental position than BTC. While exhibiting excellent liquidity (0.851), suggesting strong trading volume and price stability, its on-chain health is considerably weaker (0.379), reflecting low transaction efficiency (0.026) and concerningly low UTXO health (0.000), and network security (0.000). These suggest potential vulnerabilities in the network.  Social sentiment is high (0.819) with high social engagement (1.000), but again, a low community health score (0.445) casts some doubt on long-term network sustainability. Market cap health is low (0.523), indicating weaker market efficiency and potentially less institutional interest. High profit-taking pressure (0.800) further adds to the risk.  Therefore, despite high liquidity, ETH presents a more cautious investment opportunity due to significant on-chain and market cap weaknesses.\n\nNo text analysis available\n\nTECHNICAL ANALYSIS:\n\nBTC shows a neutral RSI at 33.84, indicating neither overbought nor oversold conditions. However, the MACD is significantly bearish at -580.14, suggesting strong downward momentum.  Volatility is low at 0.205, indicating relatively smaller price swings. The Stochastic oscillator is bullish at 9.99, suggesting potential upward pressure.  The Bollinger Bands show a bullish signal due to the price being below the lower band (-2690.27). The overall signal strength is moderate at 0.421.  Considering the conflicting signals, the bearish MACD and lower Bollinger Bands dominate the analysis. The market regime appears to be ranging, given the low volatility.\n\nETH displays a neutral RSI at 36.16, similar to BTC. The MACD is also bearish at -47.33, but less extreme than BTC's. Volatility is low at 0.171.  Similar to BTC, the Stochastic oscillator shows a bullish signal at 10.22,  and the Bollinger Bands also indicate a bullish signal as the price is below the lower band (-218.44).  The signal strength is also moderate at 0.421.  Like BTC, conflicting signals exist but the bearish MACD suggests caution.\n\n",
        "openaiResponse": "FUNDAMENTAL ANALYSIS:\n\nBTC exhibits a fundamental score of 0.741, indicating a relatively healthy state.  However, a closer look reveals a mixed bag. While its market cap health is excellent (score of 1.000), reflecting strong institutional interest and market efficiency, its liquidity score is only 0.587, suggesting relatively lower trading volume compared to its market cap.  This could lead to price instability during periods of increased trading activity. On-chain health is moderate (0.677), showing reasonable network activity but with room for improvement in transaction efficiency (0.010). Social sentiment is positive (0.823), suggesting a generally positive community outlook, despite a relatively low community health score (0.481). Risk factors, including profit-taking pressure (0.400) and drawdown risk (0.095), appear manageable at this time. Overall, BTC presents a moderate investment opportunity, hampered somewhat by its liquidity constraints.\n\n\nETH shows a fundamental score of 0.675, indicating a less robust fundamental position than BTC. While exhibiting excellent liquidity (0.851), suggesting strong trading volume and price stability, its on-chain health is considerably weaker (0.379), reflecting low transaction efficiency (0.026) and concerningly low UTXO health (0.000), and network security (0.000). These suggest potential vulnerabilities in the network.  Social sentiment is high (0.819) with high social engagement (1.000), but again, a low community health score (0.445) casts some doubt on long-term network sustainability. Market cap health is low (0.523), indicating weaker market efficiency and potentially less institutional interest. High profit-taking pressure (0.800) further adds to the risk.  Therefore, despite high liquidity, ETH presents a more cautious investment opportunity due to significant on-chain and market cap weaknesses.\n\n\n{\n  \"claims\": [\n    {\n      \"ticker\": \"BTC\",\n      \"agentRole\": \"fundamental\",\n      \"claim\": \"HOLD\",\n      \"confidence\": 0.79,\n      \"direction\": \"neutral\",\n      \"magnitude\": 0.5,\n      \"rationale\": \"While BTC shows excellent market cap health (1.000) and positive social sentiment (0.823), its relatively low liquidity score (0.587) and moderate on-chain health (0.677) suggest a cautious approach.  The risk is manageable but limits bullish potential.\",\n      \"signals\": [\n        {\"name\": \"liquidity_score\", \"value\": 0.587},\n        {\"name\": \"on_chain_health\", \"value\": 0.677},\n        {\"name\": \"social_sentiment\", \"value\": 0.823},\n        {\"name\": \"market_cap_health\", \"value\": 1.000},\n        {\"name\": \"risk_adjustment\", \"value\": 0.609},\n        {\"name\": \"network_activity\", \"value\": 0.697},\n        {\"name\": \"transaction_efficiency\", \"value\": 0.010},\n        {\"name\": \"address_growth\", \"value\": 1.000},\n        {\"name\": \"utxo_health\", \"value\": 1.000},\n        {\"name\": \"network_security\", \"value\": 1.000},\n        {\"name\": \"social_volume\", \"value\": 1.000},\n        {\"name\": \"social_engagement\", \"value\": 1.000},\n        {\"name\": \"sentiment_score\", \"value\": 0.790},\n        {\"name\": \"community_health\", \"value\": 0.481},\n        {\"name\": \"volatility_score\", \"value\": 0.000},\n        {\"name\": \"correlation_score\", \"value\": 0.000},\n        {\"name\": \"drawdown_risk\", \"value\": 0.095},\n        {\"name\": \"profit_taking_pressure\", \"value\": 0.400}\n      ],\n      \"evidence\": [\"BTC_market_cap_health_1.000\", \"BTC_liquidity_score_0.587\", \"BTC_on_chain_health_0.677\"],\n      \"riskFlags\": [\"low_liquidity\"]\n    },\n    {\n      \"ticker\": \"ETH\",\n      \"agentRole\": \"fundamental\",\n      \"claim\": \"HOLD\",\n      \"confidence\": 0.62,\n      \"direction\": \"neutral\",\n      \"magnitude\": 0.4,\n      \"rationale\": \"ETH's excellent liquidity (0.851) is offset by significantly weaker on-chain health (0.379) and low market cap health (0.523). High profit-taking pressure (0.800) further contributes to the risk.  The positive social sentiment (0.819) is not enough to outweigh these concerns.\",\n      \"signals\": [\n        {\"name\": \"liquidity_score\", \"value\": 0.851},\n        {\"name\": \"on_chain_health\", \"value\": 0.379},\n        {\"name\": \"social_sentiment\", \"value\": 0.819},\n        {\"name\": \"market_cap_health\", \"value\": 0.523},\n        {\"name\": \"risk_adjustment\", \"value\": 0.687},\n        {\"name\": \"network_activity\", \"value\": 0.689},\n        {\"name\": \"transaction_efficiency\", \"value\": 0.026},\n        {\"name\": \"address_growth\", \"value\": 1.000},\n        {\"name\": \"utxo_health\", \"value\": 0.000},\n        {\"name\": \"network_security\", \"value\": 0.000},\n        {\"name\": \"social_volume\", \"value\": 0.963},\n        {\"name\": \"social_engagement\", \"value\": 1.000},\n        {\"name\": \"sentiment_score\", \"value\": 0.820},\n        {\"name\": \"community_health\", \"value\": 0.445},\n        {\"name\": \"volatility_score\", \"value\": 0.000},\n        {\"name\": \"correlation_score\", \"value\": 0.000},\n        {\"name\": \"drawdown_risk\", \"value\": 0.089},\n        {\"name\": \"profit_taking_pressure\", \"value\": 0.800}\n      ],\n      \"evidence\": [\"ETH_liquidity_score_0.851\", \"ETH_on_chain_health_0.379\", \"ETH_market_cap_health_0.523\"],\n      \"riskFlags\": [\"weak_onchain\", \"high_profit_taking_pressure\"]\n    }\n  ]\n}\n\n\n```json\n{\n  \"claims\": [\n    {\n      \"ticker\": \"BTC\",\n      \"agentRole\": \"sentiment\",\n      \"claim\": \"HOLD\",\n      \"confidence\": 0.3,\n      \"direction\": \"neutral\",\n      \"magnitude\": 0.0,\n      \"rationale\": \"Mixed news sentiment with low freshness and below-threshold GalaxyScore. Insufficient data for strong directional call.\",\n      \"signals\": [\n        {\"name\": \"sentiment_score\", \"value\": 0.0},\n        {\"name\": \"news_coverage\", \"value\": 20},\n        {\"name\": \"freshness_score\", \"value\": 0.0},\n        {\"name\": \"consistency\", \"value\": 0.558},\n        {\"name\": \"credibility\", \"value\": 0.657},\n        {\"name\": \"coverage_norm\", \"value\": 0.774},\n        {\"name\": \"market_mood_factor\", \"value\": 1.0},\n        {\"name\": \"social_volume\", \"value\": 135986},\n        {\"name\": \"galaxyscore\", \"value\": 48.1},\n        {\"name\": \"social_engagement\", \"value\": 0.73}\n      ],\n      \"evidence\": [\n        {\"kind\": \"news\", \"source\": \"various\", \"url\": null, \"publishedAt\": null, \"snippet\": \"News articles show mixed sentiment regarding BTC price movements, influenced by factors such as Fed rate decisions, institutional investments, and market uncertainty.\"},\n        {\"kind\": \"index\", \"name\": \"fear_greed\", \"value\": 51, \"observedAt\": null},\n        {\"kind\": \"social\", \"source\": \"signals\", \"metric\": \"galaxyscore\", \"value\": 48.1, \"observedAt\": null}\n      ],\n      \"riskFlags\": [\"low_freshness\", \"inconsistent_sentiment\", \"low_galaxyscore\"]\n    },\n    {\n      \"ticker\": \"ETH\",\n      \"agentRole\": \"sentiment\",\n      \"claim\": \"HOLD\",\n      \"confidence\": 0.3,\n      \"direction\": \"neutral\",\n      \"magnitude\": 0.0,\n      \"rationale\": \"Mixed news sentiment with low freshness and below-threshold GalaxyScore. Insufficient data for strong directional call.\",\n      \"signals\": [\n        {\"name\": \"sentiment_score\", \"value\": 0.0},\n        {\"name\": \"news_coverage\", \"value\": 20},\n        {\"name\": \"freshness_score\", \"value\": 0.0},\n        {\"name\": \"consistency\", \"value\": 0.521},\n        {\"name\": \"credibility\", \"value\": 0.657},\n        {\"name\": \"coverage_norm\", \"value\": 0.774},\n        {\"name\": \"market_mood_factor\", \"value\": 1.0},\n        {\"name\": \"social_volume\", \"value\": 96307},\n        {\"name\": \"galaxyscore\", \"value\": 44.5},\n        {\"name\": \"social_engagement\", \"value\": 0.73}\n      ],\n      \"evidence\": [\n        {\"kind\": \"news\", \"source\": \"various\", \"url\": null, \"publishedAt\": null, \"snippet\": \"News articles show mixed sentiment regarding ETH price movements, influenced by factors such as institutional investments, ETF outflows, and DeFi activity.\"},\n        {\"kind\": \"index\", \"name\": \"fear_greed\", \"value\": 51, \"observedAt\": null},\n        {\"kind\": \"social\", \"source\": \"signals\", \"metric\": \"galaxyscore\", \"value\": 44.5, \"observedAt\": null}\n      ],\n      \"riskFlags\": [\"low_freshness\", \"inconsistent_sentiment\", \"low_galaxyscore\"]\n    }\n  ]\n}\n```\n\n\nTECHNICAL ANALYSIS:\n\nBTC shows a neutral RSI at 33.84, indicating neither overbought nor oversold conditions. However, the MACD is significantly bearish at -580.14, suggesting strong downward momentum.  Volatility is low at 0.205, indicating relatively smaller price swings. The Stochastic oscillator is bullish at 9.99, suggesting potential upward pressure.  The Bollinger Bands show a bullish signal due to the price being below the lower band (-2690.27). The overall signal strength is moderate at 0.421.  Considering the conflicting signals, the bearish MACD and lower Bollinger Bands dominate the analysis. The market regime appears to be ranging, given the low volatility.\n\nETH displays a neutral RSI at 36.16, similar to BTC. The MACD is also bearish at -47.33, but less extreme than BTC's. Volatility is low at 0.171.  Similar to BTC, the Stochastic oscillator shows a bullish signal at 10.22,  and the Bollinger Bands also indicate a bullish signal as the price is below the lower band (-218.44).  The signal strength is also moderate at 0.421.  Like BTC, conflicting signals exist but the bearish MACD suggests caution.\n\n\n{\n  \"claims\": [\n    {\n      \"ticker\": \"BTC\",\n      \"agentRole\": \"technical\",\n      \"claim\": \"HOLD\",\n      \"confidence\": 0.75,\n      \"direction\": \"neutral\",\n      \"magnitude\": 0.0,\n      \"rationale\": \"While the Stochastic oscillator and Bollinger Bands suggest bullish potential, the significantly negative MACD (-580.14) and relatively low volatility (0.205) outweigh the bullish signals, creating a neutral outlook.  The RSI is also neutral, offering no strong buy or sell signal. The overall signal strength of 0.421 is considered moderate for a HOLD recommendation.\",\n      \"signals\": [\n        {\"name\": \"rsi\", \"value\": 33.84},\n        {\"name\": \"macd\", \"value\": -580.14},\n        {\"name\": \"volatility_30d\", \"value\": 0.205},\n        {\"name\": \"stochastic\", \"value\": 9.99},\n        {\"name\": \"bollinger_bands\", \"value\": -2690.27},\n        {\"name\": \"signal_strength\", \"value\": 0.421}\n      ],\n      \"evidence\": [\"rsi\",\"macd\",\"stochastic\",\"bollinger_bands\"],\n      \"riskFlags\": [\"weak_signals\", \"conflicting_indicators\"]\n    },\n    {\n      \"ticker\": \"ETH\",\n      \"agentRole\": \"technical\",\n      \"claim\": \"HOLD\",\n      \"confidence\": 0.70,\n      \"direction\": \"neutral\",\n      \"magnitude\": 0.0,\n      \"rationale\": \"Similar to BTC, ETH shows conflicting signals. The RSI is neutral (36.16), the MACD is bearish (-47.33), the Stochastic oscillator is bullish (10.22), and the Bollinger Bands show a bullish signal. The low volatility (0.171) indicates a ranging market. The moderate signal strength (0.421) supports a neutral stance.  The bearish MACD is less extreme than BTC's, justifying a slightly lower confidence compared to BTC.\",\n      \"signals\": [\n        {\"name\": \"rsi\", \"value\": 36.16},\n        {\"name\": \"macd\", \"value\": -47.33},\n        {\"name\": \"volatility_30d\", \"value\": 0.171},\n        {\"name\": \"stochastic\", \"value\": 10.22},\n        {\"name\": \"bollinger_bands\", \"value\": -218.44},\n        {\"name\": \"signal_strength\", \"value\": 0.421}\n      ],\n      \"evidence\": [\"rsi\",\"macd\",\"stochastic\",\"bollinger_bands\"],\n      \"riskFlags\": [\"weak_signals\", \"conflicting_indicators\"]\n    }\n  ]\n}\n\n\n"
      }
    },
    {
      "timestamp": "2025-08-29T15:25:03.027Z",
      "role": "technical",
      "context": {
        "universe": [
          "BTC",
          "ETH"
        ],
        "marketStats": 2,
        "facts": 11,
        "news": 0
      },
      "response": {
        "claims": [
          {
            "id": "BTC_technical_1756480993490_0",
            "ticker": "BTC",
            "agentRole": "technical",
            "claim": "BUY",
            "confidence": 0.95,
            "evidence": [],
            "timestamp": 1756480993490,
            "riskFlags": [
              "low_volatility"
            ],
            "direction": "bullish",
            "magnitude": 0.7,
            "rationale": "Despite a bearish MACD (-575.11), the oversold conditions indicated by the Stochastic (10.37) and Williams %R (-88.84) oscillators, along with a bullish signal from the Bollinger Bands, suggest a potential short-term bullish reversal. The low volatility (0.205) and a signal strength of 0.421 support this BUY recommendation.",
            "signals": [
              {
                "name": "rsi",
                "value": 34.05
              },
              {
                "name": "macd",
                "value": -575.11
              },
              {
                "name": "stochastic",
                "value": 10.37
              },
              {
                "name": "williams_r",
                "value": -88.84
              },
              {
                "name": "bollinger_bands",
                "value": -2708.27
              },
              {
                "name": "volatility_30d",
                "value": 0.205
              },
              {
                "name": "signal_strength",
                "value": 0.421
              }
            ]
          },
          {
            "id": "ETH_technical_1756480993490_1",
            "ticker": "ETH",
            "agentRole": "technical",
            "claim": "BUY",
            "confidence": 0.95,
            "evidence": [],
            "timestamp": 1756480993490,
            "riskFlags": [
              "low_volatility"
            ],
            "direction": "bullish",
            "magnitude": 0.7,
            "rationale": "Similar to BTC, ETH shows a bearish MACD (-47.33), but oversold conditions are indicated by the Stochastic (10.22) and Williams %R (-82.51) oscillators, along with a bullish signal from the Bollinger Bands. The low volatility (0.171) and a signal strength of 0.421 support a BUY recommendation. The potential for a short-term bullish reversal is present.",
            "signals": [
              {
                "name": "rsi",
                "value": 36.16
              },
              {
                "name": "macd",
                "value": -47.33
              },
              {
                "name": "stochastic",
                "value": 10.22
              },
              {
                "name": "williams_r",
                "value": -82.51
              },
              {
                "name": "bollinger_bands",
                "value": -218.44
              },
              {
                "name": "volatility_30d",
                "value": 0.171
              },
              {
                "name": "signal_strength",
                "value": 0.421
              }
            ]
          }
        ],
        "textPart": "FUNDAMENTAL ANALYSIS:\n\nBTC exhibits a fundamental score of 0.741, indicating a relatively healthy asset.  However, the liquidity score (0.587) is below average, suggesting potential challenges in swiftly buying or selling large quantities.  While the on-chain health (0.677) shows moderate network activity,  the exceptionally high market cap health (1.000) points to strong institutional confidence. The social sentiment (0.823) is positive, though community health (0.481) needs improvement.  The risk adjustment (0.609) suggests moderate risk, primarily driven by drawdown risk (0.095). Overall, BTC shows a mixed bag; strong institutional support and positive sentiment are offset by below-average liquidity and moderate on-chain health.\n\nETH presents a fundamental score of 0.675, reflecting a moderate overall health.  Liquidity is excellent (0.850), making it easier to trade.  However, on-chain health (0.379) is considerably weak, indicating low network activity and possibly concerns about network usage.  Social sentiment (0.819) is high and suggests positive community engagement, despite a low community health score (0.445).  Market cap health (0.523) is relatively low, suggesting potential lack of institutional confidence.  Risk adjustment (0.687) is moderate, influenced by a relatively low drawdown risk (0.089) but a high profit-taking pressure (0.800).  ETH shows a less stable profile than BTC, with excellent liquidity but concerning on-chain health and market cap health indicators.\n\nNo text analysis available\n\nTECHNICAL ANALYSIS:\n\nBTC shows a neutral RSI at 34.05, indicating neither oversold nor overbought conditions.  The MACD is bearish at -575.11, suggesting downward momentum. However, the Stochastic oscillator at 10.37 and Williams %R at -88.84 suggest oversold conditions and potential for a bullish reversal. Volatility is low at 0.205, indicating relatively smaller price swings. The signal strength is 0.421, indicating a moderately bullish signal. Overall, the technical picture is mixed, with bearish MACD but bullish Stochastic and Williams %R, suggesting a potential short-term bullish reversal within a broader bearish trend.  The Bollinger Bands are also showing a bullish signal as the price is below the lower band.\n\nETH displays a neutral RSI at 36.16, suggesting balanced buying and selling pressure. The MACD is bearish at -47.33, indicating downward momentum. Similar to BTC, the Stochastic oscillator at 10.22 and Williams %R at -82.51 suggest oversold conditions and a potential for bullish reversal. Volatility is low at 0.171. The signal strength is 0.421, mirroring BTC. Overall, the technical indicators for ETH are also mixed, with bearish MACD but bullish Stochastic and Williams %R, suggesting a potential short-term bullish reversal in a bearish trend.  The Bollinger Bands are also showing a bullish signal with the price below the lower band.\n\n",
        "openaiResponse": "FUNDAMENTAL ANALYSIS:\n\nBTC exhibits a fundamental score of 0.741, indicating a relatively healthy asset.  However, the liquidity score (0.587) is below average, suggesting potential challenges in swiftly buying or selling large quantities.  While the on-chain health (0.677) shows moderate network activity,  the exceptionally high market cap health (1.000) points to strong institutional confidence. The social sentiment (0.823) is positive, though community health (0.481) needs improvement.  The risk adjustment (0.609) suggests moderate risk, primarily driven by drawdown risk (0.095). Overall, BTC shows a mixed bag; strong institutional support and positive sentiment are offset by below-average liquidity and moderate on-chain health.\n\nETH presents a fundamental score of 0.675, reflecting a moderate overall health.  Liquidity is excellent (0.850), making it easier to trade.  However, on-chain health (0.379) is considerably weak, indicating low network activity and possibly concerns about network usage.  Social sentiment (0.819) is high and suggests positive community engagement, despite a low community health score (0.445).  Market cap health (0.523) is relatively low, suggesting potential lack of institutional confidence.  Risk adjustment (0.687) is moderate, influenced by a relatively low drawdown risk (0.089) but a high profit-taking pressure (0.800).  ETH shows a less stable profile than BTC, with excellent liquidity but concerning on-chain health and market cap health indicators.\n\n\n{\n  \"claims\": [\n    {\n      \"ticker\": \"BTC\",\n      \"agentRole\": \"fundamental\",\n      \"claim\": \"HOLD\",\n      \"confidence\": 0.78,\n      \"direction\": \"neutral\",\n      \"magnitude\": 0.5,\n      \"rationale\": \"While BTC shows strong institutional support (market_cap_health=1.000) and positive social sentiment (social_sentiment=0.823), its liquidity (liquidity_score=0.587) is a concern, limiting its trading efficiency.  Moderate on-chain health (on_chain_health=0.677) suggests the network's activity needs improvement before a strong BUY recommendation can be made.\",\n      \"signals\": [\n        {\"name\": \"liquidity_score\", \"value\": 0.587},\n        {\"name\": \"on_chain_health\", \"value\": 0.677},\n        {\"name\": \"social_sentiment\", \"value\": 0.823},\n        {\"name\": \"market_cap_health\", \"value\": 1.000},\n        {\"name\": \"risk_adjustment\", \"value\": 0.609},\n        {\"name\": \"network_activity\", \"value\": 0.697},\n        {\"name\": \"transaction_efficiency\", \"value\": 0.010},\n        {\"name\": \"address_growth\", \"value\": 1.000},\n        {\"name\": \"utxo_health\", \"value\": 1.000},\n        {\"name\": \"network_security\", \"value\": 1.000},\n        {\"name\": \"social_volume\", \"value\": 1.000},\n        {\"name\": \"social_engagement\", \"value\": 1.000},\n        {\"name\": \"sentiment_score\", \"value\": 0.790},\n        {\"name\": \"community_health\", \"value\": 0.481},\n        {\"name\": \"volatility_score\", \"value\": 0.000},\n        {\"name\": \"correlation_score\", \"value\": 0.000},\n        {\"name\": \"drawdown_risk\", \"value\": 0.095},\n        {\"name\": \"profit_taking_pressure\", \"value\": 0.400}\n      ],\n      \"evidence\": [\"BTC_liquidity_score\", \"BTC_market_cap_health\",\"BTC_social_sentiment\", \"BTC_on_chain_health\"],\n      \"riskFlags\": [\"low_liquidity\"]\n    },\n    {\n      \"ticker\": \"ETH\",\n      \"agentRole\": \"fundamental\",\n      \"claim\": \"HOLD\",\n      \"confidence\": 0.6,\n      \"direction\": \"neutral\",\n      \"magnitude\": 0.5,\n      \"rationale\": \"ETH's excellent liquidity (liquidity_score=0.850) is a positive factor. However, the weak on-chain health (on_chain_health=0.379) and low market cap health (market_cap_health=0.523) raise significant concerns. While social sentiment (social_sentiment=0.819) is positive, these negative fundamental indicators outweigh the positive aspects. Therefore, a HOLD recommendation is given until on-chain health and market cap health improve.\",\n      \"signals\": [\n        {\"name\": \"liquidity_score\", \"value\": 0.850},\n        {\"name\": \"on_chain_health\", \"value\": 0.379},\n        {\"name\": \"social_sentiment\", \"value\": 0.819},\n        {\"name\": \"market_cap_health\", \"value\": 0.523},\n        {\"name\": \"risk_adjustment\", \"value\": 0.687},\n        {\"name\": \"network_activity\", \"value\": 0.689},\n        {\"name\": \"transaction_efficiency\", \"value\": 0.026},\n        {\"name\": \"address_growth\", \"value\": 1.000},\n        {\"name\": \"utxo_health\", \"value\": 0.000},\n        {\"name\": \"network_security\", \"value\": 0.000},\n        {\"name\": \"social_volume\", \"value\": 0.963},\n        {\"name\": \"social_engagement\", \"value\": 1.000},\n        {\"name\": \"sentiment_score\", \"value\": 0.820},\n        {\"name\": \"community_health\", \"value\": 0.445},\n        {\"name\": \"volatility_score\", \"value\": 0.000},\n        {\"name\": \"correlation_score\", \"value\": 0.000},\n        {\"name\": \"drawdown_risk\", \"value\": 0.089},\n        {\"name\": \"profit_taking_pressure\", \"value\": 0.800}\n      ],\n      \"evidence\": [\"ETH_liquidity_score\", \"ETH_on_chain_health\", \"ETH_social_sentiment\", \"ETH_market_cap_health\"],\n      \"riskFlags\": [\"weak_onchain\", \"low_market_cap_health\"]\n    }\n  ]\n}\n\n\n```json\n{\n  \"claims\": [\n    {\n      \"ticker\": \"BTC\",\n      \"agentRole\": \"sentiment\",\n      \"claim\": \"HOLD\",\n      \"confidence\": 0.3,\n      \"direction\": \"neutral\",\n      \"magnitude\": 0.0,\n      \"rationale\": \"Mixed news sentiment and low GalaxyScore indicate a neutral outlook.  Low freshness score significantly impacts confidence.\",\n      \"signals\": [\n        {\"name\": \"sentiment_score\", \"value\": 0.238},\n        {\"name\": \"news_coverage\", \"value\": 20},\n        {\"name\": \"freshness_score\", \"value\": 0.0},\n        {\"name\": \"consistency\", \"value\": 0.558},\n        {\"name\": \"credibility\", \"value\": 0.657},\n        {\"name\": \"coverage_norm\", \"value\": 0.774},\n        {\"name\": \"market_mood_factor\", \"value\": 1.0},\n        {\"name\": \"social_volume\", \"value\": 135986},\n        {\"name\": \"galaxyscore\", \"value\": 48.1},\n        {\"name\": \"social_engagement\", \"value\": 0.73}\n      ],\n      \"evidence\": [\n        {\"kind\": \"news\", \"source\": \"various\", \"url\": \"N/A\", \"publishedAt\": \"N/A\", \"snippet\": \"Multiple news articles report on BTC price fluctuations and institutional investments, with mixed sentiment.\"},\n        {\"kind\": \"index\", \"name\": \"fear_greed\", \"value\": 51, \"observedAt\": \"N/A\"},\n        {\"kind\": \"social\", \"source\": \"signals\", \"metric\": \"galaxyscore\", \"value\": 48.1, \"observedAt\": \"N/A\"}\n      ],\n      \"riskFlags\": [\"low_freshness\", \"inconsistent_sentiment\"]\n    },\n    {\n      \"ticker\": \"ETH\",\n      \"agentRole\": \"sentiment\",\n      \"claim\": \"HOLD\",\n      \"confidence\": 0.3,\n      \"direction\": \"neutral\",\n      \"magnitude\": 0.0,\n      \"rationale\": \"Mixed news sentiment and low GalaxyScore indicate a neutral outlook. Low freshness score significantly impacts confidence.\",\n      \"signals\": [\n        {\"name\": \"sentiment_score\", \"value\": 0.230},\n        {\"name\": \"news_coverage\", \"value\": 20},\n        {\"name\": \"freshness_score\", \"value\": 0.0},\n        {\"name\": \"consistency\", \"value\": 0.521},\n        {\"name\": \"credibility\", \"value\": 0.657},\n        {\"name\": \"coverage_norm\", \"value\": 0.774},\n        {\"name\": \"market_mood_factor\", \"value\": 1.0},\n        {\"name\": \"social_volume\", \"value\": 96307},\n        {\"name\": \"galaxyscore\", \"value\": 44.5},\n        {\"name\": \"social_engagement\", \"value\": 0.73}\n      ],\n      \"evidence\": [\n        {\"kind\": \"news\", \"source\": \"various\", \"url\": \"N/A\", \"publishedAt\": \"N/A\", \"snippet\": \"Multiple news articles report on ETH price fluctuations and institutional investments, with mixed sentiment.\"},\n        {\"kind\": \"index\", \"name\": \"fear_greed\", \"value\": 51, \"observedAt\": \"N/A\"},\n        {\"kind\": \"social\", \"source\": \"signals\", \"metric\": \"galaxyscore\", \"value\": 44.5, \"observedAt\": \"N/A\"}\n      ],\n      \"riskFlags\": [\"low_freshness\", \"inconsistent_sentiment\"]\n    }\n  ]\n}\n```\n\n\nTECHNICAL ANALYSIS:\n\nBTC shows a neutral RSI at 34.05, indicating neither oversold nor overbought conditions.  The MACD is bearish at -575.11, suggesting downward momentum. However, the Stochastic oscillator at 10.37 and Williams %R at -88.84 suggest oversold conditions and potential for a bullish reversal. Volatility is low at 0.205, indicating relatively smaller price swings. The signal strength is 0.421, indicating a moderately bullish signal. Overall, the technical picture is mixed, with bearish MACD but bullish Stochastic and Williams %R, suggesting a potential short-term bullish reversal within a broader bearish trend.  The Bollinger Bands are also showing a bullish signal as the price is below the lower band.\n\nETH displays a neutral RSI at 36.16, suggesting balanced buying and selling pressure. The MACD is bearish at -47.33, indicating downward momentum. Similar to BTC, the Stochastic oscillator at 10.22 and Williams %R at -82.51 suggest oversold conditions and a potential for bullish reversal. Volatility is low at 0.171. The signal strength is 0.421, mirroring BTC. Overall, the technical indicators for ETH are also mixed, with bearish MACD but bullish Stochastic and Williams %R, suggesting a potential short-term bullish reversal in a bearish trend.  The Bollinger Bands are also showing a bullish signal with the price below the lower band.\n\n\n{\n  \"claims\": [\n    {\n      \"ticker\": \"BTC\",\n      \"agentRole\": \"technical\",\n      \"claim\": \"BUY\",\n      \"confidence\": 0.95,\n      \"direction\": \"bullish\",\n      \"magnitude\": 0.7,\n      \"rationale\": \"Despite a bearish MACD (-575.11), the oversold conditions indicated by the Stochastic (10.37) and Williams %R (-88.84) oscillators, along with a bullish signal from the Bollinger Bands, suggest a potential short-term bullish reversal. The low volatility (0.205) and a signal strength of 0.421 support this BUY recommendation.\",\n      \"signals\": [\n        {\"name\": \"rsi\", \"value\": 34.05},\n        {\"name\": \"macd\", \"value\": -575.11},\n        {\"name\": \"stochastic\", \"value\": 10.37},\n        {\"name\": \"williams_r\", \"value\": -88.84},\n        {\"name\": \"bollinger_bands\", \"value\": -2708.27},\n        {\"name\": \"volatility_30d\", \"value\": 0.205},\n        {\"name\": \"signal_strength\", \"value\": 0.421}\n      ],\n      \"evidence\": [],\n      \"riskFlags\": [\"low_volatility\"]\n    },\n    {\n      \"ticker\": \"ETH\",\n      \"agentRole\": \"technical\",\n      \"claim\": \"BUY\",\n      \"confidence\": 0.95,\n      \"direction\": \"bullish\",\n      \"magnitude\": 0.7,\n      \"rationale\": \"Similar to BTC, ETH shows a bearish MACD (-47.33), but oversold conditions are indicated by the Stochastic (10.22) and Williams %R (-82.51) oscillators, along with a bullish signal from the Bollinger Bands. The low volatility (0.171) and a signal strength of 0.421 support a BUY recommendation. The potential for a short-term bullish reversal is present.\",\n      \"signals\": [\n        {\"name\": \"rsi\", \"value\": 36.16},\n        {\"name\": \"macd\", \"value\": -47.33},\n        {\"name\": \"stochastic\", \"value\": 10.22},\n        {\"name\": \"williams_r\", \"value\": -82.51},\n        {\"name\": \"bollinger_bands\", \"value\": -218.44},\n        {\"name\": \"volatility_30d\", \"value\": 0.171},\n        {\"name\": \"signal_strength\", \"value\": 0.421}\n      ],\n      \"evidence\": [],\n      \"riskFlags\": [\"low_volatility\"]\n    }\n  ]\n}\n\n\n"
      }
    }
  ]
}