{
  "roundId": "ce44ce13-858a-4c2c-aa9d-7fa2c00d1950",
  "date": "8/30/2025, 11:07:45 AM",
  "totalResponses": 3,
  "responses": [
    {
      "timestamp": "2025-08-30T07:06:48.773Z",
      "role": "fundamental",
      "context": {
        "universe": [
          "BTC",
          "ETH"
        ],
        "marketStats": 2,
        "facts": 11,
        "news": 0
      },
      "response": {
        "claims": [
          {
            "id": "BTC_fundamental_1756537524750_0",
            "ticker": "BTC",
            "agentRole": "fundamental",
            "claim": "BUY",
            "confidence": 0.984,
            "evidence": [
              null,
              null,
              null
            ],
            "timestamp": 1756537524750,
            "riskFlags": []
          },
          {
            "id": "ETH_fundamental_1756537524750_1",
            "ticker": "ETH",
            "agentRole": "fundamental",
            "claim": "HOLD",
            "confidence": 0.996,
            "evidence": [
              null,
              null,
              null
            ],
            "timestamp": 1756537524750,
            "riskFlags": []
          }
        ],
        "textPart": "FUNDAMENTAL ANALYSIS:\nBTC demonstrates strong liquidity with an excellent liquidity score of 0.984 and a substantial trading volume of approximately $2.56 billion. This high liquidity indicates stable pricing and lower spreads, which are favorable for investors. On-chain health is also robust, with a score of 0.699, reflecting healthy network activity and address growth, as evidenced by a perfect score of 1.000 in address growth and UTXO health. Social engagement is high, with a sentiment score of 0.795 and maximum scores in social volume and engagement, indicating a vibrant community. Market cap health is exceptional at 1.000, suggesting strong institutional interest and effective supply utilization. However, there are risk factors to consider, as indicated by a high-risk status and a correlation factor of 0.800, which could imply potential volatility in market conditions.\n\nETH shows excellent liquidity with a liquidity score of 0.996 and a trading volume of approximately $3.13 billion, which also indicates stable pricing. However, its on-chain health is moderate at 0.380, with concerns regarding UTXO health and network security, both scoring 0.000. Social engagement is strong, with a sentiment score of 0.797 and high scores in social volume and engagement, reflecting a healthy community. However, market cap health is concerning at 0.523, suggesting weaker institutional interest and potential inefficiencies in supply utilization. Risk factors are notable, with a profit-taking pressure score of 0.800, indicating a higher likelihood of profit-taking behavior among investors.\n\nOverall, BTC presents a stronger fundamental profile compared to ETH, with better liquidity, on-chain health, and market cap efficiency, despite both assets facing high-risk factors.\n\n{\n  \"claims\": [\n    {\n      \"ticker\": \"BTC\",\n      \"agentRole\": \"fundamental\",\n      \"claim\": \"BUY\",\n      \"confidence\": 0.85,\n      \"direction\": \"bullish\",\n      \"magnitude\": 0.7,\n      \"rationale\": \"BTC shows strong fundamentals with excellent liquidity, robust on-chain health, and high social engagement, making it a strong buy.\",\n      \"signals\": [\n        {\"name\": \"liquidity_score\", \"value\": 0.984},\n        {\"name\": \"on_chain_health\", \"value\": 0.699},\n        {\"name\": \"social_sentiment\", \"value\": 0.795},\n        {\"name\": \"market_cap_health\", \"value\": 1.000},\n        {\"name\": \"risk_adjustment\", \"value\": 0.609}\n      ],\n      \"evidence\": [\"REAL_EVIDENCE_ID_1\", \"REAL_EVIDENCE_ID_2\"],\n      \"riskFlags\": [\"high_volatility\"]\n    },\n    {\n      \"ticker\": \"ETH\",\n      \"agentRole\": \"fundamental\",\n      \"claim\": \"HOLD\",\n      \"confidence\": 0.55,\n      \"direction\": \"neutral\",\n      \"magnitude\": 0.5,\n      \"rationale\": \"ETH has good liquidity and social engagement but suffers from moderate on-chain health and low market cap efficiency, warranting a hold.\",\n      \"signals\": [\n        {\"name\": \"liquidity_score\", \"value\": 0.996},\n        {\"name\": \"on_chain_health\", \"value\": 0.380},\n        {\"name\": \"social_sentiment\", \"value\": 0.797},\n        {\"name\": \"market_cap_health\", \"value\": 0.523},\n        {\"name\": \"risk_adjustment\", \"value\": 0.687}\n      ],\n      \"evidence\": [\"REAL_EVIDENCE_ID_3\", \"REAL_EVIDENCE_ID_4\"],\n      \"riskFlags\": [\"high_profit_taking_pressure\"]\n    }\n  ]\n}",
        "jsonPart": {
          "claims": []
        },
        "openaiResponse": "FUNDAMENTAL ANALYSIS:\nBTC demonstrates strong liquidity with an excellent liquidity score of 0.984 and a substantial trading volume of approximately $2.56 billion. This high liquidity indicates stable pricing and lower spreads, which are favorable for investors. On-chain health is also robust, with a score of 0.699, reflecting healthy network activity and address growth, as evidenced by a perfect score of 1.000 in address growth and UTXO health. Social engagement is high, with a sentiment score of 0.795 and maximum scores in social volume and engagement, indicating a vibrant community. Market cap health is exceptional at 1.000, suggesting strong institutional interest and effective supply utilization. However, there are risk factors to consider, as indicated by a high-risk status and a correlation factor of 0.800, which could imply potential volatility in market conditions.\n\nETH shows excellent liquidity with a liquidity score of 0.996 and a trading volume of approximately $3.13 billion, which also indicates stable pricing. However, its on-chain health is moderate at 0.380, with concerns regarding UTXO health and network security, both scoring 0.000. Social engagement is strong, with a sentiment score of 0.797 and high scores in social volume and engagement, reflecting a healthy community. However, market cap health is concerning at 0.523, suggesting weaker institutional interest and potential inefficiencies in supply utilization. Risk factors are notable, with a profit-taking pressure score of 0.800, indicating a higher likelihood of profit-taking behavior among investors.\n\nOverall, BTC presents a stronger fundamental profile compared to ETH, with better liquidity, on-chain health, and market cap efficiency, despite both assets facing high-risk factors.\n\n{\n  \"claims\": [\n    {\n      \"ticker\": \"BTC\",\n      \"agentRole\": \"fundamental\",\n      \"claim\": \"BUY\",\n      \"confidence\": 0.85,\n      \"direction\": \"bullish\",\n      \"magnitude\": 0.7,\n      \"rationale\": \"BTC shows strong fundamentals with excellent liquidity, robust on-chain health, and high social engagement, making it a strong buy.\",\n      \"signals\": [\n        {\"name\": \"liquidity_score\", \"value\": 0.984},\n        {\"name\": \"on_chain_health\", \"value\": 0.699},\n        {\"name\": \"social_sentiment\", \"value\": 0.795},\n        {\"name\": \"market_cap_health\", \"value\": 1.000},\n        {\"name\": \"risk_adjustment\", \"value\": 0.609}\n      ],\n      \"evidence\": [\"REAL_EVIDENCE_ID_1\", \"REAL_EVIDENCE_ID_2\"],\n      \"riskFlags\": [\"high_volatility\"]\n    },\n    {\n      \"ticker\": \"ETH\",\n      \"agentRole\": \"fundamental\",\n      \"claim\": \"HOLD\",\n      \"confidence\": 0.55,\n      \"direction\": \"neutral\",\n      \"magnitude\": 0.5,\n      \"rationale\": \"ETH has good liquidity and social engagement but suffers from moderate on-chain health and low market cap efficiency, warranting a hold.\",\n      \"signals\": [\n        {\"name\": \"liquidity_score\", \"value\": 0.996},\n        {\"name\": \"on_chain_health\", \"value\": 0.380},\n        {\"name\": \"social_sentiment\", \"value\": 0.797},\n        {\"name\": \"market_cap_health\", \"value\": 0.523},\n        {\"name\": \"risk_adjustment\", \"value\": 0.687}\n      ],\n      \"evidence\": [\"REAL_EVIDENCE_ID_3\", \"REAL_EVIDENCE_ID_4\"],\n      \"riskFlags\": [\"high_profit_taking_pressure\"]\n    }\n  ]\n}",
        "systemPrompt": "",
        "userPrompt": ""
      }
    },
    {
      "timestamp": "2025-08-30T07:07:04.749Z",
      "role": "sentiment",
      "context": {
        "universe": [
          "BTC",
          "ETH"
        ],
        "marketStats": 2,
        "facts": 11,
        "news": 0
      },
      "response": {
        "claims": [],
        "textPart": "{\n  \"claims\": [\n    {\n      \"ticker\": \"BTC\",\n      \"agentRole\": \"sentiment\",\n      \"claim\": \"HOLD\",\n      \"confidence\": 0.3,\n      \"direction\": \"neutral\",\n      \"magnitude\": 0.5,\n      \"rationale\": \"Mixed sentiment from news articles with a significant number of articles but low freshness and moderate social engagement.\",\n      \"signals\": [\n        {\"name\": \"sentiment_score\", \"value\": 0.223},\n        {\"name\": \"news_coverage\", \"value\": 20},\n        {\"name\": \"freshness_score\", \"value\": 0.0},\n        {\"name\": \"consistency\", \"value\": 0.544},\n        {\"name\": \"credibility\", \"value\": 0.655},\n        {\"name\": \"coverage_norm\", \"value\": 0.774},\n        {\"name\": \"market_mood_factor\", \"value\": 1.0},\n        {\"name\": \"social_volume\", \"value\": 0.45},\n        {\"name\": \"galaxyscore\", \"value\": 36},\n        {\"name\": \"social_engagement\", \"value\": 0.73}\n      ],\n      \"evidence\": [\n        {\"kind\": \"news\", \"source\": \"various\", \"url\": \"https:\n        {\"kind\": \"social\", \"source\": \"signals\", \"metric\": \"galaxyscore\", \"value\": 36, \"observedAt\": \"2024-01-01T00:00:00Z\"}\n      ],\n      \"riskFlags\": [\"old_news\", \"low_social_engagement\"]\n    },\n    {\n      \"ticker\": \"ETH\",\n      \"agentRole\": \"sentiment\",\n      \"claim\": \"HOLD\",\n      \"confidence\": 0.3,\n      \"direction\": \"neutral\",\n      \"magnitude\": 0.5,\n      \"rationale\": \"Similar to BTC, ETH shows mixed sentiment with a good number of articles but low freshness and moderate social engagement.\",\n      \"signals\": [\n        {\"name\": \"sentiment_score\", \"value\": 0.228},\n        {\"name\": \"news_coverage\", \"value\": 20},\n        {\"name\": \"freshness_score\", \"value\": 0.0},\n        {\"name\": \"consistency\", \"value\": 0.516},\n        {\"name\": \"credibility\", \"value\": 0.667},\n        {\"name\": \"coverage_norm\", \"value\": 0.774},\n        {\"name\": \"market_mood_factor\", \"value\": 1.0},\n        {\"name\": \"social_volume\", \"value\": 0.45},\n        {\"name\": \"galaxyscore\", \"value\": 53.7},\n        {\"name\": \"social_engagement\", \"value\": 0.73}\n      ],\n      \"evidence\": [\n        {\"kind\": \"news\", \"source\": \"various\", \"url\": \"https:\n        {\"kind\": \"social\", \"source\": \"signals\", \"metric\": \"galaxyscore\", \"value\": 53.7, \"observedAt\": \"2024-01-01T00:00:00Z\"}\n      ],\n      \"riskFlags\": [\"old_news\", \"low_social_engagement\"]\n    }\n  ]\n}",
        "jsonPart": {
          "claims": []
        },
        "openaiResponse": "{\n  \"claims\": [\n    {\n      \"ticker\": \"BTC\",\n      \"agentRole\": \"sentiment\",\n      \"claim\": \"HOLD\",\n      \"confidence\": 0.3,\n      \"direction\": \"neutral\",\n      \"magnitude\": 0.5,\n      \"rationale\": \"Mixed sentiment from news articles with a significant number of articles but low freshness and moderate social engagement.\",\n      \"signals\": [\n        {\"name\": \"sentiment_score\", \"value\": 0.223},\n        {\"name\": \"news_coverage\", \"value\": 20},\n        {\"name\": \"freshness_score\", \"value\": 0.0},\n        {\"name\": \"consistency\", \"value\": 0.544},\n        {\"name\": \"credibility\", \"value\": 0.655},\n        {\"name\": \"coverage_norm\", \"value\": 0.774},\n        {\"name\": \"market_mood_factor\", \"value\": 1.0},\n        {\"name\": \"social_volume\", \"value\": 0.45},\n        {\"name\": \"galaxyscore\", \"value\": 36},\n        {\"name\": \"social_engagement\", \"value\": 0.73}\n      ],\n      \"evidence\": [\n        {\"kind\": \"news\", \"source\": \"various\", \"url\": \"https://example.com\", \"publishedAt\": \"2024-01-01T00:00:00Z\", \"snippet\": \"PCE Data at 2.6% Boosts BTC Price...\"},\n        {\"kind\": \"social\", \"source\": \"signals\", \"metric\": \"galaxyscore\", \"value\": 36, \"observedAt\": \"2024-01-01T00:00:00Z\"}\n      ],\n      \"riskFlags\": [\"old_news\", \"low_social_engagement\"]\n    },\n    {\n      \"ticker\": \"ETH\",\n      \"agentRole\": \"sentiment\",\n      \"claim\": \"HOLD\",\n      \"confidence\": 0.3,\n      \"direction\": \"neutral\",\n      \"magnitude\": 0.5,\n      \"rationale\": \"Similar to BTC, ETH shows mixed sentiment with a good number of articles but low freshness and moderate social engagement.\",\n      \"signals\": [\n        {\"name\": \"sentiment_score\", \"value\": 0.228},\n        {\"name\": \"news_coverage\", \"value\": 20},\n        {\"name\": \"freshness_score\", \"value\": 0.0},\n        {\"name\": \"consistency\", \"value\": 0.516},\n        {\"name\": \"credibility\", \"value\": 0.667},\n        {\"name\": \"coverage_norm\", \"value\": 0.774},\n        {\"name\": \"market_mood_factor\", \"value\": 1.0},\n        {\"name\": \"social_volume\", \"value\": 0.45},\n        {\"name\": \"galaxyscore\", \"value\": 53.7},\n        {\"name\": \"social_engagement\", \"value\": 0.73}\n      ],\n      \"evidence\": [\n        {\"kind\": \"news\", \"source\": \"various\", \"url\": \"https://example.com\", \"publishedAt\": \"2024-01-01T00:00:00Z\", \"snippet\": \"Ethereum Foundation Launches Major UX Overhaul...\"},\n        {\"kind\": \"social\", \"source\": \"signals\", \"metric\": \"galaxyscore\", \"value\": 53.7, \"observedAt\": \"2024-01-01T00:00:00Z\"}\n      ],\n      \"riskFlags\": [\"old_news\", \"low_social_engagement\"]\n    }\n  ]\n}",
        "systemPrompt": "",
        "userPrompt": ""
      }
    },
    {
      "timestamp": "2025-08-30T07:07:24.103Z",
      "role": "technical",
      "context": {
        "universe": [
          "BTC",
          "ETH"
        ],
        "marketStats": 2,
        "facts": 11,
        "news": 0
      },
      "response": {
        "claims": [
          {
            "id": "ETH_technical_1756537524750_0",
            "ticker": "ETH",
            "agentRole": "technical",
            "claim": "BUY",
            "confidence": 1,
            "evidence": [
              null,
              null,
              null
            ],
            "timestamp": 1756537524750,
            "riskFlags": []
          }
        ],
        "textPart": "TECHNICAL ANALYSIS:\nBTC shows a neutral RSI at 33.18, indicating it is approaching oversold conditions but not yet extreme. The MACD is bearish at -1042.01, suggesting downward momentum. The Stochastic indicator is at 15.03, indicating oversold conditions, which is a bullish signal. The Bollinger Bands are also indicating a bullish signal as the price is near the lower band. Volatility is moderate at 0.27, which suggests potential for significant moves. The signal strength is slightly negative at -0.059, indicating weak technical momentum. Overall, the technical picture for BTC is mixed with bearish MACD but bullish signals from Stochastic and Bollinger Bands.\n\nETH displays a neutral RSI at 43.91, suggesting balanced buying and selling pressure. The MACD is bearish at -55.11, indicating downward momentum. The Stochastic is at 29.20, which is neutral, indicating no strong buying or selling pressure. The Bollinger Bands show a bullish signal as well, but the overall trend is neutral. Volatility is low at 0.22, indicating less potential for large moves. The signal strength is neutral at 0.00, indicating no clear momentum. The technical indicators suggest a cautious approach with mixed signals for ETH.\n\nBased on the analysis, here are the claims:\n\n{\n  \"claims\": [\n    {\n      \"ticker\": \"BTC\",\n      \"agentRole\": \"technical\",\n      \"claim\": \"HOLD\",\n      \"confidence\": 0.72,\n      \"direction\": \"neutral\",\n      \"magnitude\": 0.5,\n      \"rationale\": \"Mixed signals with bearish MACD and bullish Stochastic suggest caution.\",\n      \"signals\": [\n        {\"name\": \"rsi\", \"value\": 33.18},\n        {\"name\": \"macd\", \"value\": -1042.01},\n        {\"name\": \"volatility_30d\", \"value\": 0.27},\n        {\"name\": \"signal_strength\", \"value\": -0.059}\n      ],\n      \"evidence\": [\"REAL_EVIDENCE_ID_1\", \"REAL_EVIDENCE_ID_2\"],\n      \"riskFlags\": [\"moderate_volatility\", \"mixed_signals\"]\n    },\n    {\n      \"ticker\": \"ETH\",\n      \"agentRole\": \"technical\",\n      \"claim\": \"HOLD\",\n      \"confidence\": 0.20,\n      \"direction\": \"neutral\",\n      \"magnitude\": 0.3,\n      \"rationale\": \"Insufficient alignment among indicators and low volatility suggest holding position.\",\n      \"signals\": [\n        {\"name\": \"rsi\", \"value\": 43.91},\n        {\"name\": \"macd\", \"value\": -55.11},\n        {\"name\": \"volatility_30d\", \"value\": 0.22},\n        {\"name\": \"signal_strength\", \"value\": 0.00}\n      ],\n      \"evidence\": [\"REAL_EVIDENCE_ID_3\", \"REAL_EVIDENCE_ID_4\"],\n      \"riskFlags\": [\"low_volatility\", \"neutral_signals\"]\n    }\n  ]\n}\n",
        "jsonPart": {
          "claims": []
        },
        "openaiResponse": "TECHNICAL ANALYSIS:\nBTC shows a neutral RSI at 33.18, indicating it is approaching oversold conditions but not yet extreme. The MACD is bearish at -1042.01, suggesting downward momentum. The Stochastic indicator is at 15.03, indicating oversold conditions, which is a bullish signal. The Bollinger Bands are also indicating a bullish signal as the price is near the lower band. Volatility is moderate at 0.27, which suggests potential for significant moves. The signal strength is slightly negative at -0.059, indicating weak technical momentum. Overall, the technical picture for BTC is mixed with bearish MACD but bullish signals from Stochastic and Bollinger Bands.\n\nETH displays a neutral RSI at 43.91, suggesting balanced buying and selling pressure. The MACD is bearish at -55.11, indicating downward momentum. The Stochastic is at 29.20, which is neutral, indicating no strong buying or selling pressure. The Bollinger Bands show a bullish signal as well, but the overall trend is neutral. Volatility is low at 0.22, indicating less potential for large moves. The signal strength is neutral at 0.00, indicating no clear momentum. The technical indicators suggest a cautious approach with mixed signals for ETH.\n\nBased on the analysis, here are the claims:\n\n```json\n{\n  \"claims\": [\n    {\n      \"ticker\": \"BTC\",\n      \"agentRole\": \"technical\",\n      \"claim\": \"HOLD\",\n      \"confidence\": 0.72,\n      \"direction\": \"neutral\",\n      \"magnitude\": 0.5,\n      \"rationale\": \"Mixed signals with bearish MACD and bullish Stochastic suggest caution.\",\n      \"signals\": [\n        {\"name\": \"rsi\", \"value\": 33.18},\n        {\"name\": \"macd\", \"value\": -1042.01},\n        {\"name\": \"volatility_30d\", \"value\": 0.27},\n        {\"name\": \"signal_strength\", \"value\": -0.059}\n      ],\n      \"evidence\": [\"REAL_EVIDENCE_ID_1\", \"REAL_EVIDENCE_ID_2\"],\n      \"riskFlags\": [\"moderate_volatility\", \"mixed_signals\"]\n    },\n    {\n      \"ticker\": \"ETH\",\n      \"agentRole\": \"technical\",\n      \"claim\": \"HOLD\",\n      \"confidence\": 0.20,\n      \"direction\": \"neutral\",\n      \"magnitude\": 0.3,\n      \"rationale\": \"Insufficient alignment among indicators and low volatility suggest holding position.\",\n      \"signals\": [\n        {\"name\": \"rsi\", \"value\": 43.91},\n        {\"name\": \"macd\", \"value\": -55.11},\n        {\"name\": \"volatility_30d\", \"value\": 0.22},\n        {\"name\": \"signal_strength\", \"value\": 0.00}\n      ],\n      \"evidence\": [\"REAL_EVIDENCE_ID_3\", \"REAL_EVIDENCE_ID_4\"],\n      \"riskFlags\": [\"low_volatility\", \"neutral_signals\"]\n    }\n  ]\n}\n```",
        "systemPrompt": "",
        "userPrompt": ""
      }
    }
  ]
}