{
  "roundId": "eba803c3-2f2d-4b45-ba3e-8d9345464723",
  "date": "8/30/2025, 12:16:22 PM",
  "totalResponses": 3,
  "responses": [
    {
      "timestamp": "2025-08-30T08:15:36.416Z",
      "role": "fundamental",
      "context": {
        "universe": [
          "BTC",
          "ETH"
        ],
        "marketStats": 2,
        "facts": 11,
        "news": 0
      },
      "response": {
        "claims": [
          {
            "id": "BTC_fundamental_1756541654380_0",
            "ticker": "BTC",
            "agentRole": "fundamental",
            "claim": "BUY",
            "confidence": 1,
            "evidence": [
              null,
              null,
              null
            ],
            "timestamp": 1756541654380,
            "riskFlags": [
              "high_volatility"
            ],
            "direction": "bullish",
            "magnitude": 0.7,
            "rationale": "BTC demonstrates strong liquidity, robust on-chain activity, and excellent market cap health, making it a solid investment.",
            "signals": [
              {
                "name": "liquidity_score",
                "value": 0.993
              },
              {
                "name": "on_chain_health",
                "value": 0.699
              },
              {
                "name": "social_sentiment",
                "value": 0.8
              },
              {
                "name": "market_cap_health",
                "value": 1
              },
              {
                "name": "risk_adjustment",
                "value": 0.609
              },
              {
                "name": "network_activity",
                "value": 0.777
              },
              {
                "name": "address_growth",
                "value": 1
              },
              {
                "name": "utxo_health",
                "value": 1
              },
              {
                "name": "network_security",
                "value": 1
              },
              {
                "name": "social_volume",
                "value": 1
              },
              {
                "name": "social_engagement",
                "value": 1
              },
              {
                "name": "community_health",
                "value": 0.385
              },
              {
                "name": "drawdown_risk",
                "value": 0.095
              },
              {
                "name": "profit_taking_pressure",
                "value": 0.4
              }
            ]
          },
          {
            "id": "ETH_fundamental_1756541654380_1",
            "ticker": "ETH",
            "agentRole": "fundamental",
            "claim": "HOLD",
            "confidence": 0.563,
            "evidence": [
              null,
              null,
              null
            ],
            "timestamp": 1756541654380,
            "riskFlags": [
              "high_profit_taking_pressure"
            ],
            "direction": "neutral",
            "magnitude": 0.5,
            "rationale": "ETH has excellent liquidity and strong social engagement but suffers from low on-chain health and market cap efficiency.",
            "signals": [
              {
                "name": "liquidity_score",
                "value": 0.997
              },
              {
                "name": "on_chain_health",
                "value": 0.389
              },
              {
                "name": "social_sentiment",
                "value": 0.823
              },
              {
                "name": "market_cap_health",
                "value": 0.523
              },
              {
                "name": "risk_adjustment",
                "value": 0.687
              },
              {
                "name": "network_activity",
                "value": 0.725
              },
              {
                "name": "address_growth",
                "value": 1
              },
              {
                "name": "utxo_health",
                "value": 0
              },
              {
                "name": "network_security",
                "value": 0
              },
              {
                "name": "social_volume",
                "value": 0.938
              },
              {
                "name": "social_engagement",
                "value": 0.932
              },
              {
                "name": "community_health",
                "value": 0.579
              },
              {
                "name": "drawdown_risk",
                "value": 0.089
              },
              {
                "name": "profit_taking_pressure",
                "value": 0.8
              }
            ]
          }
        ],
        "textPart": "FUNDAMENTAL ANALYSIS:\nBTC exhibits strong liquidity with a liquidity score of 0.993, indicating excellent market conditions for trading with low spreads and high volume. The on-chain health is also robust, with a score of 0.699, reflecting healthy network activity and a high address growth score of 1.000, which suggests increasing user engagement. Social engagement is high, with a sentiment score of 0.800 and perfect scores in social volume and engagement, indicating a vibrant community. Market cap health is exceptional at 1.000, suggesting strong institutional interest and efficient supply utilization. However, risk factors are present, with a high-risk status and a profit-taking pressure score of 0.400, indicating potential volatility. Overall, BTC demonstrates solid fundamentals with a good investment thesis.\n\nETH shows excellent liquidity with a liquidity score of 0.997, which is favorable for trading. However, its on-chain health is lower at 0.389, indicating potential concerns regarding network activity and UTXO health, which is at 0.000. Social engagement is strong, with a sentiment score of 0.823 and high scores in social volume and engagement, suggesting a healthy community. However, market cap health is concerning at 0.523, indicating lower institutional interest and efficiency. The risk profile shows a high profit-taking pressure score of 0.800, which could lead to increased volatility. Overall, while ETH has good liquidity and social engagement, its on-chain and market cap health suggest caution.\n\nBased on this analysis, the following claims are made:",
        "jsonPart": {
          "claims": [
            {
              "ticker": "BTC",
              "agentRole": "fundamental",
              "claim": "BUY",
              "confidence": 1,
              "direction": "bullish",
              "magnitude": 0.7,
              "rationale": "BTC demonstrates strong liquidity, robust on-chain activity, and excellent market cap health, making it a solid investment.",
              "signals": [
                {
                  "name": "liquidity_score",
                  "value": 0.993
                },
                {
                  "name": "on_chain_health",
                  "value": 0.699
                },
                {
                  "name": "social_sentiment",
                  "value": 0.8
                },
                {
                  "name": "market_cap_health",
                  "value": 1
                },
                {
                  "name": "risk_adjustment",
                  "value": 0.609
                },
                {
                  "name": "network_activity",
                  "value": 0.777
                },
                {
                  "name": "address_growth",
                  "value": 1
                },
                {
                  "name": "utxo_health",
                  "value": 1
                },
                {
                  "name": "network_security",
                  "value": 1
                },
                {
                  "name": "social_volume",
                  "value": 1
                },
                {
                  "name": "social_engagement",
                  "value": 1
                },
                {
                  "name": "community_health",
                  "value": 0.385
                },
                {
                  "name": "drawdown_risk",
                  "value": 0.095
                },
                {
                  "name": "profit_taking_pressure",
                  "value": 0.4
                }
              ],
              "evidence": [
                "REAL_EVIDENCE_ID_1",
                "REAL_EVIDENCE_ID_2"
              ],
              "riskFlags": [
                "high_volatility"
              ]
            },
            {
              "ticker": "ETH",
              "agentRole": "fundamental",
              "claim": "HOLD",
              "confidence": 0.563,
              "direction": "neutral",
              "magnitude": 0.5,
              "rationale": "ETH has excellent liquidity and strong social engagement but suffers from low on-chain health and market cap efficiency.",
              "signals": [
                {
                  "name": "liquidity_score",
                  "value": 0.997
                },
                {
                  "name": "on_chain_health",
                  "value": 0.389
                },
                {
                  "name": "social_sentiment",
                  "value": 0.823
                },
                {
                  "name": "market_cap_health",
                  "value": 0.523
                },
                {
                  "name": "risk_adjustment",
                  "value": 0.687
                },
                {
                  "name": "network_activity",
                  "value": 0.725
                },
                {
                  "name": "address_growth",
                  "value": 1
                },
                {
                  "name": "utxo_health",
                  "value": 0
                },
                {
                  "name": "network_security",
                  "value": 0
                },
                {
                  "name": "social_volume",
                  "value": 0.938
                },
                {
                  "name": "social_engagement",
                  "value": 0.932
                },
                {
                  "name": "community_health",
                  "value": 0.579
                },
                {
                  "name": "drawdown_risk",
                  "value": 0.089
                },
                {
                  "name": "profit_taking_pressure",
                  "value": 0.8
                }
              ],
              "evidence": [
                "REAL_EVIDENCE_ID_3",
                "REAL_EVIDENCE_ID_4"
              ],
              "riskFlags": [
                "high_profit_taking_pressure"
              ]
            }
          ]
        },
        "openaiResponse": "FUNDAMENTAL ANALYSIS:\nBTC exhibits strong liquidity with a liquidity score of 0.993, indicating excellent market conditions for trading with low spreads and high volume. The on-chain health is also robust, with a score of 0.699, reflecting healthy network activity and a high address growth score of 1.000, which suggests increasing user engagement. Social engagement is high, with a sentiment score of 0.800 and perfect scores in social volume and engagement, indicating a vibrant community. Market cap health is exceptional at 1.000, suggesting strong institutional interest and efficient supply utilization. However, risk factors are present, with a high-risk status and a profit-taking pressure score of 0.400, indicating potential volatility. Overall, BTC demonstrates solid fundamentals with a good investment thesis.\n\nETH shows excellent liquidity with a liquidity score of 0.997, which is favorable for trading. However, its on-chain health is lower at 0.389, indicating potential concerns regarding network activity and UTXO health, which is at 0.000. Social engagement is strong, with a sentiment score of 0.823 and high scores in social volume and engagement, suggesting a healthy community. However, market cap health is concerning at 0.523, indicating lower institutional interest and efficiency. The risk profile shows a high profit-taking pressure score of 0.800, which could lead to increased volatility. Overall, while ETH has good liquidity and social engagement, its on-chain and market cap health suggest caution.\n\nBased on this analysis, the following claims are made:\n\n```json\n{\n  \"claims\": [\n    {\n      \"ticker\": \"BTC\",\n      \"agentRole\": \"fundamental\",\n      \"claim\": \"BUY\",\n      \"confidence\": 1.0,\n      \"direction\": \"bullish\",\n      \"magnitude\": 0.7,\n      \"rationale\": \"BTC demonstrates strong liquidity, robust on-chain activity, and excellent market cap health, making it a solid investment.\",\n      \"signals\": [\n        {\"name\": \"liquidity_score\", \"value\": 0.993},\n        {\"name\": \"on_chain_health\", \"value\": 0.699},\n        {\"name\": \"social_sentiment\", \"value\": 0.800},\n        {\"name\": \"market_cap_health\", \"value\": 1.000},\n        {\"name\": \"risk_adjustment\", \"value\": 0.609},\n        {\"name\": \"network_activity\", \"value\": 0.777},\n        {\"name\": \"address_growth\", \"value\": 1.000},\n        {\"name\": \"utxo_health\", \"value\": 1.000},\n        {\"name\": \"network_security\", \"value\": 1.000},\n        {\"name\": \"social_volume\", \"value\": 1.000},\n        {\"name\": \"social_engagement\", \"value\": 1.000},\n        {\"name\": \"community_health\", \"value\": 0.385},\n        {\"name\": \"drawdown_risk\", \"value\": 0.095},\n        {\"name\": \"profit_taking_pressure\", \"value\": 0.400}\n      ],\n      \"evidence\": [\"REAL_EVIDENCE_ID_1\", \"REAL_EVIDENCE_ID_2\"],\n      \"riskFlags\": [\"high_volatility\"]\n    },\n    {\n      \"ticker\": \"ETH\",\n      \"agentRole\": \"fundamental\",\n      \"claim\": \"HOLD\",\n      \"confidence\": 0.563,\n      \"direction\": \"neutral\",\n      \"magnitude\": 0.5,\n      \"rationale\": \"ETH has excellent liquidity and strong social engagement but suffers from low on-chain health and market cap efficiency.\",\n      \"signals\": [\n        {\"name\": \"liquidity_score\", \"value\": 0.997},\n        {\"name\": \"on_chain_health\", \"value\": 0.389},\n        {\"name\": \"social_sentiment\", \"value\": 0.823},\n        {\"name\": \"market_cap_health\", \"value\": 0.523},\n        {\"name\": \"risk_adjustment\", \"value\": 0.687},\n        {\"name\": \"network_activity\", \"value\": 0.725},\n        {\"name\": \"address_growth\", \"value\": 1.000},\n        {\"name\": \"utxo_health\", \"value\": 0.000},\n        {\"name\": \"network_security\", \"value\": 0.000},\n        {\"name\": \"social_volume\", \"value\": 0.938},\n        {\"name\": \"social_engagement\", \"value\": 0.932},\n        {\"name\": \"community_health\", \"value\": 0.579},\n        {\"name\": \"drawdown_risk\", \"value\": 0.089},\n        {\"name\": \"profit_taking_pressure\", \"value\": 0.800}\n      ],\n      \"evidence\": [\"REAL_EVIDENCE_ID_3\", \"REAL_EVIDENCE_ID_4\"],\n      \"riskFlags\": [\"high_profit_taking_pressure\"]\n    }\n  ]\n}\n```",
        "systemPrompt": "",
        "userPrompt": ""
      }
    },
    {
      "timestamp": "2025-08-30T08:15:50.214Z",
      "role": "sentiment",
      "context": {
        "universe": [
          "BTC",
          "ETH"
        ],
        "marketStats": 2,
        "facts": 11,
        "news": 0
      },
      "response": {
        "claims": [
          {
            "id": "BTC_sentiment_1756541654380_0",
            "ticker": "BTC",
            "agentRole": "sentiment",
            "claim": "HOLD",
            "confidence": 0.3,
            "evidence": [
              null,
              null,
              null
            ],
            "timestamp": 1756541654380,
            "riskFlags": [
              "old_news",
              "low_social_engagement"
            ],
            "direction": "neutral",
            "magnitude": 0.5,
            "rationale": "Mixed sentiment from news articles and low social engagement indicate uncertainty in market emotions.",
            "signals": [
              {
                "name": "sentiment_score",
                "value": 0.226
              },
              {
                "name": "news_coverage",
                "value": 20
              },
              {
                "name": "freshness_score",
                "value": 0
              },
              {
                "name": "consistency",
                "value": 0.544
              },
              {
                "name": "credibility",
                "value": 0.655
              },
              {
                "name": "coverage_norm",
                "value": 0.774
              },
              {
                "name": "market_mood_factor",
                "value": 1
              },
              {
                "name": "social_volume",
                "value": 134897
              },
              {
                "name": "galaxyscore",
                "value": 38.5
              },
              {
                "name": "social_engagement",
                "value": 2308413
              }
            ]
          },
          {
            "id": "ETH_sentiment_1756541654380_1",
            "ticker": "ETH",
            "agentRole": "sentiment",
            "claim": "HOLD",
            "confidence": 0.3,
            "evidence": [
              null,
              null,
              null
            ],
            "timestamp": 1756541654380,
            "riskFlags": [
              "old_news",
              "low_social_engagement"
            ],
            "direction": "neutral",
            "magnitude": 0.5,
            "rationale": "Similar to BTC, ETH shows mixed sentiment with low social engagement, indicating market uncertainty.",
            "signals": [
              {
                "name": "sentiment_score",
                "value": 0.238
              },
              {
                "name": "news_coverage",
                "value": 20
              },
              {
                "name": "freshness_score",
                "value": 0
              },
              {
                "name": "consistency",
                "value": 0.516
              },
              {
                "name": "credibility",
                "value": 0.667
              },
              {
                "name": "coverage_norm",
                "value": 0.774
              },
              {
                "name": "market_mood_factor",
                "value": 1
              },
              {
                "name": "social_volume",
                "value": 93797
              },
              {
                "name": "galaxyscore",
                "value": 57.9
              },
              {
                "name": "social_engagement",
                "value": 931985
              }
            ]
          }
        ],
        "textPart": "No text analysis available",
        "jsonPart": {
          "claims": [
            {
              "ticker": "BTC",
              "agentRole": "sentiment",
              "claim": "HOLD",
              "confidence": 0.3,
              "direction": "neutral",
              "magnitude": 0.5,
              "rationale": "Mixed sentiment from news articles and low social engagement indicate uncertainty in market emotions.",
              "signals": [
                {
                  "name": "sentiment_score",
                  "value": 0.226
                },
                {
                  "name": "news_coverage",
                  "value": 20
                },
                {
                  "name": "freshness_score",
                  "value": 0
                },
                {
                  "name": "consistency",
                  "value": 0.544
                },
                {
                  "name": "credibility",
                  "value": 0.655
                },
                {
                  "name": "coverage_norm",
                  "value": 0.774
                },
                {
                  "name": "market_mood_factor",
                  "value": 1
                },
                {
                  "name": "social_volume",
                  "value": 134897
                },
                {
                  "name": "galaxyscore",
                  "value": 38.5
                },
                {
                  "name": "social_engagement",
                  "value": 2308413
                }
              ],
              "evidence": [
                {
                  "kind": "news",
                  "source": "various",
                  "url": "N/A",
                  "publishedAt": "N/A",
                  "snippet": "Mixed news sentiment with some positive and negative indicators."
                },
                {
                  "kind": "social",
                  "source": "signals",
                  "metric": "galaxyscore",
                  "value": 38.5,
                  "observedAt": "N/A"
                }
              ],
              "riskFlags": [
                "old_news",
                "low_social_engagement"
              ]
            },
            {
              "ticker": "ETH",
              "agentRole": "sentiment",
              "claim": "HOLD",
              "confidence": 0.3,
              "direction": "neutral",
              "magnitude": 0.5,
              "rationale": "Similar to BTC, ETH shows mixed sentiment with low social engagement, indicating market uncertainty.",
              "signals": [
                {
                  "name": "sentiment_score",
                  "value": 0.238
                },
                {
                  "name": "news_coverage",
                  "value": 20
                },
                {
                  "name": "freshness_score",
                  "value": 0
                },
                {
                  "name": "consistency",
                  "value": 0.516
                },
                {
                  "name": "credibility",
                  "value": 0.667
                },
                {
                  "name": "coverage_norm",
                  "value": 0.774
                },
                {
                  "name": "market_mood_factor",
                  "value": 1
                },
                {
                  "name": "social_volume",
                  "value": 93797
                },
                {
                  "name": "galaxyscore",
                  "value": 57.9
                },
                {
                  "name": "social_engagement",
                  "value": 931985
                }
              ],
              "evidence": [
                {
                  "kind": "news",
                  "source": "various",
                  "url": "N/A",
                  "publishedAt": "N/A",
                  "snippet": "Mixed news sentiment with some positive and negative indicators."
                },
                {
                  "kind": "social",
                  "source": "signals",
                  "metric": "galaxyscore",
                  "value": 57.9,
                  "observedAt": "N/A"
                }
              ],
              "riskFlags": [
                "old_news",
                "low_social_engagement"
              ]
            }
          ]
        },
        "openaiResponse": "{\n  \"claims\": [\n    {\n      \"ticker\": \"BTC\",\n      \"agentRole\": \"sentiment\",\n      \"claim\": \"HOLD\",\n      \"confidence\": 0.3,\n      \"direction\": \"neutral\",\n      \"magnitude\": 0.5,\n      \"rationale\": \"Mixed sentiment from news articles and low social engagement indicate uncertainty in market emotions.\",\n      \"signals\": [\n        {\"name\": \"sentiment_score\", \"value\": 0.226},\n        {\"name\": \"news_coverage\", \"value\": 20},\n        {\"name\": \"freshness_score\", \"value\": 0.0},\n        {\"name\": \"consistency\", \"value\": 0.544},\n        {\"name\": \"credibility\", \"value\": 0.655},\n        {\"name\": \"coverage_norm\", \"value\": 0.774},\n        {\"name\": \"market_mood_factor\", \"value\": 1.0},\n        {\"name\": \"social_volume\", \"value\": 134897},\n        {\"name\": \"galaxyscore\", \"value\": 38.5},\n        {\"name\": \"social_engagement\", \"value\": 2308413}\n      ],\n      \"evidence\": [\n        {\"kind\": \"news\", \"source\": \"various\", \"url\": \"N/A\", \"publishedAt\": \"N/A\", \"snippet\": \"Mixed news sentiment with some positive and negative indicators.\"},\n        {\"kind\": \"social\", \"source\": \"signals\", \"metric\": \"galaxyscore\", \"value\": 38.5, \"observedAt\": \"N/A\"}\n      ],\n      \"riskFlags\": [\"old_news\", \"low_social_engagement\"]\n    },\n    {\n      \"ticker\": \"ETH\",\n      \"agentRole\": \"sentiment\",\n      \"claim\": \"HOLD\",\n      \"confidence\": 0.3,\n      \"direction\": \"neutral\",\n      \"magnitude\": 0.5,\n      \"rationale\": \"Similar to BTC, ETH shows mixed sentiment with low social engagement, indicating market uncertainty.\",\n      \"signals\": [\n        {\"name\": \"sentiment_score\", \"value\": 0.238},\n        {\"name\": \"news_coverage\", \"value\": 20},\n        {\"name\": \"freshness_score\", \"value\": 0.0},\n        {\"name\": \"consistency\", \"value\": 0.516},\n        {\"name\": \"credibility\", \"value\": 0.667},\n        {\"name\": \"coverage_norm\", \"value\": 0.774},\n        {\"name\": \"market_mood_factor\", \"value\": 1.0},\n        {\"name\": \"social_volume\", \"value\": 93797},\n        {\"name\": \"galaxyscore\", \"value\": 57.9},\n        {\"name\": \"social_engagement\", \"value\": 931985}\n      ],\n      \"evidence\": [\n        {\"kind\": \"news\", \"source\": \"various\", \"url\": \"N/A\", \"publishedAt\": \"N/A\", \"snippet\": \"Mixed news sentiment with some positive and negative indicators.\"},\n        {\"kind\": \"social\", \"source\": \"signals\", \"metric\": \"galaxyscore\", \"value\": 57.9, \"observedAt\": \"N/A\"}\n      ],\n      \"riskFlags\": [\"old_news\", \"low_social_engagement\"]\n    }\n  ]\n}",
        "systemPrompt": "",
        "userPrompt": ""
      }
    },
    {
      "timestamp": "2025-08-30T08:16:04.883Z",
      "role": "technical",
      "context": {
        "universe": [
          "BTC",
          "ETH"
        ],
        "marketStats": 2,
        "facts": 11,
        "news": 0
      },
      "response": {
        "claims": [
          {
            "id": "BTC_technical_1756541654380_0",
            "ticker": "BTC",
            "agentRole": "technical",
            "claim": "HOLD",
            "confidence": 0.72,
            "evidence": [
              null,
              null,
              null
            ],
            "timestamp": 1756541654380,
            "riskFlags": [
              "bearish_trend",
              "weak_signals"
            ],
            "direction": "neutral",
            "magnitude": 0.5,
            "rationale": "BTC shows mixed signals with bearish MACD and potential oversold conditions from Stochastic. The overall trend is bearish, suggesting a cautious approach.",
            "signals": [
              {
                "name": "rsi",
                "value": 35.97
              },
              {
                "name": "macd",
                "value": -1028.12
              },
              {
                "name": "stochastic",
                "value": 18.87
              },
              {
                "name": "volatility_30d",
                "value": 0.283
              },
              {
                "name": "signal_strength",
                "value": -0.176
              }
            ]
          },
          {
            "id": "ETH_technical_1756541654380_1",
            "ticker": "ETH",
            "agentRole": "technical",
            "claim": "HOLD",
            "confidence": 0.2,
            "evidence": [
              null,
              null,
              null
            ],
            "timestamp": 1756541654380,
            "riskFlags": [
              "bearish_trend",
              "neutral_signals"
            ],
            "direction": "neutral",
            "magnitude": 0.5,
            "rationale": "ETH shows bearish momentum with MACD and neutral signals across other indicators. The lack of strong technical momentum suggests a HOLD.",
            "signals": [
              {
                "name": "rsi",
                "value": 43.62
              },
              {
                "name": "macd",
                "value": -52.28
              },
              {
                "name": "stochastic",
                "value": 33.31
              },
              {
                "name": "volatility_30d",
                "value": 0.225
              },
              {
                "name": "signal_strength",
                "value": 0
              }
            ]
          }
        ],
        "textPart": "TECHNICAL ANALYSIS:\nBTC shows a neutral RSI at 35.97, indicating that it is neither in an oversold nor overbought condition. The MACD is bearish at -1028.12, suggesting downward momentum in the price. The Stochastic indicator is at 18.87, indicating oversold conditions, which could suggest a potential buying opportunity. However, the overall trend is bearish with a moderate volatility of 0.283, which indicates potential for significant price movements. The signal strength is negative at -0.176, indicating weak technical momentum. Overall, the technical picture for BTC is mixed, with bearish momentum from MACD but a potential buying signal from the Stochastic.\n\nETH displays a neutral RSI at 43.62, suggesting balanced buying and selling pressure. The MACD is also bearish at -52.28, indicating downward momentum. The Stochastic indicator is at 33.31, which is neutral, suggesting no immediate buying or selling pressure. Volatility is low at 0.225, indicating less potential for significant price movements. The signal strength is neutral at 0, indicating a lack of strong technical momentum. Overall, the technical indicators suggest a cautious approach for ETH, with bearish MACD but neutral momentum signals.\n\nBased on the analysis, here are the claims:",
        "jsonPart": {
          "claims": [
            {
              "ticker": "BTC",
              "agentRole": "technical",
              "claim": "HOLD",
              "confidence": 0.72,
              "direction": "neutral",
              "magnitude": 0.5,
              "rationale": "BTC shows mixed signals with bearish MACD and potential oversold conditions from Stochastic. The overall trend is bearish, suggesting a cautious approach.",
              "signals": [
                {
                  "name": "rsi",
                  "value": 35.97
                },
                {
                  "name": "macd",
                  "value": -1028.12
                },
                {
                  "name": "stochastic",
                  "value": 18.87
                },
                {
                  "name": "volatility_30d",
                  "value": 0.283
                },
                {
                  "name": "signal_strength",
                  "value": -0.176
                }
              ],
              "evidence": [
                "REAL_EVIDENCE_ID_1",
                "REAL_EVIDENCE_ID_2"
              ],
              "riskFlags": [
                "bearish_trend",
                "weak_signals"
              ]
            },
            {
              "ticker": "ETH",
              "agentRole": "technical",
              "claim": "HOLD",
              "confidence": 0.2,
              "direction": "neutral",
              "magnitude": 0.5,
              "rationale": "ETH shows bearish momentum with MACD and neutral signals across other indicators. The lack of strong technical momentum suggests a HOLD.",
              "signals": [
                {
                  "name": "rsi",
                  "value": 43.62
                },
                {
                  "name": "macd",
                  "value": -52.28
                },
                {
                  "name": "stochastic",
                  "value": 33.31
                },
                {
                  "name": "volatility_30d",
                  "value": 0.225
                },
                {
                  "name": "signal_strength",
                  "value": 0
                }
              ],
              "evidence": [
                "REAL_EVIDENCE_ID_3",
                "REAL_EVIDENCE_ID_4"
              ],
              "riskFlags": [
                "bearish_trend",
                "neutral_signals"
              ]
            }
          ]
        },
        "openaiResponse": "TECHNICAL ANALYSIS:\nBTC shows a neutral RSI at 35.97, indicating that it is neither in an oversold nor overbought condition. The MACD is bearish at -1028.12, suggesting downward momentum in the price. The Stochastic indicator is at 18.87, indicating oversold conditions, which could suggest a potential buying opportunity. However, the overall trend is bearish with a moderate volatility of 0.283, which indicates potential for significant price movements. The signal strength is negative at -0.176, indicating weak technical momentum. Overall, the technical picture for BTC is mixed, with bearish momentum from MACD but a potential buying signal from the Stochastic.\n\nETH displays a neutral RSI at 43.62, suggesting balanced buying and selling pressure. The MACD is also bearish at -52.28, indicating downward momentum. The Stochastic indicator is at 33.31, which is neutral, suggesting no immediate buying or selling pressure. Volatility is low at 0.225, indicating less potential for significant price movements. The signal strength is neutral at 0, indicating a lack of strong technical momentum. Overall, the technical indicators suggest a cautious approach for ETH, with bearish MACD but neutral momentum signals.\n\nBased on the analysis, here are the claims:\n\n```json\n{\n  \"claims\": [\n    {\n      \"ticker\": \"BTC\",\n      \"agentRole\": \"technical\",\n      \"claim\": \"HOLD\",\n      \"confidence\": 0.72,\n      \"direction\": \"neutral\",\n      \"magnitude\": 0.5,\n      \"rationale\": \"BTC shows mixed signals with bearish MACD and potential oversold conditions from Stochastic. The overall trend is bearish, suggesting a cautious approach.\",\n      \"signals\": [\n        {\"name\": \"rsi\", \"value\": 35.97},\n        {\"name\": \"macd\", \"value\": -1028.12},\n        {\"name\": \"stochastic\", \"value\": 18.87},\n        {\"name\": \"volatility_30d\", \"value\": 0.283},\n        {\"name\": \"signal_strength\", \"value\": -0.176}\n      ],\n      \"evidence\": [\"REAL_EVIDENCE_ID_1\", \"REAL_EVIDENCE_ID_2\"],\n      \"riskFlags\": [\"bearish_trend\", \"weak_signals\"]\n    },\n    {\n      \"ticker\": \"ETH\",\n      \"agentRole\": \"technical\",\n      \"claim\": \"HOLD\",\n      \"confidence\": 0.2,\n      \"direction\": \"neutral\",\n      \"magnitude\": 0.5,\n      \"rationale\": \"ETH shows bearish momentum with MACD and neutral signals across other indicators. The lack of strong technical momentum suggests a HOLD.\",\n      \"signals\": [\n        {\"name\": \"rsi\", \"value\": 43.62},\n        {\"name\": \"macd\", \"value\": -52.28},\n        {\"name\": \"stochastic\", \"value\": 33.31},\n        {\"name\": \"volatility_30d\", \"value\": 0.225},\n        {\"name\": \"signal_strength\", \"value\": 0}\n      ],\n      \"evidence\": [\"REAL_EVIDENCE_ID_3\", \"REAL_EVIDENCE_ID_4\"],\n      \"riskFlags\": [\"bearish_trend\", \"neutral_signals\"]\n    }\n  ]\n}\n```",
        "systemPrompt": "",
        "userPrompt": ""
      }
    }
  ]
}