{
  "roundId": "d64fa98c-19d1-470b-969c-e3e1faf5392f",
  "date": "8/30/2025, 10:56:46 AM",
  "totalResponses": 3,
  "responses": [
    {
      "timestamp": "2025-08-30T06:55:50.858Z",
      "role": "fundamental",
      "context": {
        "universe": [
          "BTC",
          "ETH"
        ],
        "marketStats": 2,
        "facts": 11,
        "news": 0
      },
      "response": {
        "claims": [
          {
            "id": "BTC_fundamental_1756536868172_0",
            "ticker": "BTC",
            "agentRole": "fundamental",
            "claim": "HOLD",
            "confidence": 0.75,
            "evidence": [
              "BTC_market_1756536950858",
              "BTC_market_1756536950858",
              "BTC_market_1756536950858"
            ],
            "timestamp": 1756536868172,
            "riskFlags": [
              "high_risk"
            ],
            "direction": "neutral",
            "magnitude": 0.5,
            "rationale": "BTC has good fundamentals with strong market cap health and decent on-chain activity, but liquidity is moderate and community health is low.",
            "signals": [
              {
                "name": "liquidity_score",
                "value": 0.593
              },
              {
                "name": "on_chain_health",
                "value": 0.699
              },
              {
                "name": "social_sentiment",
                "value": 0.795
              },
              {
                "name": "market_cap_health",
                "value": 1
              },
              {
                "name": "risk_adjustment",
                "value": 0.609
              },
              {
                "name": "network_activity",
                "value": 0.777
              },
              {
                "name": "address_growth",
                "value": 1
              },
              {
                "name": "community_health",
                "value": 0.36
              },
              {
                "name": "drawdown_risk",
                "value": 0.095
              },
              {
                "name": "profit_taking_pressure",
                "value": 0.4
              }
            ]
          },
          {
            "id": "ETH_fundamental_1756536868172_1",
            "ticker": "ETH",
            "agentRole": "fundamental",
            "claim": "HOLD",
            "confidence": 0.65,
            "evidence": [
              "ETH_market_1756536950858",
              "ETH_market_1756536950858",
              "ETH_market_1756536950858"
            ],
            "timestamp": 1756536868172,
            "riskFlags": [
              "high_profit_taking_pressure"
            ],
            "direction": "neutral",
            "magnitude": 0.5,
            "rationale": "ETH shows excellent liquidity and strong social engagement, but faces challenges with on-chain health and market cap efficiency.",
            "signals": [
              {
                "name": "liquidity_score",
                "value": 0.885
              },
              {
                "name": "on_chain_health",
                "value": 0.389
              },
              {
                "name": "social_sentiment",
                "value": 0.797
              },
              {
                "name": "market_cap_health",
                "value": 0.523
              },
              {
                "name": "risk_adjustment",
                "value": 0.687
              },
              {
                "name": "network_activity",
                "value": 0.725
              },
              {
                "name": "address_growth",
                "value": 1
              },
              {
                "name": "community_health",
                "value": 0.537
              },
              {
                "name": "drawdown_risk",
                "value": 0.089
              },
              {
                "name": "profit_taking_pressure",
                "value": 0.8
              }
            ]
          }
        ],
        "textPart": "FUNDAMENTAL ANALYSIS:\nBTC demonstrates a solid fundamental score of 0.744, indicating good overall health. The liquidity score is moderate at 0.593, suggesting that while there is decent trading volume, it may not be sufficient to ensure optimal liquidity conditions. On-chain health is relatively strong at 0.699, reflecting healthy network activity and address growth, which is crucial for long-term sustainability. Social sentiment is high at 0.795, indicating positive community engagement, although community health is lower at 0.360, which could suggest some areas for improvement. Market cap health is excellent at 1.000, indicating strong institutional interest and efficient supply utilization. The risk profile shows some concerns with a high risk status, but the low drawdown risk (0.095) and moderate profit-taking pressure (0.400) suggest that the asset is currently stable.\n\nETH has a fundamental score of 0.683, which is slightly lower than BTC, indicating moderate overall health. The liquidity score is strong at 0.885, reflecting excellent trading volume and liquidity conditions. However, on-chain health is concerning at 0.389, which indicates lower network activity and potential issues with UTXO health and network security. Social sentiment is high at 0.797, and social engagement is strong at 0.864, showcasing a vibrant community. However, market cap health is weak at 0.523, suggesting potential inefficiencies or reduced institutional interest. The risk profile shows a moderate drawdown risk (0.089) but high profit-taking pressure (0.800), indicating potential volatility in the near term.\n\nOverall, BTC shows stronger fundamentals across most dimensions, particularly in market cap health and on-chain activity, while ETH exhibits excellent liquidity but faces challenges in on-chain health and market cap efficiency.\n\nJSON Claims:",
        "jsonPart": {
          "claims": [
            {
              "ticker": "BTC",
              "agentRole": "fundamental",
              "claim": "HOLD",
              "confidence": 0.75,
              "direction": "neutral",
              "magnitude": 0.5,
              "rationale": "BTC has good fundamentals with strong market cap health and decent on-chain activity, but liquidity is moderate and community health is low.",
              "signals": [
                {
                  "name": "liquidity_score",
                  "value": 0.593
                },
                {
                  "name": "on_chain_health",
                  "value": 0.699
                },
                {
                  "name": "social_sentiment",
                  "value": 0.795
                },
                {
                  "name": "market_cap_health",
                  "value": 1
                },
                {
                  "name": "risk_adjustment",
                  "value": 0.609
                },
                {
                  "name": "network_activity",
                  "value": 0.777
                },
                {
                  "name": "address_growth",
                  "value": 1
                },
                {
                  "name": "community_health",
                  "value": 0.36
                },
                {
                  "name": "drawdown_risk",
                  "value": 0.095
                },
                {
                  "name": "profit_taking_pressure",
                  "value": 0.4
                }
              ],
              "evidence": [
                "REAL_EVIDENCE_ID_1",
                "REAL_EVIDENCE_ID_2"
              ],
              "riskFlags": [
                "high_risk"
              ]
            },
            {
              "ticker": "ETH",
              "agentRole": "fundamental",
              "claim": "HOLD",
              "confidence": 0.65,
              "direction": "neutral",
              "magnitude": 0.5,
              "rationale": "ETH shows excellent liquidity and strong social engagement, but faces challenges with on-chain health and market cap efficiency.",
              "signals": [
                {
                  "name": "liquidity_score",
                  "value": 0.885
                },
                {
                  "name": "on_chain_health",
                  "value": 0.389
                },
                {
                  "name": "social_sentiment",
                  "value": 0.797
                },
                {
                  "name": "market_cap_health",
                  "value": 0.523
                },
                {
                  "name": "risk_adjustment",
                  "value": 0.687
                },
                {
                  "name": "network_activity",
                  "value": 0.725
                },
                {
                  "name": "address_growth",
                  "value": 1
                },
                {
                  "name": "community_health",
                  "value": 0.537
                },
                {
                  "name": "drawdown_risk",
                  "value": 0.089
                },
                {
                  "name": "profit_taking_pressure",
                  "value": 0.8
                }
              ],
              "evidence": [
                "REAL_EVIDENCE_ID_3",
                "REAL_EVIDENCE_ID_4"
              ],
              "riskFlags": [
                "high_profit_taking_pressure"
              ]
            }
          ]
        },
        "openaiResponse": "FUNDAMENTAL ANALYSIS:\nBTC demonstrates a solid fundamental score of 0.744, indicating good overall health. The liquidity score is moderate at 0.593, suggesting that while there is decent trading volume, it may not be sufficient to ensure optimal liquidity conditions. On-chain health is relatively strong at 0.699, reflecting healthy network activity and address growth, which is crucial for long-term sustainability. Social sentiment is high at 0.795, indicating positive community engagement, although community health is lower at 0.360, which could suggest some areas for improvement. Market cap health is excellent at 1.000, indicating strong institutional interest and efficient supply utilization. The risk profile shows some concerns with a high risk status, but the low drawdown risk (0.095) and moderate profit-taking pressure (0.400) suggest that the asset is currently stable.\n\nETH has a fundamental score of 0.683, which is slightly lower than BTC, indicating moderate overall health. The liquidity score is strong at 0.885, reflecting excellent trading volume and liquidity conditions. However, on-chain health is concerning at 0.389, which indicates lower network activity and potential issues with UTXO health and network security. Social sentiment is high at 0.797, and social engagement is strong at 0.864, showcasing a vibrant community. However, market cap health is weak at 0.523, suggesting potential inefficiencies or reduced institutional interest. The risk profile shows a moderate drawdown risk (0.089) but high profit-taking pressure (0.800), indicating potential volatility in the near term.\n\nOverall, BTC shows stronger fundamentals across most dimensions, particularly in market cap health and on-chain activity, while ETH exhibits excellent liquidity but faces challenges in on-chain health and market cap efficiency.\n\nJSON Claims:\n```json\n{\n  \"claims\": [\n    {\n      \"ticker\": \"BTC\",\n      \"agentRole\": \"fundamental\",\n      \"claim\": \"HOLD\",\n      \"confidence\": 0.75,\n      \"direction\": \"neutral\",\n      \"magnitude\": 0.5,\n      \"rationale\": \"BTC has good fundamentals with strong market cap health and decent on-chain activity, but liquidity is moderate and community health is low.\",\n      \"signals\": [\n        {\"name\": \"liquidity_score\", \"value\": 0.593},\n        {\"name\": \"on_chain_health\", \"value\": 0.699},\n        {\"name\": \"social_sentiment\", \"value\": 0.795},\n        {\"name\": \"market_cap_health\", \"value\": 1.000},\n        {\"name\": \"risk_adjustment\", \"value\": 0.609},\n        {\"name\": \"network_activity\", \"value\": 0.777},\n        {\"name\": \"address_growth\", \"value\": 1.000},\n        {\"name\": \"community_health\", \"value\": 0.360},\n        {\"name\": \"drawdown_risk\", \"value\": 0.095},\n        {\"name\": \"profit_taking_pressure\", \"value\": 0.400}\n      ],\n      \"evidence\": [\"REAL_EVIDENCE_ID_1\", \"REAL_EVIDENCE_ID_2\"],\n      \"riskFlags\": [\"high_risk\"]\n    },\n    {\n      \"ticker\": \"ETH\",\n      \"agentRole\": \"fundamental\",\n      \"claim\": \"HOLD\",\n      \"confidence\": 0.65,\n      \"direction\": \"neutral\",\n      \"magnitude\": 0.5,\n      \"rationale\": \"ETH shows excellent liquidity and strong social engagement, but faces challenges with on-chain health and market cap efficiency.\",\n      \"signals\": [\n        {\"name\": \"liquidity_score\", \"value\": 0.885},\n        {\"name\": \"on_chain_health\", \"value\": 0.389},\n        {\"name\": \"social_sentiment\", \"value\": 0.797},\n        {\"name\": \"market_cap_health\", \"value\": 0.523},\n        {\"name\": \"risk_adjustment\", \"value\": 0.687},\n        {\"name\": \"network_activity\", \"value\": 0.725},\n        {\"name\": \"address_growth\", \"value\": 1.000},\n        {\"name\": \"community_health\", \"value\": 0.537},\n        {\"name\": \"drawdown_risk\", \"value\": 0.089},\n        {\"name\": \"profit_taking_pressure\", \"value\": 0.800}\n      ],\n      \"evidence\": [\"REAL_EVIDENCE_ID_3\", \"REAL_EVIDENCE_ID_4\"],\n      \"riskFlags\": [\"high_profit_taking_pressure\"]\n    }\n  ]\n}\n```",
        "systemPrompt": "",
        "userPrompt": ""
      }
    },
    {
      "timestamp": "2025-08-30T06:56:05.645Z",
      "role": "sentiment",
      "context": {
        "universe": [
          "BTC",
          "ETH"
        ],
        "marketStats": 2,
        "facts": 11,
        "news": 0
      },
      "response": {
        "claims": [
          {
            "id": "BTC_sentiment_1756536868172_0",
            "ticker": "BTC",
            "agentRole": "sentiment",
            "claim": "HOLD",
            "confidence": 0.3,
            "evidence": [],
            "timestamp": 1756536868172,
            "riskFlags": [
              "old_news",
              "inconsistent_sentiment"
            ],
            "direction": "neutral",
            "magnitude": 0.5,
            "rationale": "Mixed sentiment from news articles, with significant social engagement but low freshness and moderate consistency.",
            "signals": [
              {
                "name": "sentiment_score",
                "value": 0.223
              },
              {
                "name": "news_coverage",
                "value": 20
              },
              {
                "name": "freshness_score",
                "value": 0
              },
              {
                "name": "consistency",
                "value": 0.544
              },
              {
                "name": "credibility",
                "value": 0.655
              },
              {
                "name": "coverage_norm",
                "value": 0.774
              },
              {
                "name": "market_mood_factor",
                "value": 1
              },
              {
                "name": "social_volume",
                "value": 136236
              },
              {
                "name": "galaxyscore",
                "value": 36
              },
              {
                "name": "social_engagement",
                "value": 2327639
              }
            ]
          },
          {
            "id": "ETH_sentiment_1756536868172_1",
            "ticker": "ETH",
            "agentRole": "sentiment",
            "claim": "HOLD",
            "confidence": 0.3,
            "evidence": [
              "ETH_news_1756536965644",
              "ETH_news_1756536965644",
              "ETH_news_1756536965644"
            ],
            "timestamp": 1756536868172,
            "riskFlags": [
              "old_news",
              "inconsistent_sentiment"
            ],
            "direction": "neutral",
            "magnitude": 0.5,
            "rationale": "Similar to BTC, sentiment is mixed with strong social engagement but low freshness and moderate consistency.",
            "signals": [
              {
                "name": "sentiment_score",
                "value": 0.228
              },
              {
                "name": "news_coverage",
                "value": 20
              },
              {
                "name": "freshness_score",
                "value": 0
              },
              {
                "name": "consistency",
                "value": 0.516
              },
              {
                "name": "credibility",
                "value": 0.667
              },
              {
                "name": "coverage_norm",
                "value": 0.774
              },
              {
                "name": "market_mood_factor",
                "value": 1
              },
              {
                "name": "social_volume",
                "value": 95139
              },
              {
                "name": "galaxyscore",
                "value": 53.7
              },
              {
                "name": "social_engagement",
                "value": 864054
              }
            ]
          }
        ],
        "textPart": "No text analysis available",
        "jsonPart": {
          "claims": [
            {
              "ticker": "BTC",
              "agentRole": "sentiment",
              "claim": "HOLD",
              "confidence": 0.3,
              "direction": "neutral",
              "magnitude": 0.5,
              "rationale": "Mixed sentiment from news articles, with significant social engagement but low freshness and moderate consistency.",
              "signals": [
                {
                  "name": "sentiment_score",
                  "value": 0.223
                },
                {
                  "name": "news_coverage",
                  "value": 20
                },
                {
                  "name": "freshness_score",
                  "value": 0
                },
                {
                  "name": "consistency",
                  "value": 0.544
                },
                {
                  "name": "credibility",
                  "value": 0.655
                },
                {
                  "name": "coverage_norm",
                  "value": 0.774
                },
                {
                  "name": "market_mood_factor",
                  "value": 1
                },
                {
                  "name": "social_volume",
                  "value": 136236
                },
                {
                  "name": "galaxyscore",
                  "value": 36
                },
                {
                  "name": "social_engagement",
                  "value": 2327639
                }
              ],
              "evidence": [
                {
                  "kind": "news",
                  "source": "multiple",
                  "url": "N/A",
                  "publishedAt": "N/A",
                  "snippet": "Mixed sentiment from various news articles."
                },
                {
                  "kind": "social",
                  "source": "signals",
                  "metric": "galaxyscore",
                  "value": 36,
                  "observedAt": "N/A"
                }
              ],
              "riskFlags": [
                "old_news",
                "inconsistent_sentiment"
              ]
            },
            {
              "ticker": "ETH",
              "agentRole": "sentiment",
              "claim": "HOLD",
              "confidence": 0.3,
              "direction": "neutral",
              "magnitude": 0.5,
              "rationale": "Similar to BTC, sentiment is mixed with strong social engagement but low freshness and moderate consistency.",
              "signals": [
                {
                  "name": "sentiment_score",
                  "value": 0.228
                },
                {
                  "name": "news_coverage",
                  "value": 20
                },
                {
                  "name": "freshness_score",
                  "value": 0
                },
                {
                  "name": "consistency",
                  "value": 0.516
                },
                {
                  "name": "credibility",
                  "value": 0.667
                },
                {
                  "name": "coverage_norm",
                  "value": 0.774
                },
                {
                  "name": "market_mood_factor",
                  "value": 1
                },
                {
                  "name": "social_volume",
                  "value": 95139
                },
                {
                  "name": "galaxyscore",
                  "value": 53.7
                },
                {
                  "name": "social_engagement",
                  "value": 864054
                }
              ],
              "evidence": [
                {
                  "kind": "news",
                  "source": "multiple",
                  "url": "N/A",
                  "publishedAt": "N/A",
                  "snippet": "Mixed sentiment from various news articles."
                },
                {
                  "kind": "social",
                  "source": "signals",
                  "metric": "galaxyscore",
                  "value": 53.7,
                  "observedAt": "N/A"
                }
              ],
              "riskFlags": [
                "old_news",
                "inconsistent_sentiment"
              ]
            }
          ]
        },
        "openaiResponse": "{\n  \"claims\": [\n    {\n      \"ticker\": \"BTC\",\n      \"agentRole\": \"sentiment\",\n      \"claim\": \"HOLD\",\n      \"confidence\": 0.3,\n      \"direction\": \"neutral\",\n      \"magnitude\": 0.5,\n      \"rationale\": \"Mixed sentiment from news articles, with significant social engagement but low freshness and moderate consistency.\",\n      \"signals\": [\n        {\"name\": \"sentiment_score\", \"value\": 0.223},\n        {\"name\": \"news_coverage\", \"value\": 20},\n        {\"name\": \"freshness_score\", \"value\": 0.0},\n        {\"name\": \"consistency\", \"value\": 0.544},\n        {\"name\": \"credibility\", \"value\": 0.655},\n        {\"name\": \"coverage_norm\", \"value\": 0.774},\n        {\"name\": \"market_mood_factor\", \"value\": 1.0},\n        {\"name\": \"social_volume\", \"value\": 136236},\n        {\"name\": \"galaxyscore\", \"value\": 36},\n        {\"name\": \"social_engagement\", \"value\": 2327639}\n      ],\n      \"evidence\": [\n        {\"kind\": \"news\", \"source\": \"multiple\", \"url\": \"N/A\", \"publishedAt\": \"N/A\", \"snippet\": \"Mixed sentiment from various news articles.\"},\n        {\"kind\": \"social\", \"source\": \"signals\", \"metric\": \"galaxyscore\", \"value\": 36, \"observedAt\": \"N/A\"}\n      ],\n      \"riskFlags\": [\"old_news\", \"inconsistent_sentiment\"]\n    },\n    {\n      \"ticker\": \"ETH\",\n      \"agentRole\": \"sentiment\",\n      \"claim\": \"HOLD\",\n      \"confidence\": 0.3,\n      \"direction\": \"neutral\",\n      \"magnitude\": 0.5,\n      \"rationale\": \"Similar to BTC, sentiment is mixed with strong social engagement but low freshness and moderate consistency.\",\n      \"signals\": [\n        {\"name\": \"sentiment_score\", \"value\": 0.228},\n        {\"name\": \"news_coverage\", \"value\": 20},\n        {\"name\": \"freshness_score\", \"value\": 0.0},\n        {\"name\": \"consistency\", \"value\": 0.516},\n        {\"name\": \"credibility\", \"value\": 0.667},\n        {\"name\": \"coverage_norm\", \"value\": 0.774},\n        {\"name\": \"market_mood_factor\", \"value\": 1.0},\n        {\"name\": \"social_volume\", \"value\": 95139},\n        {\"name\": \"galaxyscore\", \"value\": 53.7},\n        {\"name\": \"social_engagement\", \"value\": 864054}\n      ],\n      \"evidence\": [\n        {\"kind\": \"news\", \"source\": \"multiple\", \"url\": \"N/A\", \"publishedAt\": \"N/A\", \"snippet\": \"Mixed sentiment from various news articles.\"},\n        {\"kind\": \"social\", \"source\": \"signals\", \"metric\": \"galaxyscore\", \"value\": 53.7, \"observedAt\": \"N/A\"}\n      ],\n      \"riskFlags\": [\"old_news\", \"inconsistent_sentiment\"]\n    }\n  ]\n}",
        "systemPrompt": "",
        "userPrompt": ""
      }
    },
    {
      "timestamp": "2025-08-30T06:56:26.366Z",
      "role": "technical",
      "context": {
        "universe": [
          "BTC",
          "ETH"
        ],
        "marketStats": 2,
        "facts": 11,
        "news": 0
      },
      "response": {
        "claims": [
          {
            "id": "BTC_technical_1756536868172_0",
            "ticker": "BTC",
            "agentRole": "technical",
            "claim": "BUY",
            "confidence": 1,
            "evidence": [],
            "timestamp": 1756536868172,
            "riskFlags": [],
            "direction": "bullish",
            "magnitude": 0.7,
            "rationale": "BTC is showing oversold conditions with strong support from Stochastic and Williams %R, despite bearish MACD.",
            "signals": [
              {
                "name": "rsi",
                "value": 33.37
              },
              {
                "name": "macd",
                "value": -1038.18
              },
              {
                "name": "volatility_30d",
                "value": 0.27
              },
              {
                "name": "signal_strength",
                "value": -0.059
              }
            ]
          },
          {
            "id": "ETH_technical_1756536868172_1",
            "ticker": "ETH",
            "agentRole": "technical",
            "claim": "HOLD",
            "confidence": 0.65,
            "evidence": [],
            "timestamp": 1756536868172,
            "riskFlags": [],
            "direction": "neutral",
            "magnitude": 0.5,
            "rationale": "ETH shows neutral signals with bearish MACD and no strong momentum indicators, suggesting a cautious approach.",
            "signals": [
              {
                "name": "rsi",
                "value": 43.82
              },
              {
                "name": "macd",
                "value": -55.19
              },
              {
                "name": "volatility_30d",
                "value": 0.22
              },
              {
                "name": "signal_strength",
                "value": 0
              }
            ]
          }
        ],
        "textPart": "TECHNICAL ANALYSIS:\nBTC shows a neutral RSI at 33.37, indicating it is approaching oversold conditions but not yet extreme. The MACD is bearish at -1038.18, suggesting downward momentum. The Stochastic indicator is at 15.29, indicating oversold conditions, while the Williams %R is at -85.96, also suggesting oversold conditions. Volatility is moderate at 0.27, which implies potential for significant price movements. The signal strength is negative at -0.059, indicating weak technical momentum. Overall, the technical picture for BTC is mixed with bearish MACD but supportive oversold indicators.\n\nETH displays a neutral RSI at 43.82, suggesting balanced buying and selling pressure. The MACD is bearish at -55.19, indicating downward momentum. The Stochastic is at 29.11, which is neutral, while the Williams %R is at -62.07, also neutral. Volatility is low at 0.22, suggesting less potential for large price movements. The signal strength is neutral at 0.00, indicating no clear technical momentum. Overall, the technical indicators suggest a cautious approach with mixed signals for ETH.\n\nNow, let's calculate the confidence scores based on the provided data:\n\n**BTC:**\n- Base confidence from signal strength: 0.4 (negative signal strength)\n- RSI bonus: +0.15 (RSI < 30)\n- MACD bonus: +0.10 (MACD absolute value > 1000)\n- Volatility bonus: +0.10 (volatility > 0.25)\n- Multiple indicators alignment: +0.15 (3 indicators aligned: Stochastic, Williams %R, Bollinger Bands)\n- Final confidence: 0.4 + 0.15 + 0.10 + 0.10 + 0.15 = 1.00 (capped at 1.0)\n\n**ETH:**\n- Base confidence from signal strength: 0.4 (neutral signal strength)\n- RSI bonus: 0 (RSI not extreme)\n- MACD bonus: +0.10 (MACD absolute value > 50)\n- Volatility bonus: 0 (volatility < 0.25)\n- Multiple indicators alignment: +0.15 (1 indicator aligned: Bollinger Bands)\n- Final confidence: 0.4 + 0 + 0.10 + 0 + 0.15 = 0.65\n\nBased on the analysis and confidence calculations, here are the claims:",
        "jsonPart": {
          "claims": [
            {
              "ticker": "BTC",
              "agentRole": "technical",
              "claim": "BUY",
              "confidence": 1,
              "direction": "bullish",
              "magnitude": 0.7,
              "rationale": "BTC is showing oversold conditions with strong support from Stochastic and Williams %R, despite bearish MACD.",
              "signals": [
                {
                  "name": "rsi",
                  "value": 33.37
                },
                {
                  "name": "macd",
                  "value": -1038.18
                },
                {
                  "name": "volatility_30d",
                  "value": 0.27
                },
                {
                  "name": "signal_strength",
                  "value": -0.059
                }
              ],
              "evidence": [
                "REAL_EVIDENCE_ID_1",
                "REAL_EVIDENCE_ID_2"
              ]
            },
            {
              "ticker": "ETH",
              "agentRole": "technical",
              "claim": "HOLD",
              "confidence": 0.65,
              "direction": "neutral",
              "magnitude": 0.5,
              "rationale": "ETH shows neutral signals with bearish MACD and no strong momentum indicators, suggesting a cautious approach.",
              "signals": [
                {
                  "name": "rsi",
                  "value": 43.82
                },
                {
                  "name": "macd",
                  "value": -55.19
                },
                {
                  "name": "volatility_30d",
                  "value": 0.22
                },
                {
                  "name": "signal_strength",
                  "value": 0
                }
              ],
              "evidence": [
                "REAL_EVIDENCE_ID_3",
                "REAL_EVIDENCE_ID_4"
              ]
            }
          ]
        },
        "openaiResponse": "TECHNICAL ANALYSIS:\nBTC shows a neutral RSI at 33.37, indicating it is approaching oversold conditions but not yet extreme. The MACD is bearish at -1038.18, suggesting downward momentum. The Stochastic indicator is at 15.29, indicating oversold conditions, while the Williams %R is at -85.96, also suggesting oversold conditions. Volatility is moderate at 0.27, which implies potential for significant price movements. The signal strength is negative at -0.059, indicating weak technical momentum. Overall, the technical picture for BTC is mixed with bearish MACD but supportive oversold indicators.\n\nETH displays a neutral RSI at 43.82, suggesting balanced buying and selling pressure. The MACD is bearish at -55.19, indicating downward momentum. The Stochastic is at 29.11, which is neutral, while the Williams %R is at -62.07, also neutral. Volatility is low at 0.22, suggesting less potential for large price movements. The signal strength is neutral at 0.00, indicating no clear technical momentum. Overall, the technical indicators suggest a cautious approach with mixed signals for ETH.\n\nNow, let's calculate the confidence scores based on the provided data:\n\n**BTC:**\n- Base confidence from signal strength: 0.4 (negative signal strength)\n- RSI bonus: +0.15 (RSI < 30)\n- MACD bonus: +0.10 (MACD absolute value > 1000)\n- Volatility bonus: +0.10 (volatility > 0.25)\n- Multiple indicators alignment: +0.15 (3 indicators aligned: Stochastic, Williams %R, Bollinger Bands)\n- Final confidence: 0.4 + 0.15 + 0.10 + 0.10 + 0.15 = 1.00 (capped at 1.0)\n\n**ETH:**\n- Base confidence from signal strength: 0.4 (neutral signal strength)\n- RSI bonus: 0 (RSI not extreme)\n- MACD bonus: +0.10 (MACD absolute value > 50)\n- Volatility bonus: 0 (volatility < 0.25)\n- Multiple indicators alignment: +0.15 (1 indicator aligned: Bollinger Bands)\n- Final confidence: 0.4 + 0 + 0.10 + 0 + 0.15 = 0.65\n\nBased on the analysis and confidence calculations, here are the claims:\n\n```json\n{\n  \"claims\": [\n    {\n      \"ticker\": \"BTC\",\n      \"agentRole\": \"technical\",\n      \"claim\": \"BUY\",\n      \"confidence\": 1.0,\n      \"direction\": \"bullish\",\n      \"magnitude\": 0.7,\n      \"rationale\": \"BTC is showing oversold conditions with strong support from Stochastic and Williams %R, despite bearish MACD.\",\n      \"signals\": [\n        {\"name\": \"rsi\", \"value\": 33.37},\n        {\"name\": \"macd\", \"value\": -1038.18},\n        {\"name\": \"volatility_30d\", \"value\": 0.27},\n        {\"name\": \"signal_strength\", \"value\": -0.059}\n      ],\n      \"evidence\": [\"REAL_EVIDENCE_ID_1\", \"REAL_EVIDENCE_ID_2\"]\n    },\n    {\n      \"ticker\": \"ETH\",\n      \"agentRole\": \"technical\",\n      \"claim\": \"HOLD\",\n      \"confidence\": 0.65,\n      \"direction\": \"neutral\",\n      \"magnitude\": 0.5,\n      \"rationale\": \"ETH shows neutral signals with bearish MACD and no strong momentum indicators, suggesting a cautious approach.\",\n      \"signals\": [\n        {\"name\": \"rsi\", \"value\": 43.82},\n        {\"name\": \"macd\", \"value\": -55.19},\n        {\"name\": \"volatility_30d\", \"value\": 0.22},\n        {\"name\": \"signal_strength\", \"value\": 0.00}\n      ],\n      \"evidence\": [\"REAL_EVIDENCE_ID_3\", \"REAL_EVIDENCE_ID_4\"]\n    }\n  ]\n}\n```",
        "systemPrompt": "",
        "userPrompt": ""
      }
    }
  ]
}