{
  "roundId": "417deb3d-141d-46a0-8e17-50848c6b2470",
  "date": "8/30/2025, 12:48:39 PM",
  "totalResponses": 3,
  "responses": [
    {
      "timestamp": "2025-08-30T08:47:30.247Z",
      "role": "fundamental",
      "context": {
        "universe": [
          "BTC",
          "ETH"
        ],
        "marketStats": 2,
        "facts": 11,
        "news": 0
      },
      "response": {
        "claims": [
          {
            "id": "BTC_fundamental_1756543567225_0",
            "ticker": "BTC",
            "agentRole": "fundamental",
            "claim": "BUY",
            "confidence": 1,
            "evidence": [
              "BTC_market_data_1756543567225"
            ],
            "timestamp": 1756543567225,
            "riskFlags": [
              "high_volatility"
            ],
            "direction": "bullish",
            "magnitude": 0.7,
            "rationale": "BTC demonstrates strong liquidity, solid on-chain health, and high social engagement, making it a favorable investment.",
            "signals": [
              {
                "name": "liquidity_score",
                "value": 0.993
              },
              {
                "name": "on_chain_health",
                "value": 0.699
              },
              {
                "name": "social_sentiment",
                "value": 0.8
              },
              {
                "name": "market_cap_health",
                "value": 1
              },
              {
                "name": "risk_adjustment",
                "value": 0.609
              },
              {
                "name": "network_activity",
                "value": 0.777
              },
              {
                "name": "address_growth",
                "value": 1
              },
              {
                "name": "utxo_health",
                "value": 1
              },
              {
                "name": "network_security",
                "value": 1
              },
              {
                "name": "social_volume",
                "value": 1
              },
              {
                "name": "social_engagement",
                "value": 1
              },
              {
                "name": "community_health",
                "value": 0.385
              },
              {
                "name": "drawdown_risk",
                "value": 0.095
              },
              {
                "name": "profit_taking_pressure",
                "value": 0.4
              }
            ]
          },
          {
            "id": "ETH_fundamental_1756543567225_1",
            "ticker": "ETH",
            "agentRole": "fundamental",
            "claim": "HOLD",
            "confidence": 0.4,
            "evidence": [
              "ETH_market_data_1756543567225"
            ],
            "timestamp": 1756543567225,
            "riskFlags": [
              "high_profit_taking_pressure"
            ],
            "direction": "neutral",
            "magnitude": 0.5,
            "rationale": "ETH has strong liquidity and social engagement but faces challenges with on-chain health and market cap efficiency.",
            "signals": [
              {
                "name": "liquidity_score",
                "value": 0.995
              },
              {
                "name": "on_chain_health",
                "value": 0.389
              },
              {
                "name": "social_sentiment",
                "value": 0.823
              },
              {
                "name": "market_cap_health",
                "value": 0.523
              },
              {
                "name": "risk_adjustment",
                "value": 0.687
              },
              {
                "name": "network_activity",
                "value": 0.725
              },
              {
                "name": "address_growth",
                "value": 1
              },
              {
                "name": "utxo_health",
                "value": 0
              },
              {
                "name": "network_security",
                "value": 0
              },
              {
                "name": "social_volume",
                "value": 0.938
              },
              {
                "name": "social_engagement",
                "value": 0.932
              },
              {
                "name": "community_health",
                "value": 0.579
              },
              {
                "name": "drawdown_risk",
                "value": 0.089
              },
              {
                "name": "profit_taking_pressure",
                "value": 0.8
              }
            ]
          }
        ],
        "textPart": "FUNDAMENTAL ANALYSIS:\nBTC exhibits strong fundamentals across multiple dimensions. The liquidity assessment is excellent, with a liquidity score of 0.993 and a high trading volume of approximately $2.36 billion, indicating robust market activity and tight spreads. On-chain health is solid, with an on-chain health score of 0.699, supported by high address growth (1.000) and strong UTXO health (1.000), suggesting a healthy network with active participants. Social engagement is also high, with a social sentiment score of 0.800 and maximum scores in social volume and engagement, indicating a vibrant community. Market cap health is exceptional at 1.000, reflecting strong institutional interest and efficient supply utilization. However, risk factors are elevated, with a risk adjustment score of 0.609, indicating potential volatility concerns. Overall, BTC demonstrates strong fundamentals with good health, making it a favorable investment.\n\nETH shows good liquidity as well, with a liquidity score of 0.995 and a trading volume of approximately $2.86 billion. However, its on-chain health is relatively weaker, with an on-chain health score of 0.389, indicating lower transaction efficiency (0.032) and poor UTXO health (0.000), which may suggest challenges in network usage. Social engagement is robust, with a sentiment score of 0.823 and high scores in social volume and engagement, reflecting a healthy community. Market cap health is moderate at 0.523, indicating potential concerns regarding institutional interest. Risk factors are also notable, with a profit-taking pressure score of 0.800, suggesting that there may be significant selling pressure. Overall, while ETH has strong liquidity and social engagement, its on-chain health and market cap efficiency present challenges, leading to a moderate investment outlook.\n\nBased on this analysis, the following claims are generated:\n\nSENTIMENT ANALYSIS:\nBTC demonstrates a generally positive sentiment with a strong news coverage of 20 articles, reflecting a healthy market interest. The news sentiment score is high at 0.725, indicating that most articles are favorable, particularly with reports of bullish market indicators and institutional interest. However, the freshness score is 0.000, suggesting that the news is outdated, which could dampen the overall sentiment impact. Social media engagement is robust, with a high social volume of 134,067 and significant interactions, contributing positively to market sentiment. The GalaxyScore of 51.2 indicates moderate community sentiment, while the Fear & Greed Index at 50 suggests a neutral market mood. Overall, BTC shows strong sentiment but is hindered by the lack of recent news.\n\nETH presents a similar sentiment landscape with a slightly lower news sentiment score of 0.705. The coverage is also solid with 20 articles, but like BTC, the freshness score is 0.000, indicating that the news is not current. Positive articles regarding institutional interest and significant inflows into Ethereum contribute to a generally favorable outlook. Social media metrics show a GalaxyScore of 57.9, indicating a more positive community sentiment compared to BTC. The Fear & Greed Index remains neutral at 50, suggesting that the market mood is balanced. Overall, ETH's sentiment is positive but similarly affected by the outdated nature of the news.\n\nBoth assets demonstrate strong sentiment driven by news and social media engagement, but the lack of freshness in the news could limit their potential impact on market emotions.\n\nCLAIMS:\n\nTECHNICAL ANALYSIS:\nBTC shows a neutral RSI at 35.32, indicating that it is neither oversold nor overbought. The MACD is bearish at -1034.34, suggesting a continuation of downward momentum. The Stochastic indicator is bullish at 18.44, indicating potential upward movement, while the Williams %R is also bullish at -80.49, suggesting oversold conditions. Volatility is moderate at 0.28, which indicates a potential for significant price movements. The overall signal strength is slightly negative at -0.06, reflecting weak technical momentum. However, with three indicators aligned (Stochastic, Williams %R, and Bollinger Bands), the technical picture suggests a cautious approach with a slight bullish bias due to the oversold signals.\n\nETH displays a neutral RSI at 43.35, suggesting balanced buying and selling pressure. The MACD is bearish at -52.57, indicating downward momentum. The Stochastic is neutral at 32.99, and the Williams %R is also neutral at -63.83, indicating no strong buying or selling pressure. Volatility is low at 0.22, suggesting less potential for significant price movements. The overall signal strength is neutral at 0.00, indicating a lack of clear momentum. With only one indicator aligned (Bollinger Bands), the technical indicators suggest a cautious approach with no strong signals to act upon.\n\nBased on the analysis, the following claims are made:\n\n",
        "openaiResponse": "FUNDAMENTAL ANALYSIS:\nBTC exhibits strong fundamentals across multiple dimensions. The liquidity assessment is excellent, with a liquidity score of 0.993 and a high trading volume of approximately $2.36 billion, indicating robust market activity and tight spreads. On-chain health is solid, with an on-chain health score of 0.699, supported by high address growth (1.000) and strong UTXO health (1.000), suggesting a healthy network with active participants. Social engagement is also high, with a social sentiment score of 0.800 and maximum scores in social volume and engagement, indicating a vibrant community. Market cap health is exceptional at 1.000, reflecting strong institutional interest and efficient supply utilization. However, risk factors are elevated, with a risk adjustment score of 0.609, indicating potential volatility concerns. Overall, BTC demonstrates strong fundamentals with good health, making it a favorable investment.\n\nETH shows good liquidity as well, with a liquidity score of 0.995 and a trading volume of approximately $2.86 billion. However, its on-chain health is relatively weaker, with an on-chain health score of 0.389, indicating lower transaction efficiency (0.032) and poor UTXO health (0.000), which may suggest challenges in network usage. Social engagement is robust, with a sentiment score of 0.823 and high scores in social volume and engagement, reflecting a healthy community. Market cap health is moderate at 0.523, indicating potential concerns regarding institutional interest. Risk factors are also notable, with a profit-taking pressure score of 0.800, suggesting that there may be significant selling pressure. Overall, while ETH has strong liquidity and social engagement, its on-chain health and market cap efficiency present challenges, leading to a moderate investment outlook.\n\nBased on this analysis, the following claims are generated:\n\n```json\n{\n  \"claims\": [\n    {\n      \"ticker\": \"BTC\",\n      \"agentRole\": \"fundamental\",\n      \"claim\": \"BUY\",\n      \"confidence\": 1.0,\n      \"direction\": \"bullish\",\n      \"magnitude\": 0.7,\n      \"rationale\": \"BTC demonstrates strong liquidity, solid on-chain health, and high social engagement, making it a favorable investment.\",\n      \"signals\": [\n        {\"name\": \"liquidity_score\", \"value\": 0.993},\n        {\"name\": \"on_chain_health\", \"value\": 0.699},\n        {\"name\": \"social_sentiment\", \"value\": 0.800},\n        {\"name\": \"market_cap_health\", \"value\": 1.000},\n        {\"name\": \"risk_adjustment\", \"value\": 0.609},\n        {\"name\": \"network_activity\", \"value\": 0.777},\n        {\"name\": \"address_growth\", \"value\": 1.000},\n        {\"name\": \"utxo_health\", \"value\": 1.000},\n        {\"name\": \"network_security\", \"value\": 1.000},\n        {\"name\": \"social_volume\", \"value\": 1.000},\n        {\"name\": \"social_engagement\", \"value\": 1.000},\n        {\"name\": \"community_health\", \"value\": 0.385},\n        {\"name\": \"drawdown_risk\", \"value\": 0.095},\n        {\"name\": \"profit_taking_pressure\", \"value\": 0.400}\n      ],\n      \"evidence\": [\"REAL_EVIDENCE_ID_1\", \"REAL_EVIDENCE_ID_2\"],\n      \"riskFlags\": [\"high_volatility\"]\n    },\n    {\n      \"ticker\": \"ETH\",\n      \"agentRole\": \"fundamental\",\n      \"claim\": \"HOLD\",\n      \"confidence\": 0.4,\n      \"direction\": \"neutral\",\n      \"magnitude\": 0.5,\n      \"rationale\": \"ETH has strong liquidity and social engagement but faces challenges with on-chain health and market cap efficiency.\",\n      \"signals\": [\n        {\"name\": \"liquidity_score\", \"value\": 0.995},\n        {\"name\": \"on_chain_health\", \"value\": 0.389},\n        {\"name\": \"social_sentiment\", \"value\": 0.823},\n        {\"name\": \"market_cap_health\", \"value\": 0.523},\n        {\"name\": \"risk_adjustment\", \"value\": 0.687},\n        {\"name\": \"network_activity\", \"value\": 0.725},\n        {\"name\": \"address_growth\", \"value\": 1.000},\n        {\"name\": \"utxo_health\", \"value\": 0.000},\n        {\"name\": \"network_security\", \"value\": 0.000},\n        {\"name\": \"social_volume\", \"value\": 0.938},\n        {\"name\": \"social_engagement\", \"value\": 0.932},\n        {\"name\": \"community_health\", \"value\": 0.579},\n        {\"name\": \"drawdown_risk\", \"value\": 0.089},\n        {\"name\": \"profit_taking_pressure\", \"value\": 0.800}\n      ],\n      \"evidence\": [\"REAL_EVIDENCE_ID_3\", \"REAL_EVIDENCE_ID_4\"],\n      \"riskFlags\": [\"high_profit_taking_pressure\"]\n    }\n  ]\n}\n```\n\nSENTIMENT ANALYSIS:\nBTC demonstrates a generally positive sentiment with a strong news coverage of 20 articles, reflecting a healthy market interest. The news sentiment score is high at 0.725, indicating that most articles are favorable, particularly with reports of bullish market indicators and institutional interest. However, the freshness score is 0.000, suggesting that the news is outdated, which could dampen the overall sentiment impact. Social media engagement is robust, with a high social volume of 134,067 and significant interactions, contributing positively to market sentiment. The GalaxyScore of 51.2 indicates moderate community sentiment, while the Fear & Greed Index at 50 suggests a neutral market mood. Overall, BTC shows strong sentiment but is hindered by the lack of recent news.\n\nETH presents a similar sentiment landscape with a slightly lower news sentiment score of 0.705. The coverage is also solid with 20 articles, but like BTC, the freshness score is 0.000, indicating that the news is not current. Positive articles regarding institutional interest and significant inflows into Ethereum contribute to a generally favorable outlook. Social media metrics show a GalaxyScore of 57.9, indicating a more positive community sentiment compared to BTC. The Fear & Greed Index remains neutral at 50, suggesting that the market mood is balanced. Overall, ETH's sentiment is positive but similarly affected by the outdated nature of the news.\n\nBoth assets demonstrate strong sentiment driven by news and social media engagement, but the lack of freshness in the news could limit their potential impact on market emotions.\n\nCLAIMS:\n\n```json\n{\n  \"claims\": [\n    {\n      \"ticker\": \"BTC\",\n      \"agentRole\": \"sentiment\",\n      \"claim\": \"HOLD\",\n      \"confidence\": 0.56,\n      \"direction\": \"neutral\",\n      \"magnitude\": 0.5,\n      \"rationale\": \"Despite strong news sentiment and social engagement, the lack of recent news limits confidence.\",\n      \"signals\": [\n        {\"name\": \"sentiment_score\", \"value\": 0.241},\n        {\"name\": \"news_coverage\", \"value\": 20},\n        {\"name\": \"freshness_score\", \"value\": 0.000},\n        {\"name\": \"consistency\", \"value\": 0.544},\n        {\"name\": \"credibility\", \"value\": 0.655},\n        {\"name\": \"coverage_norm\", \"value\": 0.774},\n        {\"name\": \"market_mood_factor\", \"value\": 1.000},\n        {\"name\": \"social_volume\", \"value\": 134067},\n        {\"name\": \"galaxyscore\", \"value\": 51.2},\n        {\"name\": \"social_engagement\", \"value\": 2360951}\n      ],\n      \"evidence\": [\"3537\", \"3540\"]\n    },\n    {\n      \"ticker\": \"ETH\",\n      \"agentRole\": \"sentiment\",\n      \"claim\": \"HOLD\",\n      \"confidence\": 0.54,\n      \"direction\": \"neutral\",\n      \"magnitude\": 0.5,\n      \"rationale\": \"While news sentiment is positive and social engagement is strong, the outdated news affects overall confidence.\",\n      \"signals\": [\n        {\"name\": \"sentiment_score\", \"value\": 0.238},\n        {\"name\": \"news_coverage\", \"value\": 20},\n        {\"name\": \"freshness_score\", \"value\": 0.000},\n        {\"name\": \"consistency\", \"value\": 0.516},\n        {\"name\": \"credibility\", \"value\": 0.667},\n        {\"name\": \"coverage_norm\", \"value\": 0.774},\n        {\"name\": \"market_mood_factor\", \"value\": 1.000},\n        {\"name\": \"social_volume\", \"value\": 93797},\n        {\"name\": \"galaxyscore\", \"value\": 57.9},\n        {\"name\": \"social_engagement\", \"value\": 931985}\n      ],\n      \"evidence\": [\"3527\", \"3535\"]\n    }\n  ]\n}\n```\n\nTECHNICAL ANALYSIS:\nBTC shows a neutral RSI at 35.32, indicating that it is neither oversold nor overbought. The MACD is bearish at -1034.34, suggesting a continuation of downward momentum. The Stochastic indicator is bullish at 18.44, indicating potential upward movement, while the Williams %R is also bullish at -80.49, suggesting oversold conditions. Volatility is moderate at 0.28, which indicates a potential for significant price movements. The overall signal strength is slightly negative at -0.06, reflecting weak technical momentum. However, with three indicators aligned (Stochastic, Williams %R, and Bollinger Bands), the technical picture suggests a cautious approach with a slight bullish bias due to the oversold signals.\n\nETH displays a neutral RSI at 43.35, suggesting balanced buying and selling pressure. The MACD is bearish at -52.57, indicating downward momentum. The Stochastic is neutral at 32.99, and the Williams %R is also neutral at -63.83, indicating no strong buying or selling pressure. Volatility is low at 0.22, suggesting less potential for significant price movements. The overall signal strength is neutral at 0.00, indicating a lack of clear momentum. With only one indicator aligned (Bollinger Bands), the technical indicators suggest a cautious approach with no strong signals to act upon.\n\nBased on the analysis, the following claims are made:\n\n```json\n{\n  \"claims\": [\n    {\n      \"ticker\": \"BTC\",\n      \"agentRole\": \"technical\",\n      \"claim\": \"HOLD\",\n      \"confidence\": 0.72,\n      \"direction\": \"neutral\",\n      \"magnitude\": 0.5,\n      \"rationale\": \"BTC shows mixed signals with bearish MACD but bullish Stochastic and Williams %R. The overall picture suggests caution.\",\n      \"signals\": [\n        {\"name\": \"rsi\", \"value\": 35.32},\n        {\"name\": \"macd\", \"value\": -1034.34},\n        {\"name\": \"volatility_30d\", \"value\": 0.28},\n        {\"name\": \"signal_strength\", \"value\": -0.06}\n      ],\n      \"evidence\": [\"REAL_EVIDENCE_ID_1\", \"REAL_EVIDENCE_ID_2\"],\n      \"riskFlags\": [\"moderate_volatility\", \"mixed_signals\"]\n    },\n    {\n      \"ticker\": \"ETH\",\n      \"agentRole\": \"technical\",\n      \"claim\": \"HOLD\",\n      \"confidence\": 0.2,\n      \"direction\": \"neutral\",\n      \"magnitude\": 0.0,\n      \"rationale\": \"ETH shows weak signals with bearish MACD and no strong momentum indicators. The overall picture lacks clarity.\",\n      \"signals\": [\n        {\"name\": \"rsi\", \"value\": 43.35},\n        {\"name\": \"macd\", \"value\": -52.57},\n        {\"name\": \"volatility_30d\", \"value\": 0.22},\n        {\"name\": \"signal_strength\", \"value\": 0.00}\n      ],\n      \"evidence\": [\"REAL_EVIDENCE_ID_3\"],\n      \"riskFlags\": [\"low_volatility\", \"weak_signals\"]\n    }\n  ]\n}\n```\n\n"
      }
    },
    {
      "timestamp": "2025-08-30T08:47:49.246Z",
      "role": "sentiment",
      "context": {
        "universe": [
          "BTC",
          "ETH"
        ],
        "marketStats": 0,
        "facts": 5,
        "news": 0
      },
      "response": {
        "claims": [
          {
            "id": "BTC_sentiment_1756543567225_0",
            "ticker": "BTC",
            "agentRole": "sentiment",
            "claim": "HOLD",
            "confidence": 0.3,
            "evidence": [
              "BTC_market_data_1756543567225"
            ],
            "timestamp": 1756543567225,
            "riskFlags": [],
            "direction": "neutral",
            "magnitude": 0.5,
            "rationale": "Despite strong news sentiment and social engagement, the lack of fresh news impacts confidence.",
            "signals": [
              {
                "name": "sentiment_score",
                "value": 0.241
              },
              {
                "name": "news_coverage",
                "value": 20
              },
              {
                "name": "freshness_score",
                "value": 0
              },
              {
                "name": "consistency",
                "value": 0.544
              },
              {
                "name": "credibility",
                "value": 0.655
              },
              {
                "name": "coverage_norm",
                "value": 0.774
              },
              {
                "name": "market_mood_factor",
                "value": 1
              },
              {
                "name": "social_volume",
                "value": 134067
              },
              {
                "name": "galaxyscore",
                "value": 51.2
              },
              {
                "name": "social_engagement",
                "value": 2360951
              }
            ]
          },
          {
            "id": "ETH_sentiment_1756543567225_1",
            "ticker": "ETH",
            "agentRole": "sentiment",
            "claim": "HOLD",
            "confidence": 0.3,
            "evidence": [
              "ETH_market_data_1756543567225"
            ],
            "timestamp": 1756543567225,
            "riskFlags": [],
            "direction": "neutral",
            "magnitude": 0.5,
            "rationale": "While the sentiment is positive, the absence of fresh news limits confidence.",
            "signals": [
              {
                "name": "sentiment_score",
                "value": 0.238
              },
              {
                "name": "news_coverage",
                "value": 20
              },
              {
                "name": "freshness_score",
                "value": 0
              },
              {
                "name": "consistency",
                "value": 0.516
              },
              {
                "name": "credibility",
                "value": 0.667
              },
              {
                "name": "coverage_norm",
                "value": 0.774
              },
              {
                "name": "market_mood_factor",
                "value": 1
              },
              {
                "name": "social_volume",
                "value": 93797
              },
              {
                "name": "galaxyscore",
                "value": 57.9
              },
              {
                "name": "social_engagement",
                "value": 931985
              }
            ]
          }
        ],
        "textPart": "FUNDAMENTAL ANALYSIS:\nBTC exhibits strong fundamentals across all key metrics. The liquidity score is excellent at 0.993, indicating high trading volume and stability in pricing. On-chain health is also robust at 0.699, reflecting healthy network activity and address growth, which is at a perfect score of 1.000. Social engagement is high with a sentiment score of 0.825, suggesting a vibrant community and strong interest. Market cap health is exceptional at 1.000, indicating solid institutional interest and efficient supply utilization. However, the risk status is high, which could pose challenges in terms of volatility and profit-taking pressure, though the drawdown risk is relatively low at 0.095. Overall, BTC demonstrates excellent fundamentals, making it a strong candidate for investment.\n\nETH shows good liquidity with a score of 0.995, indicating strong trading volume. However, its on-chain health is lower at 0.389, suggesting less network activity and potential concerns with UTXO health, which is at 0.000. Social engagement is strong, with a sentiment score of 0.823 and high community health at 0.579, indicating a supportive community. Market cap health is moderate at 0.523, which may reflect less institutional interest compared to BTC. The risk factors are notable, with a profit-taking pressure score of 0.800, indicating potential selling pressure. Overall, while ETH has good liquidity and social engagement, its on-chain health and market cap efficiency suggest caution.\n\nBased on this analysis, the following claims are made:\n\nSENTIMENT ANALYSIS:\nBTC displays a generally positive sentiment based on news coverage, with 20 articles contributing to a high news sentiment score of 0.725. However, the freshness of the news is a significant concern, as it is marked at 0.000, indicating that the news is outdated. The consistency of sentiment across different sources is moderate at 0.544, and the credibility score is relatively strong at 0.655. Social media engagement is robust, with a significant volume of interactions (2,360,951) and a GalaxyScore of 51.2, reflecting a moderately positive community sentiment. The Fear & Greed Index is neutral at 50, suggesting a balanced market mood. Overall, while BTC has strong news sentiment and social engagement, the lack of fresh news could dampen market confidence.\n\nETH also shows a positive sentiment with a news sentiment score of 0.705 and the same coverage of 20 articles. However, like BTC, the freshness score is 0.000, indicating that the news is stale. The consistency of sentiment is slightly lower than BTC at 0.516, but the credibility score is comparable at 0.667. Social media engagement is slightly lower than BTC, with 931,985 interactions and a GalaxyScore of 57.9, indicating a more favorable community sentiment. The Fear & Greed Index remains neutral at 50. Overall, ETH has a positive sentiment but is similarly affected by the lack of fresh news.\n\nIn summary, both BTC and ETH exhibit positive sentiment driven by strong news coverage and social media engagement, but the freshness of the news is a critical issue that may impact market confidence.\n\nCLAIMS:\n\nTECHNICAL ANALYSIS:\nBTC shows a neutral RSI at 35.32, indicating neither oversold nor overbought conditions. The MACD is bearish at -1034.34, suggesting downward momentum. The Stochastic indicator is at 18.44, indicating potential bullish momentum as it is below 20. However, the overall trend strength is negative at -0.024, and the volatility is moderate at 0.281. The signal strength is slightly negative at -0.059, indicating weak technical momentum. Overall, the technical picture for BTC is mixed, with bearish MACD but potential bullish signals from the Stochastic.\n\nETH displays a neutral RSI at 42.99, suggesting balanced buying and selling pressure. The MACD is also bearish at -52.95, indicating downward momentum. The Stochastic indicator is at 32.56, which is neutral, indicating no strong momentum signals. The volatility is low at 0.225, suggesting less potential for large price moves. The signal strength is neutral at 0.0, indicating weak technical momentum. Overall, the technical indicators suggest a cautious approach for ETH, with mixed signals.\n\nBased on the analysis, the confidence levels are adjusted based on the indicators' alignment and strength.\n\n",
        "openaiResponse": "FUNDAMENTAL ANALYSIS:\nBTC exhibits strong fundamentals across all key metrics. The liquidity score is excellent at 0.993, indicating high trading volume and stability in pricing. On-chain health is also robust at 0.699, reflecting healthy network activity and address growth, which is at a perfect score of 1.000. Social engagement is high with a sentiment score of 0.825, suggesting a vibrant community and strong interest. Market cap health is exceptional at 1.000, indicating solid institutional interest and efficient supply utilization. However, the risk status is high, which could pose challenges in terms of volatility and profit-taking pressure, though the drawdown risk is relatively low at 0.095. Overall, BTC demonstrates excellent fundamentals, making it a strong candidate for investment.\n\nETH shows good liquidity with a score of 0.995, indicating strong trading volume. However, its on-chain health is lower at 0.389, suggesting less network activity and potential concerns with UTXO health, which is at 0.000. Social engagement is strong, with a sentiment score of 0.823 and high community health at 0.579, indicating a supportive community. Market cap health is moderate at 0.523, which may reflect less institutional interest compared to BTC. The risk factors are notable, with a profit-taking pressure score of 0.800, indicating potential selling pressure. Overall, while ETH has good liquidity and social engagement, its on-chain health and market cap efficiency suggest caution.\n\nBased on this analysis, the following claims are made:\n\n```json\n{\n  \"claims\": [\n    {\n      \"ticker\": \"BTC\",\n      \"agentRole\": \"fundamental\",\n      \"claim\": \"BUY\",\n      \"confidence\": 1.0,\n      \"direction\": \"bullish\",\n      \"magnitude\": 0.8,\n      \"rationale\": \"Strong fundamentals with excellent liquidity, on-chain health, and market cap efficiency.\",\n      \"signals\": [\n        {\"name\": \"liquidity_score\", \"value\": 0.993},\n        {\"name\": \"on_chain_health\", \"value\": 0.699},\n        {\"name\": \"social_sentiment\", \"value\": 0.825},\n        {\"name\": \"market_cap_health\", \"value\": 1.000},\n        {\"name\": \"risk_adjustment\", \"value\": 0.609},\n        {\"name\": \"network_activity\", \"value\": 0.777},\n        {\"name\": \"address_growth\", \"value\": 1.000},\n        {\"name\": \"utxo_health\", \"value\": 1.000},\n        {\"name\": \"network_security\", \"value\": 1.000},\n        {\"name\": \"social_volume\", \"value\": 1.000},\n        {\"name\": \"social_engagement\", \"value\": 1.000},\n        {\"name\": \"sentiment_score\", \"value\": 0.780},\n        {\"name\": \"community_health\", \"value\": 0.512},\n        {\"name\": \"drawdown_risk\", \"value\": 0.095},\n        {\"name\": \"profit_taking_pressure\", \"value\": 0.400}\n      ],\n      \"evidence\": [\"REAL_EVIDENCE_ID_1\", \"REAL_EVIDENCE_ID_2\"]\n    },\n    {\n      \"ticker\": \"ETH\",\n      \"agentRole\": \"fundamental\",\n      \"claim\": \"HOLD\",\n      \"confidence\": 0.4,\n      \"direction\": \"neutral\",\n      \"magnitude\": 0.5,\n      \"rationale\": \"Good liquidity and social engagement, but lower on-chain health and market cap efficiency warrant caution.\",\n      \"signals\": [\n        {\"name\": \"liquidity_score\", \"value\": 0.995},\n        {\"name\": \"on_chain_health\", \"value\": 0.389},\n        {\"name\": \"social_sentiment\", \"value\": 0.823},\n        {\"name\": \"market_cap_health\", \"value\": 0.523},\n        {\"name\": \"risk_adjustment\", \"value\": 0.687},\n        {\"name\": \"network_activity\", \"value\": 0.725},\n        {\"name\": \"address_growth\", \"value\": 1.000},\n        {\"name\": \"utxo_health\", \"value\": 0.000},\n        {\"name\": \"network_security\", \"value\": 0.000},\n        {\"name\": \"social_volume\", \"value\": 0.938},\n        {\"name\": \"social_engagement\", \"value\": 0.932},\n        {\"name\": \"sentiment_score\", \"value\": 0.820},\n        {\"name\": \"community_health\", \"value\": 0.579},\n        {\"name\": \"drawdown_risk\", \"value\": 0.089},\n        {\"name\": \"profit_taking_pressure\", \"value\": 0.800}\n      ],\n      \"evidence\": [\"REAL_EVIDENCE_ID_3\", \"REAL_EVIDENCE_ID_4\"]\n    }\n  ]\n}\n```\n\nSENTIMENT ANALYSIS:\nBTC displays a generally positive sentiment based on news coverage, with 20 articles contributing to a high news sentiment score of 0.725. However, the freshness of the news is a significant concern, as it is marked at 0.000, indicating that the news is outdated. The consistency of sentiment across different sources is moderate at 0.544, and the credibility score is relatively strong at 0.655. Social media engagement is robust, with a significant volume of interactions (2,360,951) and a GalaxyScore of 51.2, reflecting a moderately positive community sentiment. The Fear & Greed Index is neutral at 50, suggesting a balanced market mood. Overall, while BTC has strong news sentiment and social engagement, the lack of fresh news could dampen market confidence.\n\nETH also shows a positive sentiment with a news sentiment score of 0.705 and the same coverage of 20 articles. However, like BTC, the freshness score is 0.000, indicating that the news is stale. The consistency of sentiment is slightly lower than BTC at 0.516, but the credibility score is comparable at 0.667. Social media engagement is slightly lower than BTC, with 931,985 interactions and a GalaxyScore of 57.9, indicating a more favorable community sentiment. The Fear & Greed Index remains neutral at 50. Overall, ETH has a positive sentiment but is similarly affected by the lack of fresh news.\n\nIn summary, both BTC and ETH exhibit positive sentiment driven by strong news coverage and social media engagement, but the freshness of the news is a critical issue that may impact market confidence.\n\nCLAIMS:\n```json\n{\n  \"claims\": [\n    {\n      \"ticker\": \"BTC\",\n      \"agentRole\": \"sentiment\",\n      \"claim\": \"HOLD\",\n      \"confidence\": 0.3,\n      \"direction\": \"neutral\",\n      \"magnitude\": 0.5,\n      \"rationale\": \"Despite strong news sentiment and social engagement, the lack of fresh news impacts confidence.\",\n      \"signals\": [\n        {\"name\": \"sentiment_score\", \"value\": 0.241},\n        {\"name\": \"news_coverage\", \"value\": 20},\n        {\"name\": \"freshness_score\", \"value\": 0.000},\n        {\"name\": \"consistency\", \"value\": 0.544},\n        {\"name\": \"credibility\", \"value\": 0.655},\n        {\"name\": \"coverage_norm\", \"value\": 0.774},\n        {\"name\": \"market_mood_factor\", \"value\": 1.000},\n        {\"name\": \"social_volume\", \"value\": 134067},\n        {\"name\": \"galaxyscore\", \"value\": 51.2},\n        {\"name\": \"social_engagement\", \"value\": 2360951}\n      ],\n      \"evidence\": [\"3537\", \"3540\"]\n    },\n    {\n      \"ticker\": \"ETH\",\n      \"agentRole\": \"sentiment\",\n      \"claim\": \"HOLD\",\n      \"confidence\": 0.3,\n      \"direction\": \"neutral\",\n      \"magnitude\": 0.5,\n      \"rationale\": \"While the sentiment is positive, the absence of fresh news limits confidence.\",\n      \"signals\": [\n        {\"name\": \"sentiment_score\", \"value\": 0.238},\n        {\"name\": \"news_coverage\", \"value\": 20},\n        {\"name\": \"freshness_score\", \"value\": 0.000},\n        {\"name\": \"consistency\", \"value\": 0.516},\n        {\"name\": \"credibility\", \"value\": 0.667},\n        {\"name\": \"coverage_norm\", \"value\": 0.774},\n        {\"name\": \"market_mood_factor\", \"value\": 1.000},\n        {\"name\": \"social_volume\", \"value\": 93797},\n        {\"name\": \"galaxyscore\", \"value\": 57.9},\n        {\"name\": \"social_engagement\", \"value\": 931985}\n      ],\n      \"evidence\": [\"3527\", \"3535\"]\n    }\n  ]\n}\n```\n\nTECHNICAL ANALYSIS:\nBTC shows a neutral RSI at 35.32, indicating neither oversold nor overbought conditions. The MACD is bearish at -1034.34, suggesting downward momentum. The Stochastic indicator is at 18.44, indicating potential bullish momentum as it is below 20. However, the overall trend strength is negative at -0.024, and the volatility is moderate at 0.281. The signal strength is slightly negative at -0.059, indicating weak technical momentum. Overall, the technical picture for BTC is mixed, with bearish MACD but potential bullish signals from the Stochastic.\n\nETH displays a neutral RSI at 42.99, suggesting balanced buying and selling pressure. The MACD is also bearish at -52.95, indicating downward momentum. The Stochastic indicator is at 32.56, which is neutral, indicating no strong momentum signals. The volatility is low at 0.225, suggesting less potential for large price moves. The signal strength is neutral at 0.0, indicating weak technical momentum. Overall, the technical indicators suggest a cautious approach for ETH, with mixed signals.\n\nBased on the analysis, the confidence levels are adjusted based on the indicators' alignment and strength.\n\n{\n  \"claims\": [\n    {\n      \"ticker\": \"BTC\",\n      \"agentRole\": \"technical\",\n      \"claim\": \"HOLD\",\n      \"confidence\": 0.72,\n      \"direction\": \"neutral\",\n      \"magnitude\": 0.0,\n      \"rationale\": \"Mixed signals with bearish MACD and potential bullish Stochastic; hold position.\",\n      \"signals\": [\n        {\"name\": \"rsi\", \"value\": 35.32},\n        {\"name\": \"macd\", \"value\": -1034.34},\n        {\"name\": \"volatility_30d\", \"value\": 0.281},\n        {\"name\": \"signal_strength\", \"value\": -0.059}\n      ],\n      \"evidence\": [\"REAL_EVIDENCE_ID_1\", \"REAL_EVIDENCE_ID_2\"],\n      \"riskFlags\": [\"moderate_volatility\", \"weak_signals\"]\n    },\n    {\n      \"ticker\": \"ETH\",\n      \"agentRole\": \"technical\",\n      \"claim\": \"HOLD\",\n      \"confidence\": 0.2,\n      \"direction\": \"neutral\",\n      \"magnitude\": 0.0,\n      \"rationale\": \"Insufficient alignment and weak signals; recommend holding.\",\n      \"signals\": [\n        {\"name\": \"rsi\", \"value\": 42.99},\n        {\"name\": \"macd\", \"value\": -52.95},\n        {\"name\": \"volatility_30d\", \"value\": 0.225},\n        {\"name\": \"signal_strength\", \"value\": 0.0}\n      ],\n      \"evidence\": [\"REAL_EVIDENCE_ID_3\", \"REAL_EVIDENCE_ID_4\"],\n      \"riskFlags\": [\"low_volatility\", \"weak_signals\"]\n    }\n  ]\n}\n\n"
      }
    },
    {
      "timestamp": "2025-08-30T08:48:16.977Z",
      "role": "technical",
      "context": {
        "universe": [
          "BTC",
          "ETH"
        ],
        "marketStats": 2,
        "facts": 11,
        "news": 0
      },
      "response": {
        "claims": [
          {
            "id": "BTC_technical_1756543567225_0",
            "ticker": "BTC",
            "agentRole": "technical",
            "claim": "HOLD",
            "confidence": 0.72,
            "evidence": [
              "BTC_market_data_1756543567225"
            ],
            "timestamp": 1756543567225,
            "riskFlags": [
              "moderate_volatility",
              "mixed_signals"
            ],
            "direction": "neutral",
            "magnitude": 0.5,
            "rationale": "Mixed signals with bearish MACD but bullish Stochastic and Williams %R suggest caution.",
            "signals": [
              {
                "name": "rsi",
                "value": 35.14
              },
              {
                "name": "macd",
                "value": -1036.02
              },
              {
                "name": "volatility_30d",
                "value": 0.281
              },
              {
                "name": "signal_strength",
                "value": -0.059
              }
            ]
          },
          {
            "id": "ETH_technical_1756543567225_1",
            "ticker": "ETH",
            "agentRole": "technical",
            "claim": "HOLD",
            "confidence": 0.2,
            "evidence": [
              "ETH_market_data_1756543567225"
            ],
            "timestamp": 1756543567225,
            "riskFlags": [
              "low_volatility",
              "bearish_momentum"
            ],
            "direction": "neutral",
            "magnitude": 0.1,
            "rationale": "Insufficient alignment of indicators and bearish MACD suggest a cautious approach.",
            "signals": [
              {
                "name": "rsi",
                "value": 43.11
              },
              {
                "name": "macd",
                "value": -52.82
              },
              {
                "name": "volatility_30d",
                "value": 0.225
              },
              {
                "name": "signal_strength",
                "value": 0
              }
            ]
          }
        ],
        "textPart": "FUNDAMENTAL ANALYSIS:\nBTC demonstrates excellent liquidity with a liquidity score of 0.993 and a very high trading volume of approximately $2.36 billion, indicating strong market participation and stability in pricing. The on-chain health is solid with a score of 0.699, reflecting good network activity and address growth, which is crucial for long-term sustainability. Social engagement is high, with a sentiment score of 0.825 and perfect scores in social volume and engagement, suggesting a vibrant community and strong interest. Market cap health is exceptional at 1.000, indicating efficient supply utilization and likely institutional interest. However, there is a high-risk status due to potential volatility, although the drawdown risk is relatively low at 0.095. Overall, BTC shows strong fundamentals across all metrics, making it a compelling investment.\n\nETH, on the other hand, also exhibits excellent liquidity with a liquidity score of 0.995 and a trading volume of approximately $2.86 billion, indicating good market depth. However, its on-chain health is weaker at 0.389, suggesting challenges in network activity and UTXO health, which could impact its long-term viability. Social engagement remains strong with a sentiment score of 0.823 and high scores in social volume and engagement, indicating a healthy community. However, market cap health is concerning at 0.523, which may reflect inefficiencies or lower institutional interest. The risk profile is also high, with a profit-taking pressure score of 0.800, indicating potential selling pressure. Overall, while ETH has strong liquidity and social metrics, its on-chain health and market cap efficiency raise concerns.\n\nBased on these analyses, the following claims are made:\n\nSENTIMENT ANALYSIS:\nBTC shows a generally positive news sentiment with a strong coverage of 20 articles, indicating a robust market interest. The sentiment from news sources is relatively high at 0.725, but the freshness score is very low (0.000), which could dampen overall market enthusiasm. Social media engagement is significant, with a high volume of interactions and a GalaxyScore of 51.2, suggesting a moderately positive community sentiment. The Fear & Greed Index is neutral at 50, indicating a balanced market mood. However, the consistency of sentiment across sources is moderate (0.544), which may reflect some divergence in opinions. Overall, BTC sentiment is positive but tempered by the lack of recent news.\n\nETH also demonstrates a positive sentiment with a news sentiment score of 0.705 and the same strong coverage of 20 articles. Similar to BTC, ETH's news freshness is low (0.000), which may limit the impact of the positive news. Social media engagement is strong, with a GalaxyScore of 57.9, indicating a more favorable community sentiment compared to BTC. The Fear & Greed Index remains neutral at 50, suggesting a balanced outlook. The consistency of sentiment is slightly lower than BTC at 0.516, indicating some variability in the sentiment expressed across different sources. Overall, ETH sentiment is positive but also affected by the lack of recent updates.\n\nREVISED SUMMARY:\nBTC has a positive sentiment driven by strong news coverage and social media engagement, but the lack of fresh news may limit its impact. ETH shows similar positive sentiment with strong community support, but also suffers from low freshness. Both assets reflect a neutral market mood according to the Fear & Greed Index, with moderate consistency in sentiment across sources.\n\nAGGREGATE:\n- BTC: Positive sentiment with strong news coverage, but low freshness and moderate consistency.\n- ETH: Positive sentiment with strong community support, but low freshness and moderate consistency.\n\nNow, I will calculate the sentiment scores and prepare the claims.\n\n### Sentiment Score Calculation:\n- BTC:\n  - Average Sentiment = 0.725\n  - Coverage Norm = 0.774\n  - Freshness Score = 0.000\n  - Consistency = 0.544\n  - Credibility = 0.655\n  - Market Mood Factor = 1.000\n  - Sentiment Score = 0.725 × 0.774 × 0.000 × 0.544 × 0.655 × 1.000 = 0.000 (due to freshness being 0)\n\n- ETH:\n  - Average Sentiment = 0.705\n  - Coverage Norm = 0.774\n  - Freshness Score = 0.000\n  - Consistency = 0.516\n  - Credibility = 0.667\n  - Market Mood Factor = 1.000\n  - Sentiment Score = 0.705 × 0.774 × 0.000 × 0.516 × 0.667 × 1.000 = 0.000 (due to freshness being 0)\n\n### Confidence Calculation:\n- BTC:\n  - Base Confidence = 0.774 × 0.544 × 0.655 = 0.274\n  - Freshness Penalty = 0.274 (no reduction since freshness is 0)\n  - Final Confidence = 0.274 (below 0.3, so set to 0.2)\n\n- ETH:\n  - Base Confidence = 0.774 × 0.516 × 0.667 = 0.251\n  - Freshness Penalty = 0.251 (no reduction since freshness is 0)\n  - Final Confidence = 0.251 (below 0.3, so set to 0.2)\n\nSince both assets have insufficient data due to the lack of fresh news, I will return HOLD with confidence 0.2 for both.\n\n### JSON Claims:\n\nTECHNICAL ANALYSIS:\nBTC shows a neutral RSI at 35.14, indicating that it is neither oversold nor overbought. The MACD is bearish at -1036.02, suggesting downward momentum. The Stochastic indicator is bullish at 18.33, indicating potential for upward movement, while the Williams %R is also bullish at -80.83, suggesting oversold conditions. The volatility is moderate at 0.281, which indicates potential for significant price movements. The overall signal strength is negative at -0.059, suggesting weak technical momentum. Given the mixed signals, the overall technical picture for BTC is neutral with bearish MACD but some bullish indicators.\n\nETH displays a neutral RSI at 43.11, indicating balanced buying and selling pressure. The MACD is bearish at -52.82, suggesting downward momentum. The Stochastic indicator is neutral at 32.70, and the Williams %R is also neutral at -64.69. The volatility is low at 0.225, indicating less potential for large price movements. The overall signal strength is neutral at 0.000, indicating a lack of clear momentum. The technical indicators suggest a cautious approach for ETH, with bearish MACD and neutral RSI.\n\nGiven the analysis, the confidence scores for BTC and ETH are derived from their respective indicators, with BTC having a higher confidence due to the alignment of multiple indicators despite the bearish MACD.\n\nNow, I will provide the claims in the specified JSON format:\n\n",
        "openaiResponse": "FUNDAMENTAL ANALYSIS:\nBTC demonstrates excellent liquidity with a liquidity score of 0.993 and a very high trading volume of approximately $2.36 billion, indicating strong market participation and stability in pricing. The on-chain health is solid with a score of 0.699, reflecting good network activity and address growth, which is crucial for long-term sustainability. Social engagement is high, with a sentiment score of 0.825 and perfect scores in social volume and engagement, suggesting a vibrant community and strong interest. Market cap health is exceptional at 1.000, indicating efficient supply utilization and likely institutional interest. However, there is a high-risk status due to potential volatility, although the drawdown risk is relatively low at 0.095. Overall, BTC shows strong fundamentals across all metrics, making it a compelling investment.\n\nETH, on the other hand, also exhibits excellent liquidity with a liquidity score of 0.995 and a trading volume of approximately $2.86 billion, indicating good market depth. However, its on-chain health is weaker at 0.389, suggesting challenges in network activity and UTXO health, which could impact its long-term viability. Social engagement remains strong with a sentiment score of 0.823 and high scores in social volume and engagement, indicating a healthy community. However, market cap health is concerning at 0.523, which may reflect inefficiencies or lower institutional interest. The risk profile is also high, with a profit-taking pressure score of 0.800, indicating potential selling pressure. Overall, while ETH has strong liquidity and social metrics, its on-chain health and market cap efficiency raise concerns.\n\nBased on these analyses, the following claims are made:\n\n```json\n{\n  \"claims\": [\n    {\n      \"ticker\": \"BTC\",\n      \"agentRole\": \"fundamental\",\n      \"claim\": \"BUY\",\n      \"confidence\": 0.85,\n      \"direction\": \"bullish\",\n      \"magnitude\": 0.7,\n      \"rationale\": \"BTC shows strong liquidity, solid on-chain health, and excellent social engagement, indicating a robust investment opportunity.\",\n      \"signals\": [\n        {\"name\": \"liquidity_score\", \"value\": 0.993},\n        {\"name\": \"on_chain_health\", \"value\": 0.699},\n        {\"name\": \"social_sentiment\", \"value\": 0.825},\n        {\"name\": \"market_cap_health\", \"value\": 1.000},\n        {\"name\": \"risk_adjustment\", \"value\": 0.609},\n        {\"name\": \"network_activity\", \"value\": 0.777},\n        {\"name\": \"address_growth\", \"value\": 1.000},\n        {\"name\": \"utxo_health\", \"value\": 1.000},\n        {\"name\": \"network_security\", \"value\": 1.000},\n        {\"name\": \"social_volume\", \"value\": 1.000},\n        {\"name\": \"social_engagement\", \"value\": 1.000},\n        {\"name\": \"sentiment_score\", \"value\": 0.780},\n        {\"name\": \"community_health\", \"value\": 0.512},\n        {\"name\": \"drawdown_risk\", \"value\": 0.095},\n        {\"name\": \"profit_taking_pressure\", \"value\": 0.400}\n      ],\n      \"evidence\": [\"REAL_EVIDENCE_ID_1\", \"REAL_EVIDENCE_ID_2\"]\n    },\n    {\n      \"ticker\": \"ETH\",\n      \"agentRole\": \"fundamental\",\n      \"claim\": \"HOLD\",\n      \"confidence\": 0.6,\n      \"direction\": \"neutral\",\n      \"magnitude\": 0.5,\n      \"rationale\": \"ETH has excellent liquidity and strong social metrics, but its on-chain health and market cap efficiency are concerning, warranting a cautious approach.\",\n      \"signals\": [\n        {\"name\": \"liquidity_score\", \"value\": 0.995},\n        {\"name\": \"on_chain_health\", \"value\": 0.389},\n        {\"name\": \"social_sentiment\", \"value\": 0.823},\n        {\"name\": \"market_cap_health\", \"value\": 0.523},\n        {\"name\": \"risk_adjustment\", \"value\": 0.687},\n        {\"name\": \"network_activity\", \"value\": 0.725},\n        {\"name\": \"address_growth\", \"value\": 1.000},\n        {\"name\": \"utxo_health\", \"value\": 0.000},\n        {\"name\": \"network_security\", \"value\": 0.000},\n        {\"name\": \"social_volume\", \"value\": 0.938},\n        {\"name\": \"social_engagement\", \"value\": 0.932},\n        {\"name\": \"sentiment_score\", \"value\": 0.820},\n        {\"name\": \"community_health\", \"value\": 0.579},\n        {\"name\": \"drawdown_risk\", \"value\": 0.089},\n        {\"name\": \"profit_taking_pressure\", \"value\": 0.800}\n      ],\n      \"evidence\": [\"REAL_EVIDENCE_ID_3\", \"REAL_EVIDENCE_ID_4\"]\n    }\n  ]\n}\n```\n\nSENTIMENT ANALYSIS:\nBTC shows a generally positive news sentiment with a strong coverage of 20 articles, indicating a robust market interest. The sentiment from news sources is relatively high at 0.725, but the freshness score is very low (0.000), which could dampen overall market enthusiasm. Social media engagement is significant, with a high volume of interactions and a GalaxyScore of 51.2, suggesting a moderately positive community sentiment. The Fear & Greed Index is neutral at 50, indicating a balanced market mood. However, the consistency of sentiment across sources is moderate (0.544), which may reflect some divergence in opinions. Overall, BTC sentiment is positive but tempered by the lack of recent news.\n\nETH also demonstrates a positive sentiment with a news sentiment score of 0.705 and the same strong coverage of 20 articles. Similar to BTC, ETH's news freshness is low (0.000), which may limit the impact of the positive news. Social media engagement is strong, with a GalaxyScore of 57.9, indicating a more favorable community sentiment compared to BTC. The Fear & Greed Index remains neutral at 50, suggesting a balanced outlook. The consistency of sentiment is slightly lower than BTC at 0.516, indicating some variability in the sentiment expressed across different sources. Overall, ETH sentiment is positive but also affected by the lack of recent updates.\n\nREVISED SUMMARY:\nBTC has a positive sentiment driven by strong news coverage and social media engagement, but the lack of fresh news may limit its impact. ETH shows similar positive sentiment with strong community support, but also suffers from low freshness. Both assets reflect a neutral market mood according to the Fear & Greed Index, with moderate consistency in sentiment across sources.\n\nAGGREGATE:\n- BTC: Positive sentiment with strong news coverage, but low freshness and moderate consistency.\n- ETH: Positive sentiment with strong community support, but low freshness and moderate consistency.\n\nNow, I will calculate the sentiment scores and prepare the claims.\n\n### Sentiment Score Calculation:\n- BTC:\n  - Average Sentiment = 0.725\n  - Coverage Norm = 0.774\n  - Freshness Score = 0.000\n  - Consistency = 0.544\n  - Credibility = 0.655\n  - Market Mood Factor = 1.000\n  - Sentiment Score = 0.725 × 0.774 × 0.000 × 0.544 × 0.655 × 1.000 = 0.000 (due to freshness being 0)\n\n- ETH:\n  - Average Sentiment = 0.705\n  - Coverage Norm = 0.774\n  - Freshness Score = 0.000\n  - Consistency = 0.516\n  - Credibility = 0.667\n  - Market Mood Factor = 1.000\n  - Sentiment Score = 0.705 × 0.774 × 0.000 × 0.516 × 0.667 × 1.000 = 0.000 (due to freshness being 0)\n\n### Confidence Calculation:\n- BTC:\n  - Base Confidence = 0.774 × 0.544 × 0.655 = 0.274\n  - Freshness Penalty = 0.274 (no reduction since freshness is 0)\n  - Final Confidence = 0.274 (below 0.3, so set to 0.2)\n\n- ETH:\n  - Base Confidence = 0.774 × 0.516 × 0.667 = 0.251\n  - Freshness Penalty = 0.251 (no reduction since freshness is 0)\n  - Final Confidence = 0.251 (below 0.3, so set to 0.2)\n\nSince both assets have insufficient data due to the lack of fresh news, I will return HOLD with confidence 0.2 for both.\n\n### JSON Claims:\n```json\n{\n  \"claims\": [\n    {\n      \"ticker\": \"BTC\",\n      \"agentRole\": \"sentiment\",\n      \"claim\": \"HOLD\",\n      \"confidence\": 0.2,\n      \"direction\": \"neutral\",\n      \"magnitude\": 0.0,\n      \"rationale\": \"Sentiment is positive but lacks fresh news, leading to low confidence.\",\n      \"signals\": [\n        {\"name\": \"sentiment_score\", \"value\": 0.000},\n        {\"name\": \"news_coverage\", \"value\": 20},\n        {\"name\": \"freshness_score\", \"value\": 0.000},\n        {\"name\": \"consistency\", \"value\": 0.544},\n        {\"name\": \"credibility\", \"value\": 0.655},\n        {\"name\": \"coverage_norm\", \"value\": 0.774},\n        {\"name\": \"market_mood_factor\", \"value\": 1.000},\n        {\"name\": \"social_volume\", \"value\": 134067},\n        {\"name\": \"galaxyscore\", \"value\": 51.2},\n        {\"name\": \"social_engagement\", \"value\": 2360951}\n      ],\n      \"evidence\": [],\n      \"riskFlags\": [\"old_news\"]\n    },\n    {\n      \"ticker\": \"ETH\",\n      \"agentRole\": \"sentiment\",\n      \"claim\": \"HOLD\",\n      \"confidence\": 0.2,\n      \"direction\": \"neutral\",\n      \"magnitude\": 0.0,\n      \"rationale\": \"Sentiment is positive but lacks fresh news, leading to low confidence.\",\n      \"signals\": [\n        {\"name\": \"sentiment_score\", \"value\": 0.000},\n        {\"name\": \"news_coverage\", \"value\": 20},\n        {\"name\": \"freshness_score\", \"value\": 0.000},\n        {\"name\": \"consistency\", \"value\": 0.516},\n        {\"name\": \"credibility\", \"value\": 0.667},\n        {\"name\": \"coverage_norm\", \"value\": 0.774},\n        {\"name\": \"market_mood_factor\", \"value\": 1.000},\n        {\"name\": \"social_volume\", \"value\": 93797},\n        {\"name\": \"galaxyscore\", \"value\": 57.9},\n        {\"name\": \"social_engagement\", \"value\": 931985}\n      ],\n      \"evidence\": [],\n      \"riskFlags\": [\"old_news\"]\n    }\n  ]\n}\n```\n\nTECHNICAL ANALYSIS:\nBTC shows a neutral RSI at 35.14, indicating that it is neither oversold nor overbought. The MACD is bearish at -1036.02, suggesting downward momentum. The Stochastic indicator is bullish at 18.33, indicating potential for upward movement, while the Williams %R is also bullish at -80.83, suggesting oversold conditions. The volatility is moderate at 0.281, which indicates potential for significant price movements. The overall signal strength is negative at -0.059, suggesting weak technical momentum. Given the mixed signals, the overall technical picture for BTC is neutral with bearish MACD but some bullish indicators.\n\nETH displays a neutral RSI at 43.11, indicating balanced buying and selling pressure. The MACD is bearish at -52.82, suggesting downward momentum. The Stochastic indicator is neutral at 32.70, and the Williams %R is also neutral at -64.69. The volatility is low at 0.225, indicating less potential for large price movements. The overall signal strength is neutral at 0.000, indicating a lack of clear momentum. The technical indicators suggest a cautious approach for ETH, with bearish MACD and neutral RSI.\n\nGiven the analysis, the confidence scores for BTC and ETH are derived from their respective indicators, with BTC having a higher confidence due to the alignment of multiple indicators despite the bearish MACD.\n\nNow, I will provide the claims in the specified JSON format:\n\n```json\n{\n  \"claims\": [\n    {\n      \"ticker\": \"BTC\",\n      \"agentRole\": \"technical\",\n      \"claim\": \"HOLD\",\n      \"confidence\": 0.72,\n      \"direction\": \"neutral\",\n      \"magnitude\": 0.5,\n      \"rationale\": \"Mixed signals with bearish MACD but bullish Stochastic and Williams %R suggest caution.\",\n      \"signals\": [\n        {\"name\": \"rsi\", \"value\": 35.14},\n        {\"name\": \"macd\", \"value\": -1036.02},\n        {\"name\": \"volatility_30d\", \"value\": 0.281},\n        {\"name\": \"signal_strength\", \"value\": -0.059}\n      ],\n      \"evidence\": [\"REAL_EVIDENCE_ID_1\", \"REAL_EVIDENCE_ID_2\"],\n      \"riskFlags\": [\"moderate_volatility\", \"mixed_signals\"]\n    },\n    {\n      \"ticker\": \"ETH\",\n      \"agentRole\": \"technical\",\n      \"claim\": \"HOLD\",\n      \"confidence\": 0.2,\n      \"direction\": \"neutral\",\n      \"magnitude\": 0.1,\n      \"rationale\": \"Insufficient alignment of indicators and bearish MACD suggest a cautious approach.\",\n      \"signals\": [\n        {\"name\": \"rsi\", \"value\": 43.11},\n        {\"name\": \"macd\", \"value\": -52.82},\n        {\"name\": \"volatility_30d\", \"value\": 0.225},\n        {\"name\": \"signal_strength\", \"value\": 0.000}\n      ],\n      \"evidence\": [\"REAL_EVIDENCE_ID_3\", \"REAL_EVIDENCE_ID_4\"],\n      \"riskFlags\": [\"low_volatility\", \"bearish_momentum\"]\n    }\n  ]\n}\n```\n\n"
      }
    }
  ]
}