{
  "testDate": "8/28/2025, 6:45:52 PM",
  "totalAgents": 3,
  "responses": [
    {
      "timestamp": "2025-08-28T14:44:14.011Z",
      "role": "fundamental",
      "context": {
        "universe": [
          "BTC",
          "ETH"
        ],
        "marketStats": 2,
        "facts": 11,
        "news": 0
      },
      "response": {
        "claims": [
          {
            "id": "BTC_fundamental_1756392156610_0",
            "ticker": "BTC",
            "agentRole": "fundamental",
            "claim": "BUY",
            "confidence": 0.833,
            "evidence": [
              "BTC_market_1756392254010",
              "BTC_market_1756392254010",
              "BTC_market_1756392254010"
            ],
            "timestamp": 1756392156610,
            "riskFlags": [],
            "direction": "bullish",
            "magnitude": 0.7,
            "rationale": "BTC shows strong fundamentals across all dimensions with excellent liquidity, strong on-chain activity, high social sentiment, and peak market cap health.",
            "signals": [
              {
                "name": "liquidity_score",
                "value": 0.601
              },
              {
                "name": "on_chain_health",
                "value": 0.678
              },
              {
                "name": "social_sentiment",
                "value": 0.843
              },
              {
                "name": "market_cap_health",
                "value": 1
              },
              {
                "name": "drawdown_risk",
                "value": 0.894
              },
              {
                "name": "profit_taking_pressure",
                "value": 0.993
              }
            ]
          },
          {
            "id": "ETH_fundamental_1756392156610_1",
            "ticker": "ETH",
            "agentRole": "fundamental",
            "claim": "HOLD",
            "confidence": 0.737,
            "evidence": [
              "ETH_market_1756392254011",
              "ETH_market_1756392254011",
              "ETH_market_1756392254011"
            ],
            "timestamp": 1756392156610,
            "riskFlags": [],
            "direction": "neutral",
            "magnitude": 0.6,
            "rationale": "ETH shows good fundamentals with excellent liquidity and high social sentiment, but there is room for improvement in on-chain activity and market cap health.",
            "signals": [
              {
                "name": "liquidity_score",
                "value": 0.801
              },
              {
                "name": "on_chain_health",
                "value": 0.366
              },
              {
                "name": "social_sentiment",
                "value": 0.809
              },
              {
                "name": "market_cap_health",
                "value": 0.523
              },
              {
                "name": "drawdown_risk",
                "value": 0.91
              },
              {
                "name": "profit_taking_pressure",
                "value": 0.961
              }
            ]
          }
        ],
        "textPart": "FUNDAMENTAL ANALYSIS:\n\nBTC shows excellent liquidity with a score of 0.601, indicating a robust market with high volume and tight spreads. The on-chain activity is strong with a network health score of 0.678, suggesting a healthy network with high transaction volume and address growth. Social sentiment is high at 0.843, indicating a strong community engagement and positive sentiment towards the asset. Market cap health is at its peak, suggesting strong institutional backing and a well-distributed supply. Risk factors are well-managed with a drawdown risk of 0.894 and a profit-taking pressure of 0.993, indicating a low risk of significant price drops and a high likelihood of profit realization. Overall, BTC demonstrates strong fundamentals across all dimensions with a fundamental score of 0.833.\n\nETH, on the other hand, also shows excellent liquidity with a score of 0.801, indicating a highly liquid market with ample trading volume. However, its on-chain activity is only moderate with a network health score of 0.366, suggesting a lower level of network usage compared to BTC. Social sentiment is high at 0.809, indicating a strong community engagement and positive sentiment towards the asset. Market cap health is moderate at 0.523, suggesting a less robust institutional backing compared to BTC. Risk factors are well-managed with a drawdown risk of 0.910 and a profit-taking pressure of 0.961, indicating a low risk of significant price drops and a high likelihood of profit realization. Overall, ETH demonstrates good fundamentals with a fundamental score of 0.737, but there is room for improvement in on-chain activity and market cap health.\n\nBased on the above analysis, here are the claims:",
        "jsonPart": {
          "claims": [
            {
              "ticker": "BTC",
              "agentRole": "fundamental",
              "claim": "BUY",
              "confidence": 0.833,
              "direction": "bullish",
              "magnitude": 0.7,
              "rationale": "BTC shows strong fundamentals across all dimensions with excellent liquidity, strong on-chain activity, high social sentiment, and peak market cap health.",
              "signals": [
                {
                  "name": "liquidity_score",
                  "value": 0.601
                },
                {
                  "name": "on_chain_health",
                  "value": 0.678
                },
                {
                  "name": "social_sentiment",
                  "value": 0.843
                },
                {
                  "name": "market_cap_health",
                  "value": 1
                },
                {
                  "name": "drawdown_risk",
                  "value": 0.894
                },
                {
                  "name": "profit_taking_pressure",
                  "value": 0.993
                }
              ],
              "evidence": [
                "1756392156610"
              ],
              "riskFlags": []
            },
            {
              "ticker": "ETH",
              "agentRole": "fundamental",
              "claim": "HOLD",
              "confidence": 0.737,
              "direction": "neutral",
              "magnitude": 0.6,
              "rationale": "ETH shows good fundamentals with excellent liquidity and high social sentiment, but there is room for improvement in on-chain activity and market cap health.",
              "signals": [
                {
                  "name": "liquidity_score",
                  "value": 0.801
                },
                {
                  "name": "on_chain_health",
                  "value": 0.366
                },
                {
                  "name": "social_sentiment",
                  "value": 0.809
                },
                {
                  "name": "market_cap_health",
                  "value": 0.523
                },
                {
                  "name": "drawdown_risk",
                  "value": 0.91
                },
                {
                  "name": "profit_taking_pressure",
                  "value": 0.961
                }
              ],
              "evidence": [
                "1756392156610"
              ],
              "riskFlags": []
            }
          ]
        },
        "openaiResponse": "FUNDAMENTAL ANALYSIS:\n\nBTC shows excellent liquidity with a score of 0.601, indicating a robust market with high volume and tight spreads. The on-chain activity is strong with a network health score of 0.678, suggesting a healthy network with high transaction volume and address growth. Social sentiment is high at 0.843, indicating a strong community engagement and positive sentiment towards the asset. Market cap health is at its peak, suggesting strong institutional backing and a well-distributed supply. Risk factors are well-managed with a drawdown risk of 0.894 and a profit-taking pressure of 0.993, indicating a low risk of significant price drops and a high likelihood of profit realization. Overall, BTC demonstrates strong fundamentals across all dimensions with a fundamental score of 0.833.\n\nETH, on the other hand, also shows excellent liquidity with a score of 0.801, indicating a highly liquid market with ample trading volume. However, its on-chain activity is only moderate with a network health score of 0.366, suggesting a lower level of network usage compared to BTC. Social sentiment is high at 0.809, indicating a strong community engagement and positive sentiment towards the asset. Market cap health is moderate at 0.523, suggesting a less robust institutional backing compared to BTC. Risk factors are well-managed with a drawdown risk of 0.910 and a profit-taking pressure of 0.961, indicating a low risk of significant price drops and a high likelihood of profit realization. Overall, ETH demonstrates good fundamentals with a fundamental score of 0.737, but there is room for improvement in on-chain activity and market cap health.\n\nBased on the above analysis, here are the claims:\n\n{\n  \"claims\": [\n    {\n      \"ticker\": \"BTC\",\n      \"agentRole\": \"fundamental\",\n      \"claim\": \"BUY\",\n      \"confidence\": 0.833,\n      \"direction\": \"bullish\",\n      \"magnitude\": 0.7,\n      \"rationale\": \"BTC shows strong fundamentals across all dimensions with excellent liquidity, strong on-chain activity, high social sentiment, and peak market cap health.\",\n      \"signals\": [\n        {\"name\": \"liquidity_score\", \"value\": 0.601},\n        {\"name\": \"on_chain_health\", \"value\": 0.678},\n        {\"name\": \"social_sentiment\", \"value\": 0.843},\n        {\"name\": \"market_cap_health\", \"value\": 1.000},\n        {\"name\": \"drawdown_risk\", \"value\": 0.894},\n        {\"name\": \"profit_taking_pressure\", \"value\": 0.993}\n      ],\n      \"evidence\": [\"1756392156610\"],\n      \"riskFlags\": []\n    },\n    {\n      \"ticker\": \"ETH\",\n      \"agentRole\": \"fundamental\",\n      \"claim\": \"HOLD\",\n      \"confidence\": 0.737,\n      \"direction\": \"neutral\",\n      \"magnitude\": 0.6,\n      \"rationale\": \"ETH shows good fundamentals with excellent liquidity and high social sentiment, but there is room for improvement in on-chain activity and market cap health.\",\n      \"signals\": [\n        {\"name\": \"liquidity_score\", \"value\": 0.801},\n        {\"name\": \"on_chain_health\", \"value\": 0.366},\n        {\"name\": \"social_sentiment\", \"value\": 0.809},\n        {\"name\": \"market_cap_health\", \"value\": 0.523},\n        {\"name\": \"drawdown_risk\", \"value\": 0.910},\n        {\"name\": \"profit_taking_pressure\", \"value\": 0.961}\n      ],\n      \"evidence\": [\"1756392156610\"],\n      \"riskFlags\": []\n    }\n  ]\n}"
      }
    },
    {
      "timestamp": "2025-08-28T14:44:51.639Z",
      "role": "sentiment",
      "context": {
        "universe": [
          "BTC",
          "ETH"
        ],
        "marketStats": 2,
        "facts": 11,
        "news": 0
      },
      "response": {
        "claims": [
          {
            "id": "BTC_sentiment_1756392156610_0",
            "ticker": "BTC",
            "agentRole": "sentiment",
            "claim": "HOLD",
            "confidence": 0.65,
            "evidence": [],
            "timestamp": 1756392156610,
            "riskFlags": [
              "low_sentiment_score",
              "mixed_news_sentiment"
            ],
            "direction": "neutral",
            "magnitude": 0.25,
            "rationale": "Mixed sentiment in the news and positive sentiment in the social media space.",
            "signals": [
              {
                "name": "sentiment_score",
                "value": 0.25
              },
              {
                "name": "news_coverage",
                "value": 20
              },
              {
                "name": "freshness_score",
                "value": 0
              },
              {
                "name": "consistency",
                "value": 0.558
              },
              {
                "name": "credibility",
                "value": 0.657
              },
              {
                "name": "coverage_norm",
                "value": 0.774
              },
              {
                "name": "market_mood_factor",
                "value": 1
              },
              {
                "name": "social_volume",
                "value": 141440
              },
              {
                "name": "galaxyscore",
                "value": 58.1
              },
              {
                "name": "social_engagement",
                "value": 3519206
              }
            ]
          },
          {
            "id": "ETH_sentiment_1756392156610_1",
            "ticker": "ETH",
            "agentRole": "sentiment",
            "claim": "SELL",
            "confidence": 0.55,
            "evidence": [
              "ETH_news_1756392291639",
              "ETH_news_1756392291639",
              "ETH_news_1756392291639"
            ],
            "timestamp": 1756392156610,
            "riskFlags": [
              "low_sentiment_score",
              "mixed_news_sentiment"
            ],
            "direction": "bearish",
            "magnitude": 0.225,
            "rationale": "Mixed sentiment in the news and social media space.",
            "signals": [
              {
                "name": "sentiment_score",
                "value": 0.225
              },
              {
                "name": "news_coverage",
                "value": 20
              },
              {
                "name": "freshness_score",
                "value": 0
              },
              {
                "name": "consistency",
                "value": 0.521
              },
              {
                "name": "credibility",
                "value": 0.657
              },
              {
                "name": "coverage_norm",
                "value": 0.774
              },
              {
                "name": "market_mood_factor",
                "value": 1
              },
              {
                "name": "social_volume",
                "value": 101641
              },
              {
                "name": "galaxyscore",
                "value": 37.7
              },
              {
                "name": "social_engagement",
                "value": 1603008
              }
            ]
          }
        ],
        "textPart": "SUMMARIZE:\n- BTC has a final sentiment score of 0.250, with 20 news articles showing a mixed sentiment. Social volume and GalaxyScore are relatively high.\n- ETH has a final sentiment score of 0.225, with 20 news articles showing a mixed sentiment. Social volume and GalaxyScore are lower than BTC.\n\nREFLECT/CRITICIZE:\n- The sentiment scores for both BTC and ETH are low, indicating a bearish sentiment. However, the high social volume and GalaxyScore for BTC suggest a more positive sentiment in the social media space.\n- The news coverage for both assets is high, but the sentiment is mixed, which could indicate uncertainty in the market.\n\nREVISE:\n- BTC has a mixed sentiment in the news but a more positive sentiment in the social media space. This could indicate a potential bullish trend despite the low final sentiment score.\n- ETH has a mixed sentiment in both the news and social media space, indicating uncertainty and potential bearish trend.\n\nAGGREGATE:\n- For BTC, the sentiment analysis suggests a HOLD position due to the mixed sentiment in the news and the positive sentiment in the social media space.\n- For ETH, the sentiment analysis suggests a SELL position due to the mixed sentiment in the news and social media space.",
        "jsonPart": {
          "claims": [
            {
              "ticker": "BTC",
              "agentRole": "sentiment",
              "claim": "HOLD",
              "confidence": 0.65,
              "direction": "neutral",
              "magnitude": 0.25,
              "rationale": "Mixed sentiment in the news and positive sentiment in the social media space.",
              "signals": [
                {
                  "name": "sentiment_score",
                  "value": 0.25
                },
                {
                  "name": "news_coverage",
                  "value": 20
                },
                {
                  "name": "freshness_score",
                  "value": 0
                },
                {
                  "name": "consistency",
                  "value": 0.558
                },
                {
                  "name": "credibility",
                  "value": 0.657
                },
                {
                  "name": "coverage_norm",
                  "value": 0.774
                },
                {
                  "name": "market_mood_factor",
                  "value": 1
                },
                {
                  "name": "social_volume",
                  "value": 141440
                },
                {
                  "name": "galaxyscore",
                  "value": 58.1
                },
                {
                  "name": "social_engagement",
                  "value": 3519206
                }
              ],
              "riskFlags": [
                "low_sentiment_score",
                "mixed_news_sentiment"
              ]
            },
            {
              "ticker": "ETH",
              "agentRole": "sentiment",
              "claim": "SELL",
              "confidence": 0.55,
              "direction": "bearish",
              "magnitude": 0.225,
              "rationale": "Mixed sentiment in the news and social media space.",
              "signals": [
                {
                  "name": "sentiment_score",
                  "value": 0.225
                },
                {
                  "name": "news_coverage",
                  "value": 20
                },
                {
                  "name": "freshness_score",
                  "value": 0
                },
                {
                  "name": "consistency",
                  "value": 0.521
                },
                {
                  "name": "credibility",
                  "value": 0.657
                },
                {
                  "name": "coverage_norm",
                  "value": 0.774
                },
                {
                  "name": "market_mood_factor",
                  "value": 1
                },
                {
                  "name": "social_volume",
                  "value": 101641
                },
                {
                  "name": "galaxyscore",
                  "value": 37.7
                },
                {
                  "name": "social_engagement",
                  "value": 1603008
                }
              ],
              "riskFlags": [
                "low_sentiment_score",
                "mixed_news_sentiment"
              ]
            }
          ]
        },
        "openaiResponse": "SUMMARIZE:\n- BTC has a final sentiment score of 0.250, with 20 news articles showing a mixed sentiment. Social volume and GalaxyScore are relatively high.\n- ETH has a final sentiment score of 0.225, with 20 news articles showing a mixed sentiment. Social volume and GalaxyScore are lower than BTC.\n\nREFLECT/CRITICIZE:\n- The sentiment scores for both BTC and ETH are low, indicating a bearish sentiment. However, the high social volume and GalaxyScore for BTC suggest a more positive sentiment in the social media space.\n- The news coverage for both assets is high, but the sentiment is mixed, which could indicate uncertainty in the market.\n\nREVISE:\n- BTC has a mixed sentiment in the news but a more positive sentiment in the social media space. This could indicate a potential bullish trend despite the low final sentiment score.\n- ETH has a mixed sentiment in both the news and social media space, indicating uncertainty and potential bearish trend.\n\nAGGREGATE:\n- For BTC, the sentiment analysis suggests a HOLD position due to the mixed sentiment in the news and the positive sentiment in the social media space.\n- For ETH, the sentiment analysis suggests a SELL position due to the mixed sentiment in the news and social media space.\n\n{\n  \"claims\": [\n    {\n      \"ticker\": \"BTC\",\n      \"agentRole\": \"sentiment\",\n      \"claim\": \"HOLD\",\n      \"confidence\": 0.65,\n      \"direction\": \"neutral\",\n      \"magnitude\": 0.25,\n      \"rationale\": \"Mixed sentiment in the news and positive sentiment in the social media space.\",\n      \"signals\": [\n        {\"name\": \"sentiment_score\", \"value\": 0.25},\n        {\"name\": \"news_coverage\", \"value\": 20},\n        {\"name\": \"freshness_score\", \"value\": 0.0},\n        {\"name\": \"consistency\", \"value\": 0.558},\n        {\"name\": \"credibility\", \"value\": 0.657},\n        {\"name\": \"coverage_norm\", \"value\": 0.774},\n        {\"name\": \"market_mood_factor\", \"value\": 1.0},\n        {\"name\": \"social_volume\", \"value\": 141440},\n        {\"name\": \"galaxyscore\", \"value\": 58.1},\n        {\"name\": \"social_engagement\", \"value\": 3519206}\n      ],\n      \"riskFlags\": [\"low_sentiment_score\", \"mixed_news_sentiment\"]\n    },\n    {\n      \"ticker\": \"ETH\",\n      \"agentRole\": \"sentiment\",\n      \"claim\": \"SELL\",\n      \"confidence\": 0.55,\n      \"direction\": \"bearish\",\n      \"magnitude\": 0.225,\n      \"rationale\": \"Mixed sentiment in the news and social media space.\",\n      \"signals\": [\n        {\"name\": \"sentiment_score\", \"value\": 0.225},\n        {\"name\": \"news_coverage\", \"value\": 20},\n        {\"name\": \"freshness_score\", \"value\": 0.0},\n        {\"name\": \"consistency\", \"value\": 0.521},\n        {\"name\": \"credibility\", \"value\": 0.657},\n        {\"name\": \"coverage_norm\", \"value\": 0.774},\n        {\"name\": \"market_mood_factor\", \"value\": 1.0},\n        {\"name\": \"social_volume\", \"value\": 101641},\n        {\"name\": \"galaxyscore\", \"value\": 37.7},\n        {\"name\": \"social_engagement\", \"value\": 1603008}\n      ],\n      \"riskFlags\": [\"low_sentiment_score\", \"mixed_news_sentiment\"]\n    }\n  ]\n}"
      }
    },
    {
      "timestamp": "2025-08-28T14:45:28.282Z",
      "role": "technical",
      "context": {
        "universe": [
          "BTC",
          "ETH"
        ],
        "marketStats": 2,
        "facts": 11,
        "news": 0
      },
      "response": {
        "claims": [
          {
            "id": "BTC_technical_1756392156610_0",
            "ticker": "BTC",
            "agentRole": "technical",
            "claim": "SELL",
            "confidence": 0.6,
            "evidence": [],
            "timestamp": 1756392156610,
            "riskFlags": [
              "high_volatility",
              "weak_signals"
            ],
            "direction": "bearish",
            "magnitude": 0.7,
            "rationale": "Bearish MACD, Stochastic and Bollinger Bands signals, neutral RSI, and negative signal strength suggest a potential price drop.",
            "signals": [
              {
                "name": "rsi",
                "value": 55.13
              },
              {
                "name": "macd",
                "value": -107.33
              },
              {
                "name": "volatility_30d",
                "value": 0.3
              },
              {
                "name": "stochastic",
                "value": 91.49
              },
              {
                "name": "bollinger_bands",
                "value": 1836.99
              },
              {
                "name": "signal_strength",
                "value": -0.65
              }
            ]
          },
          {
            "id": "ETH_technical_1756392156610_1",
            "ticker": "ETH",
            "agentRole": "technical",
            "claim": "HOLD",
            "confidence": 0.5,
            "evidence": [],
            "timestamp": 1756392156610,
            "riskFlags": [
              "high_volatility",
              "weak_signals"
            ],
            "direction": "neutral",
            "magnitude": 0.5,
            "rationale": "Mixed signals from bullish MACD, bearish Bollinger Bands, neutral RSI and Stochastic, and positive but weak signal strength suggest a cautious approach.",
            "signals": [
              {
                "name": "rsi",
                "value": 50.18
              },
              {
                "name": "macd",
                "value": 3.26
              },
              {
                "name": "volatility_30d",
                "value": 0.3
              },
              {
                "name": "stochastic",
                "value": 73.31
              },
              {
                "name": "bollinger_bands",
                "value": 16.03
              },
              {
                "name": "signal_strength",
                "value": 0.12
              }
            ]
          }
        ],
        "textPart": "TECHNICAL ANALYSIS:\n\nBTC shows a neutral RSI at 55.13, indicating neither oversold nor overbought conditions. The MACD is bearish at -107.33, suggesting downward momentum. The Stochastic is at 91.49, which is in the overbought territory, indicating a potential price reversal. The Bollinger Bands value is 1836.99, which is bearish as the price is near the upper band. The signal strength is negative at -0.65, indicating weak technical momentum. The volatility is moderate at 0.3, indicating potential for significant moves. Overall, the technical picture is mixed with bearish MACD, Stochastic and Bollinger Bands but neutral RSI.\n\nETH displays a neutral RSI at 50.18, suggesting balanced buying and selling pressure. The MACD is bullish at 3.26, indicating upward momentum. The Stochastic is at 73.31, which is neutral. The Bollinger Bands value is 16.03, which is bearish as the price is near the upper band. The signal strength is positive at 0.12, indicating weak technical momentum. The volatility is moderate at 0.3, similar to BTC. The technical indicators suggest a cautious approach with mixed signals.\n\nCLAIMS:",
        "jsonPart": {
          "claims": [
            {
              "ticker": "BTC",
              "agentRole": "technical",
              "claim": "SELL",
              "confidence": 0.6,
              "direction": "bearish",
              "magnitude": 0.7,
              "rationale": "Bearish MACD, Stochastic and Bollinger Bands signals, neutral RSI, and negative signal strength suggest a potential price drop.",
              "signals": [
                {
                  "name": "rsi",
                  "value": 55.13
                },
                {
                  "name": "macd",
                  "value": -107.33
                },
                {
                  "name": "volatility_30d",
                  "value": 0.3
                },
                {
                  "name": "stochastic",
                  "value": 91.49
                },
                {
                  "name": "bollinger_bands",
                  "value": 1836.99
                },
                {
                  "name": "signal_strength",
                  "value": -0.65
                }
              ],
              "evidence": [
                "1756392156610"
              ],
              "riskFlags": [
                "high_volatility",
                "weak_signals"
              ]
            },
            {
              "ticker": "ETH",
              "agentRole": "technical",
              "claim": "HOLD",
              "confidence": 0.5,
              "direction": "neutral",
              "magnitude": 0.5,
              "rationale": "Mixed signals from bullish MACD, bearish Bollinger Bands, neutral RSI and Stochastic, and positive but weak signal strength suggest a cautious approach.",
              "signals": [
                {
                  "name": "rsi",
                  "value": 50.18
                },
                {
                  "name": "macd",
                  "value": 3.26
                },
                {
                  "name": "volatility_30d",
                  "value": 0.3
                },
                {
                  "name": "stochastic",
                  "value": 73.31
                },
                {
                  "name": "bollinger_bands",
                  "value": 16.03
                },
                {
                  "name": "signal_strength",
                  "value": 0.12
                }
              ],
              "evidence": [
                "1756392156610"
              ],
              "riskFlags": [
                "high_volatility",
                "weak_signals"
              ]
            }
          ]
        },
        "openaiResponse": "TECHNICAL ANALYSIS:\n\nBTC shows a neutral RSI at 55.13, indicating neither oversold nor overbought conditions. The MACD is bearish at -107.33, suggesting downward momentum. The Stochastic is at 91.49, which is in the overbought territory, indicating a potential price reversal. The Bollinger Bands value is 1836.99, which is bearish as the price is near the upper band. The signal strength is negative at -0.65, indicating weak technical momentum. The volatility is moderate at 0.3, indicating potential for significant moves. Overall, the technical picture is mixed with bearish MACD, Stochastic and Bollinger Bands but neutral RSI.\n\nETH displays a neutral RSI at 50.18, suggesting balanced buying and selling pressure. The MACD is bullish at 3.26, indicating upward momentum. The Stochastic is at 73.31, which is neutral. The Bollinger Bands value is 16.03, which is bearish as the price is near the upper band. The signal strength is positive at 0.12, indicating weak technical momentum. The volatility is moderate at 0.3, similar to BTC. The technical indicators suggest a cautious approach with mixed signals.\n\nCLAIMS:\n\n{\n  \"claims\": [\n    {\n      \"ticker\": \"BTC\",\n      \"agentRole\": \"technical\",\n      \"claim\": \"SELL\",\n      \"confidence\": 0.6,\n      \"direction\": \"bearish\",\n      \"magnitude\": 0.7,\n      \"rationale\": \"Bearish MACD, Stochastic and Bollinger Bands signals, neutral RSI, and negative signal strength suggest a potential price drop.\",\n      \"signals\": [\n        {\"name\": \"rsi\", \"value\": 55.13},\n        {\"name\": \"macd\", \"value\": -107.33},\n        {\"name\": \"volatility_30d\", \"value\": 0.3},\n        {\"name\": \"stochastic\", \"value\": 91.49},\n        {\"name\": \"bollinger_bands\", \"value\": 1836.99},\n        {\"name\": \"signal_strength\", \"value\": -0.65}\n      ],\n      \"evidence\": [\"1756392156610\"],\n      \"riskFlags\": [\"high_volatility\", \"weak_signals\"]\n    },\n    {\n      \"ticker\": \"ETH\",\n      \"agentRole\": \"technical\",\n      \"claim\": \"HOLD\",\n      \"confidence\": 0.5,\n      \"direction\": \"neutral\",\n      \"magnitude\": 0.5,\n      \"rationale\": \"Mixed signals from bullish MACD, bearish Bollinger Bands, neutral RSI and Stochastic, and positive but weak signal strength suggest a cautious approach.\",\n      \"signals\": [\n        {\"name\": \"rsi\", \"value\": 50.18},\n        {\"name\": \"macd\", \"value\": 3.26},\n        {\"name\": \"volatility_30d\", \"value\": 0.3},\n        {\"name\": \"stochastic\", \"value\": 73.31},\n        {\"name\": \"bollinger_bands\", \"value\": 16.03},\n        {\"name\": \"signal_strength\", \"value\": 0.12}\n      ],\n      \"evidence\": [\"1756392156610\"],\n      \"riskFlags\": [\"high_volatility\", \"weak_signals\"]\n    }\n  ]\n}"
      }
    }
  ]
}