{
  "testDate": "8/28/2025, 4:40:40 PM",
  "totalAgents": 3,
  "responses": [
    {
      "timestamp": "2025-08-28T12:39:16.573Z",
      "role": "fundamental",
      "context": {
        "universe": [
          "BTC",
          "ETH"
        ],
        "marketStats": 2,
        "facts": 11,
        "news": 0
      },
      "response": {
        "claims": [
          {
            "id": "BTC_fundamental_1756384671364_0",
            "ticker": "BTC",
            "agentRole": "fundamental",
            "claim": "HOLD",
            "confidence": 0.2,
            "evidence": [
              "BTC_market_1756384756573",
              "BTC_market_1756384756573",
              "BTC_market_1756384756573"
            ],
            "timestamp": 1756384671364,
            "riskFlags": [
              "low_liquidity"
            ],
            "direction": "neutral",
            "magnitude": 0,
            "rationale": "Insufficient data for comprehensive fundamental analysis. Current market statistics suggest potential liquidity concerns.",
            "signals": [
              {
                "name": "liquidity_score",
                "value": 0
              }
            ]
          },
          {
            "id": "ETH_fundamental_1756384671364_1",
            "ticker": "ETH",
            "agentRole": "fundamental",
            "claim": "HOLD",
            "confidence": 0.2,
            "evidence": [
              "ETH_market_1756384756573",
              "ETH_market_1756384756573",
              "ETH_market_1756384756573"
            ],
            "timestamp": 1756384671364,
            "riskFlags": [
              "low_liquidity"
            ],
            "direction": "neutral",
            "magnitude": 0,
            "rationale": "Insufficient data for comprehensive fundamental analysis. Current market statistics suggest better liquidity compared to BTC.",
            "signals": [
              {
                "name": "liquidity_score",
                "value": 0
              }
            ]
          }
        ],
        "textPart": "FUNDAMENTAL ANALYSIS:\n\nGiven the lack of specific fundamental data for both BTC and ETH, it's challenging to provide a comprehensive analysis. However, we can still make some general observations based on the available market statistics. \n\nBTC shows a relatively low volume compared to its price, which may indicate lower liquidity. This could potentially lead to higher price volatility and increased trading risk. Without additional on-chain, social, and risk metrics, it's difficult to assess the overall health of the BTC network and its community engagement.\n\nETH, on the other hand, has a significantly higher volume relative to its price, suggesting better liquidity. This could potentially lead to more stable pricing and lower trading risk. However, similar to BTC, the lack of additional on-chain, social, and risk metrics makes it difficult to evaluate the overall health of the ETH network and its community engagement.\n\nGiven the incomplete data, a neutral stance is recommended for both BTC and ETH until more comprehensive fundamental data is available.\n\nCLAIMS:",
        "jsonPart": {
          "claims": [
            {
              "ticker": "BTC",
              "agentRole": "fundamental",
              "claim": "HOLD",
              "confidence": 0.2,
              "direction": "neutral",
              "magnitude": 0,
              "rationale": "Insufficient data for comprehensive fundamental analysis. Current market statistics suggest potential liquidity concerns.",
              "signals": [
                {
                  "name": "liquidity_score",
                  "value": 0
                }
              ],
              "evidence": [
                "1756384671364"
              ],
              "riskFlags": [
                "low_liquidity"
              ]
            },
            {
              "ticker": "ETH",
              "agentRole": "fundamental",
              "claim": "HOLD",
              "confidence": 0.2,
              "direction": "neutral",
              "magnitude": 0,
              "rationale": "Insufficient data for comprehensive fundamental analysis. Current market statistics suggest better liquidity compared to BTC.",
              "signals": [
                {
                  "name": "liquidity_score",
                  "value": 0
                }
              ],
              "evidence": [
                "1756384671364"
              ],
              "riskFlags": [
                "low_liquidity"
              ]
            }
          ]
        },
        "openaiResponse": "FUNDAMENTAL ANALYSIS:\n\nGiven the lack of specific fundamental data for both BTC and ETH, it's challenging to provide a comprehensive analysis. However, we can still make some general observations based on the available market statistics. \n\nBTC shows a relatively low volume compared to its price, which may indicate lower liquidity. This could potentially lead to higher price volatility and increased trading risk. Without additional on-chain, social, and risk metrics, it's difficult to assess the overall health of the BTC network and its community engagement.\n\nETH, on the other hand, has a significantly higher volume relative to its price, suggesting better liquidity. This could potentially lead to more stable pricing and lower trading risk. However, similar to BTC, the lack of additional on-chain, social, and risk metrics makes it difficult to evaluate the overall health of the ETH network and its community engagement.\n\nGiven the incomplete data, a neutral stance is recommended for both BTC and ETH until more comprehensive fundamental data is available.\n\nCLAIMS:\n\n{\n  \"claims\": [\n    {\n      \"ticker\": \"BTC\",\n      \"agentRole\": \"fundamental\",\n      \"claim\": \"HOLD\",\n      \"confidence\": 0.2,\n      \"direction\": \"neutral\",\n      \"magnitude\": 0.0,\n      \"rationale\": \"Insufficient data for comprehensive fundamental analysis. Current market statistics suggest potential liquidity concerns.\",\n      \"signals\": [\n        {\"name\": \"liquidity_score\", \"value\": 0.0}\n      ],\n      \"evidence\": [\"1756384671364\"],\n      \"riskFlags\": [\"low_liquidity\"]\n    },\n    {\n      \"ticker\": \"ETH\",\n      \"agentRole\": \"fundamental\",\n      \"claim\": \"HOLD\",\n      \"confidence\": 0.2,\n      \"direction\": \"neutral\",\n      \"magnitude\": 0.0,\n      \"rationale\": \"Insufficient data for comprehensive fundamental analysis. Current market statistics suggest better liquidity compared to BTC.\",\n      \"signals\": [\n        {\"name\": \"liquidity_score\", \"value\": 0.0}\n      ],\n      \"evidence\": [\"1756384671364\"],\n      \"riskFlags\": [\"low_liquidity\"]\n    }\n  ]\n}"
      }
    },
    {
      "timestamp": "2025-08-28T12:40:00.849Z",
      "role": "sentiment",
      "context": {
        "universe": [
          "BTC",
          "ETH"
        ],
        "marketStats": 2,
        "facts": 11,
        "news": 0
      },
      "response": {
        "claims": [],
        "textPart": "SUMMARIZE:\n- BTC: The news sentiment is mixed with some positive news about purchases and support levels but also negative news about price drops. Social volume and GalaxyScore are relatively high.\n- ETH: The news sentiment is mostly positive with news about acquisitions and expansions but also negative news about outflows. Social volume and GalaxyScore are lower than BTC.\n\nREFLECT/CRITICIZE:\n- BTC: The summary might be slightly biased towards the positive news. The negative news about price drops could have a significant impact on the sentiment.\n- ETH: The summary might be overlooking the negative news about significant outflows which could impact the sentiment negatively.\n\nREVISE:\n- BTC: The news sentiment is mixed with significant negative news about price drops which could impact the sentiment negatively. Social volume and GalaxyScore are relatively high.\n- ETH: The news sentiment is mixed with significant negative news about outflows which could impact the sentiment negatively. Social volume and GalaxyScore are lower than BTC.\n\nAGGREGATE:\n- BTC: The overall sentiment is mixed with a slight lean towards negative due to the significant news about price drops. However, the high social volume and GalaxyScore indicate a strong interest and engagement in BTC.\n- ETH: The overall sentiment is mixed with a slight lean towards negative due to the significant news about outflows. The lower social volume and GalaxyScore indicate less interest and engagement in ETH compared to BTC.\n\n{\n  \"claims\": [\n    {\n      \"ticker\": \"BTC\",\n      \"agentRole\": \"sentiment\",\n      \"claim\": \"HOLD\",\n      \"confidence\": 0.6,\n      \"direction\": \"neutral\",\n      \"magnitude\": 0.5,\n      \"rationale\": \"Mixed news sentiment with significant negative news about price drops. High social volume and GalaxyScore indicate strong interest and engagement.\",\n      \"signals\": [\n        {\"name\": \"sentiment_score\", \"value\": 0.25},\n        {\"name\": \"news_coverage\", \"value\": 20},\n        {\"name\": \"freshness_score\", \"value\": 0.0},\n        {\"name\": \"consistency\", \"value\": 0.558},\n        {\"name\": \"credibility\", \"value\": 0.657},\n        {\"name\": \"coverage_norm\", \"value\": 0.774},\n        {\"name\": \"market_mood_factor\", \"value\": 1.0},\n        {\"name\": \"social_volume\", \"value\": 141807},\n        {\"name\": \"galaxyscore\", \"value\": 58.3},\n        {\"name\": \"social_engagement\", \"value\": 3310927}\n      ],\n      \"evidence\": [\n        {\"kind\": \"news\", \"source\": \"coindesk\", \"url\": \"https:\n        {\"kind\": \"index\", \"name\": \"fear_greed\", \"value\": 53, \"observedAt\": \"2024-01-01T00:00:00Z\"},\n        {\"kind\": \"social\", \"source\": \"signals\", \"metric\": \"galaxyscore\", \"value\": 58.3, \"observedAt\": \"2024-01-01T00:00:00Z\"}\n      ],\n      \"riskFlags\": [\"low_coverage\", \"old_news\", \"inconsistent_sentiment\"]\n    },\n    {\n      \"ticker\": \"ETH\",\n      \"agentRole\": \"sentiment\",\n      \"claim\": \"HOLD\",\n      \"confidence\": 0.5,\n      \"direction\": \"neutral\",\n      \"magnitude\": 0.4,\n      \"rationale\": \"Mixed news sentiment with significant negative news about outflows. Lower social volume and GalaxyScore indicate less interest and engagement compared to BTC.\",\n      \"signals\": [\n        {\"name\": \"sentiment_score\", \"value\": 0.228},\n        {\"name\": \"news_coverage\", \"value\": 20},\n        {\"name\": \"freshness_score\", \"value\": 0.0},\n        {\"name\": \"consistency\", \"value\": 0.521},\n        {\"name\": \"credibility\", \"value\": 0.657},\n        {\"name\": \"coverage_norm\", \"value\": 0.774},\n        {\"name\": \"market_mood_factor\", \"value\": 1.0},\n        {\"name\": \"social_volume\", \"value\": 102006},\n        {\"name\": \"galaxyscore\", \"value\": 39.8},\n        {\"name\": \"social_engagement\", \"value\": 1367084}\n      ],\n      \"evidence\": [\n        {\"kind\": \"news\", \"source\": \"coindesk\", \"url\": \"https:\n        {\"kind\": \"index\", \"name\": \"fear_greed\", \"value\": 53, \"observedAt\": \"2024-01-01T00:00:00Z\"},\n        {\"kind\": \"social\", \"source\": \"signals\", \"metric\": \"galaxyscore\", \"value\": 39.8, \"observedAt\": \"2024-01-01T00:00:00Z\"}\n      ],\n      \"riskFlags\": [\"low_coverage\", \"old_news\", \"inconsistent_sentiment\"]\n    }\n  ]\n}",
        "jsonPart": {
          "claims": [
            {
              "id": "833af991-5266-443b-bb0d-5920fdd06a49",
              "ticker": "UNKNOWN",
              "agentRole": "sentiment",
              "claim": "HOLD",
              "confidence": 0.2,
              "evidence": [],
              "timestamp": 1756384800848,
              "riskFlags": [
                "parse_error"
              ]
            }
          ]
        },
        "openaiResponse": "SUMMARIZE:\n- BTC: The news sentiment is mixed with some positive news about purchases and support levels but also negative news about price drops. Social volume and GalaxyScore are relatively high.\n- ETH: The news sentiment is mostly positive with news about acquisitions and expansions but also negative news about outflows. Social volume and GalaxyScore are lower than BTC.\n\nREFLECT/CRITICIZE:\n- BTC: The summary might be slightly biased towards the positive news. The negative news about price drops could have a significant impact on the sentiment.\n- ETH: The summary might be overlooking the negative news about significant outflows which could impact the sentiment negatively.\n\nREVISE:\n- BTC: The news sentiment is mixed with significant negative news about price drops which could impact the sentiment negatively. Social volume and GalaxyScore are relatively high.\n- ETH: The news sentiment is mixed with significant negative news about outflows which could impact the sentiment negatively. Social volume and GalaxyScore are lower than BTC.\n\nAGGREGATE:\n- BTC: The overall sentiment is mixed with a slight lean towards negative due to the significant news about price drops. However, the high social volume and GalaxyScore indicate a strong interest and engagement in BTC.\n- ETH: The overall sentiment is mixed with a slight lean towards negative due to the significant news about outflows. The lower social volume and GalaxyScore indicate less interest and engagement in ETH compared to BTC.\n\n{\n  \"claims\": [\n    {\n      \"ticker\": \"BTC\",\n      \"agentRole\": \"sentiment\",\n      \"claim\": \"HOLD\",\n      \"confidence\": 0.6,\n      \"direction\": \"neutral\",\n      \"magnitude\": 0.5,\n      \"rationale\": \"Mixed news sentiment with significant negative news about price drops. High social volume and GalaxyScore indicate strong interest and engagement.\",\n      \"signals\": [\n        {\"name\": \"sentiment_score\", \"value\": 0.25},\n        {\"name\": \"news_coverage\", \"value\": 20},\n        {\"name\": \"freshness_score\", \"value\": 0.0},\n        {\"name\": \"consistency\", \"value\": 0.558},\n        {\"name\": \"credibility\", \"value\": 0.657},\n        {\"name\": \"coverage_norm\", \"value\": 0.774},\n        {\"name\": \"market_mood_factor\", \"value\": 1.0},\n        {\"name\": \"social_volume\", \"value\": 141807},\n        {\"name\": \"galaxyscore\", \"value\": 58.3},\n        {\"name\": \"social_engagement\", \"value\": 3310927}\n      ],\n      \"evidence\": [\n        {\"kind\": \"news\", \"source\": \"coindesk\", \"url\": \"https://...\", \"publishedAt\": \"2024-01-01T00:00:00Z\", \"snippet\": \"...\"},\n        {\"kind\": \"index\", \"name\": \"fear_greed\", \"value\": 53, \"observedAt\": \"2024-01-01T00:00:00Z\"},\n        {\"kind\": \"social\", \"source\": \"signals\", \"metric\": \"galaxyscore\", \"value\": 58.3, \"observedAt\": \"2024-01-01T00:00:00Z\"}\n      ],\n      \"riskFlags\": [\"low_coverage\", \"old_news\", \"inconsistent_sentiment\"]\n    },\n    {\n      \"ticker\": \"ETH\",\n      \"agentRole\": \"sentiment\",\n      \"claim\": \"HOLD\",\n      \"confidence\": 0.5,\n      \"direction\": \"neutral\",\n      \"magnitude\": 0.4,\n      \"rationale\": \"Mixed news sentiment with significant negative news about outflows. Lower social volume and GalaxyScore indicate less interest and engagement compared to BTC.\",\n      \"signals\": [\n        {\"name\": \"sentiment_score\", \"value\": 0.228},\n        {\"name\": \"news_coverage\", \"value\": 20},\n        {\"name\": \"freshness_score\", \"value\": 0.0},\n        {\"name\": \"consistency\", \"value\": 0.521},\n        {\"name\": \"credibility\", \"value\": 0.657},\n        {\"name\": \"coverage_norm\", \"value\": 0.774},\n        {\"name\": \"market_mood_factor\", \"value\": 1.0},\n        {\"name\": \"social_volume\", \"value\": 102006},\n        {\"name\": \"galaxyscore\", \"value\": 39.8},\n        {\"name\": \"social_engagement\", \"value\": 1367084}\n      ],\n      \"evidence\": [\n        {\"kind\": \"news\", \"source\": \"coindesk\", \"url\": \"https://...\", \"publishedAt\": \"2024-01-01T00:00:00Z\", \"snippet\": \"...\"},\n        {\"kind\": \"index\", \"name\": \"fear_greed\", \"value\": 53, \"observedAt\": \"2024-01-01T00:00:00Z\"},\n        {\"kind\": \"social\", \"source\": \"signals\", \"metric\": \"galaxyscore\", \"value\": 39.8, \"observedAt\": \"2024-01-01T00:00:00Z\"}\n      ],\n      \"riskFlags\": [\"low_coverage\", \"old_news\", \"inconsistent_sentiment\"]\n    }\n  ]\n}"
      }
    },
    {
      "timestamp": "2025-08-28T12:40:20.512Z",
      "role": "technical",
      "context": {
        "universe": [
          "BTC",
          "ETH"
        ],
        "marketStats": 2,
        "facts": 11,
        "news": 0
      },
      "response": {
        "claims": [
          {
            "id": "BTC_technical_1756384671364_0",
            "ticker": "BTC",
            "agentRole": "technical",
            "claim": "SELL",
            "confidence": 0.7,
            "evidence": [],
            "timestamp": 1756384671364,
            "riskFlags": [
              "high_volatility",
              "weak_signals"
            ],
            "direction": "bearish",
            "magnitude": 0.6,
            "rationale": "The MACD and Stochastic indicators are bearish, and the signal strength is negative.",
            "signals": [
              {
                "name": "rsi",
                "value": 55.17
              },
              {
                "name": "macd",
                "value": -106.7
              },
              {
                "name": "volatility_30d",
                "value": 0.3
              },
              {
                "name": "sharpe_proxy",
                "value": -2.179
              },
              {
                "name": "signal_strength",
                "value": -0.654
              }
            ]
          },
          {
            "id": "ETH_technical_1756384671364_1",
            "ticker": "ETH",
            "agentRole": "technical",
            "claim": "HOLD",
            "confidence": 0.5,
            "evidence": [],
            "timestamp": 1756384671364,
            "riskFlags": [
              "high_volatility",
              "weak_signals"
            ],
            "direction": "neutral",
            "magnitude": 0.3,
            "rationale": "The MACD is bullish but the signal strength is weak, suggesting a cautious approach.",
            "signals": [
              {
                "name": "rsi",
                "value": 52.11
              },
              {
                "name": "macd",
                "value": 5.06
              },
              {
                "name": "volatility_30d",
                "value": 0.3
              },
              {
                "name": "sharpe_proxy",
                "value": 0.385
              },
              {
                "name": "signal_strength",
                "value": 0.115
              }
            ]
          }
        ],
        "textPart": "TECHNICAL ANALYSIS:\n\nBTC shows a neutral RSI at 55.17, indicating neither oversold nor overbought conditions. The MACD is bearish at -106.70, suggesting downward momentum. The Stochastic is at 92.37, indicating overbought conditions, and the Bollinger Bands are wide, suggesting high volatility. The signal strength is negative at -0.654, indicating weak technical momentum. Overall, the technical picture is mixed with bearish MACD and overbought Stochastic but neutral RSI.\n\nETH displays a neutral RSI at 52.11, suggesting balanced buying and selling pressure. The MACD is bullish at 5.06, indicating upward momentum. The Stochastic is at 76.24, which is neutral, and the Bollinger Bands are wide, suggesting high volatility. The signal strength is positive at 0.115, indicating weak technical momentum. The technical indicators suggest a cautious approach with mixed signals.\n\nCLAIMS:",
        "jsonPart": {
          "claims": [
            {
              "ticker": "BTC",
              "agentRole": "technical",
              "claim": "SELL",
              "confidence": 0.7,
              "direction": "bearish",
              "magnitude": 0.6,
              "rationale": "The MACD and Stochastic indicators are bearish, and the signal strength is negative.",
              "signals": [
                {
                  "name": "rsi",
                  "value": 55.17
                },
                {
                  "name": "macd",
                  "value": -106.7
                },
                {
                  "name": "volatility_30d",
                  "value": 0.3
                },
                {
                  "name": "sharpe_proxy",
                  "value": -2.179
                },
                {
                  "name": "signal_strength",
                  "value": -0.654
                }
              ],
              "evidence": [
                "1756384671364"
              ],
              "riskFlags": [
                "high_volatility",
                "weak_signals"
              ]
            },
            {
              "ticker": "ETH",
              "agentRole": "technical",
              "claim": "HOLD",
              "confidence": 0.5,
              "direction": "neutral",
              "magnitude": 0.3,
              "rationale": "The MACD is bullish but the signal strength is weak, suggesting a cautious approach.",
              "signals": [
                {
                  "name": "rsi",
                  "value": 52.11
                },
                {
                  "name": "macd",
                  "value": 5.06
                },
                {
                  "name": "volatility_30d",
                  "value": 0.3
                },
                {
                  "name": "sharpe_proxy",
                  "value": 0.385
                },
                {
                  "name": "signal_strength",
                  "value": 0.115
                }
              ],
              "evidence": [
                "1756384671364"
              ],
              "riskFlags": [
                "high_volatility",
                "weak_signals"
              ]
            }
          ]
        },
        "openaiResponse": "TECHNICAL ANALYSIS:\n\nBTC shows a neutral RSI at 55.17, indicating neither oversold nor overbought conditions. The MACD is bearish at -106.70, suggesting downward momentum. The Stochastic is at 92.37, indicating overbought conditions, and the Bollinger Bands are wide, suggesting high volatility. The signal strength is negative at -0.654, indicating weak technical momentum. Overall, the technical picture is mixed with bearish MACD and overbought Stochastic but neutral RSI.\n\nETH displays a neutral RSI at 52.11, suggesting balanced buying and selling pressure. The MACD is bullish at 5.06, indicating upward momentum. The Stochastic is at 76.24, which is neutral, and the Bollinger Bands are wide, suggesting high volatility. The signal strength is positive at 0.115, indicating weak technical momentum. The technical indicators suggest a cautious approach with mixed signals.\n\nCLAIMS:\n\n{\n  \"claims\": [\n    {\n      \"ticker\": \"BTC\",\n      \"agentRole\": \"technical\",\n      \"claim\": \"SELL\",\n      \"confidence\": 0.7,\n      \"direction\": \"bearish\",\n      \"magnitude\": 0.6,\n      \"rationale\": \"The MACD and Stochastic indicators are bearish, and the signal strength is negative.\",\n      \"signals\": [\n        {\"name\": \"rsi\", \"value\": 55.17},\n        {\"name\": \"macd\", \"value\": -106.70},\n        {\"name\": \"volatility_30d\", \"value\": 0.3},\n        {\"name\": \"sharpe_proxy\", \"value\": -2.179},\n        {\"name\": \"signal_strength\", \"value\": -0.654}\n      ],\n      \"evidence\": [\"1756384671364\"],\n      \"riskFlags\": [\"high_volatility\", \"weak_signals\"]\n    },\n    {\n      \"ticker\": \"ETH\",\n      \"agentRole\": \"technical\",\n      \"claim\": \"HOLD\",\n      \"confidence\": 0.5,\n      \"direction\": \"neutral\",\n      \"magnitude\": 0.3,\n      \"rationale\": \"The MACD is bullish but the signal strength is weak, suggesting a cautious approach.\",\n      \"signals\": [\n        {\"name\": \"rsi\", \"value\": 52.11},\n        {\"name\": \"macd\", \"value\": 5.06},\n        {\"name\": \"volatility_30d\", \"value\": 0.3},\n        {\"name\": \"sharpe_proxy\", \"value\": 0.385},\n        {\"name\": \"signal_strength\", \"value\": 0.115}\n      ],\n      \"evidence\": [\"1756384671364\"],\n      \"riskFlags\": [\"high_volatility\", \"weak_signals\"]\n    }\n  ]\n}"
      }
    }
  ]
}