{
  "testDate": "8/29/2025, 12:45:36 PM",
  "totalAgents": 3,
  "responses": [
    {
      "timestamp": "2025-08-29T08:44:03.685Z",
      "role": "fundamental",
      "context": {
        "universe": [
          "BTC",
          "ETH"
        ],
        "marketStats": 2,
        "facts": 11,
        "news": 0
      },
      "response": {
        "claims": [
          {
            "id": "BTC_fundamental_1756456945722_0",
            "ticker": "BTC",
            "agentRole": "fundamental",
            "claim": "BUY",
            "confidence": 0.831,
            "evidence": [
              "BTC_market_1756457043684",
              "BTC_market_1756457043684",
              "BTC_market_1756457043684"
            ],
            "timestamp": 1756456945722,
            "riskFlags": [
              "low_liquidity",
              "moderate_onchain"
            ],
            "direction": "bullish",
            "magnitude": 0.7,
            "rationale": "BTC shows excellent liquidity, moderate on-chain activity, high social engagement, and strong market cap health, indicating good fundamentals.",
            "signals": [
              {
                "name": "liquidity_score",
                "value": 0.588
              },
              {
                "name": "on_chain_health",
                "value": 0.677
              },
              {
                "name": "social_sentiment",
                "value": 0.86
              },
              {
                "name": "market_cap_health",
                "value": 1
              },
              {
                "name": "drawdown_risk",
                "value": 0.894
              },
              {
                "name": "profit_taking_pressure",
                "value": 0.993
              }
            ]
          },
          {
            "id": "ETH_fundamental_1756456945722_1",
            "ticker": "ETH",
            "agentRole": "fundamental",
            "claim": "HOLD",
            "confidence": 0.74,
            "evidence": [
              "ETH_market_1756457043685",
              "ETH_market_1756457043685",
              "ETH_market_1756457043685"
            ],
            "timestamp": 1756456945722,
            "riskFlags": [
              "moderate_onchain",
              "moderate_market_cap"
            ],
            "direction": "neutral",
            "magnitude": 0.5,
            "rationale": "ETH shows excellent liquidity and high social engagement, but moderate on-chain activity and market cap health suggest room for improvement.",
            "signals": [
              {
                "name": "liquidity_score",
                "value": 0.791
              },
              {
                "name": "on_chain_health",
                "value": 0.366
              },
              {
                "name": "social_sentiment",
                "value": 0.863
              },
              {
                "name": "market_cap_health",
                "value": 0.523
              },
              {
                "name": "drawdown_risk",
                "value": 0.91
              },
              {
                "name": "profit_taking_pressure",
                "value": 0.961
              }
            ]
          }
        ],
        "textPart": "FUNDAMENTAL ANALYSIS:\n\nBTC shows excellent liquidity with a liquidity score of 0.588 and a high volume of 14386.01173, indicating a robust market presence. The on-chain activity is moderate with a network activity score of 0.697, transaction efficiency of 0.010, and address growth of 1.000, suggesting a healthy network usage. The social engagement is high with a sentiment score of 0.790 and community health of 0.670. Market cap analysis suggests strong institutional backing with a market cap health of 1.000. The risk factors are well-managed with a drawdown risk of 0.894 and profit-taking pressure of 0.993. Overall, BTC demonstrates good fundamentals across all dimensions with a fundamental score of 0.831 and confidence of 1.000.\n\nETH demonstrates excellent liquidity with a liquidity score of 0.791 and a high volume of 558847.3526, suggesting a strong market presence. However, the on-chain activity is moderate with a network activity score of 0.620 and transaction efficiency of 0.046, indicating room for improvement in network usage. Social engagement is high with a sentiment score of 0.820 and community health of 0.633. Market cap analysis indicates moderate fundamentals with a market cap health of 0.523. The risk factors show a drawdown risk of 0.910 and profit-taking pressure of 0.961, suggesting a need for improved risk management. The fundamentals are sound with a fundamental score of 0.740 and confidence of 1.000, but there is room for improvement in on-chain activity and market cap health.",
        "jsonPart": {
          "claims": [
            {
              "ticker": "BTC",
              "agentRole": "fundamental",
              "claim": "BUY",
              "confidence": 0.831,
              "direction": "bullish",
              "magnitude": 0.7,
              "rationale": "BTC shows excellent liquidity, moderate on-chain activity, high social engagement, and strong market cap health, indicating good fundamentals.",
              "signals": [
                {
                  "name": "liquidity_score",
                  "value": 0.588
                },
                {
                  "name": "on_chain_health",
                  "value": 0.677
                },
                {
                  "name": "social_sentiment",
                  "value": 0.86
                },
                {
                  "name": "market_cap_health",
                  "value": 1
                },
                {
                  "name": "drawdown_risk",
                  "value": 0.894
                },
                {
                  "name": "profit_taking_pressure",
                  "value": 0.993
                }
              ],
              "evidence": [
                "REAL_EVIDENCE_ID_1",
                "REAL_EVIDENCE_ID_2"
              ],
              "riskFlags": [
                "low_liquidity",
                "moderate_onchain"
              ]
            },
            {
              "ticker": "ETH",
              "agentRole": "fundamental",
              "claim": "HOLD",
              "confidence": 0.74,
              "direction": "neutral",
              "magnitude": 0.5,
              "rationale": "ETH shows excellent liquidity and high social engagement, but moderate on-chain activity and market cap health suggest room for improvement.",
              "signals": [
                {
                  "name": "liquidity_score",
                  "value": 0.791
                },
                {
                  "name": "on_chain_health",
                  "value": 0.366
                },
                {
                  "name": "social_sentiment",
                  "value": 0.863
                },
                {
                  "name": "market_cap_health",
                  "value": 0.523
                },
                {
                  "name": "drawdown_risk",
                  "value": 0.91
                },
                {
                  "name": "profit_taking_pressure",
                  "value": 0.961
                }
              ],
              "evidence": [
                "REAL_EVIDENCE_ID_3",
                "REAL_EVIDENCE_ID_4"
              ],
              "riskFlags": [
                "moderate_onchain",
                "moderate_market_cap"
              ]
            }
          ]
        },
        "openaiResponse": "FUNDAMENTAL ANALYSIS:\n\nBTC shows excellent liquidity with a liquidity score of 0.588 and a high volume of 14386.01173, indicating a robust market presence. The on-chain activity is moderate with a network activity score of 0.697, transaction efficiency of 0.010, and address growth of 1.000, suggesting a healthy network usage. The social engagement is high with a sentiment score of 0.790 and community health of 0.670. Market cap analysis suggests strong institutional backing with a market cap health of 1.000. The risk factors are well-managed with a drawdown risk of 0.894 and profit-taking pressure of 0.993. Overall, BTC demonstrates good fundamentals across all dimensions with a fundamental score of 0.831 and confidence of 1.000.\n\nETH demonstrates excellent liquidity with a liquidity score of 0.791 and a high volume of 558847.3526, suggesting a strong market presence. However, the on-chain activity is moderate with a network activity score of 0.620 and transaction efficiency of 0.046, indicating room for improvement in network usage. Social engagement is high with a sentiment score of 0.820 and community health of 0.633. Market cap analysis indicates moderate fundamentals with a market cap health of 0.523. The risk factors show a drawdown risk of 0.910 and profit-taking pressure of 0.961, suggesting a need for improved risk management. The fundamentals are sound with a fundamental score of 0.740 and confidence of 1.000, but there is room for improvement in on-chain activity and market cap health.\n\n{\n  \"claims\": [\n    {\n      \"ticker\": \"BTC\",\n      \"agentRole\": \"fundamental\",\n      \"claim\": \"BUY\",\n      \"confidence\": 0.831,\n      \"direction\": \"bullish\",\n      \"magnitude\": 0.7,\n      \"rationale\": \"BTC shows excellent liquidity, moderate on-chain activity, high social engagement, and strong market cap health, indicating good fundamentals.\",\n      \"signals\": [\n        {\"name\": \"liquidity_score\", \"value\": 0.588},\n        {\"name\": \"on_chain_health\", \"value\": 0.677},\n        {\"name\": \"social_sentiment\", \"value\": 0.860},\n        {\"name\": \"market_cap_health\", \"value\": 1.000},\n        {\"name\": \"drawdown_risk\", \"value\": 0.894},\n        {\"name\": \"profit_taking_pressure\", \"value\": 0.993}\n      ],\n      \"evidence\": [\"REAL_EVIDENCE_ID_1\", \"REAL_EVIDENCE_ID_2\"],\n      \"riskFlags\": [\"low_liquidity\", \"moderate_onchain\"]\n    },\n    {\n      \"ticker\": \"ETH\",\n      \"agentRole\": \"fundamental\",\n      \"claim\": \"HOLD\",\n      \"confidence\": 0.740,\n      \"direction\": \"neutral\",\n      \"magnitude\": 0.5,\n      \"rationale\": \"ETH shows excellent liquidity and high social engagement, but moderate on-chain activity and market cap health suggest room for improvement.\",\n      \"signals\": [\n        {\"name\": \"liquidity_score\", \"value\": 0.791},\n        {\"name\": \"on_chain_health\", \"value\": 0.366},\n        {\"name\": \"social_sentiment\", \"value\": 0.863},\n        {\"name\": \"market_cap_health\", \"value\": 0.523},\n        {\"name\": \"drawdown_risk\", \"value\": 0.910},\n        {\"name\": \"profit_taking_pressure\", \"value\": 0.961}\n      ],\n      \"evidence\": [\"REAL_EVIDENCE_ID_3\", \"REAL_EVIDENCE_ID_4\"],\n      \"riskFlags\": [\"moderate_onchain\", \"moderate_market_cap\"]\n    }\n  ]\n}"
      }
    },
    {
      "timestamp": "2025-08-29T08:44:41.551Z",
      "role": "sentiment",
      "context": {
        "universe": [
          "BTC",
          "ETH"
        ],
        "marketStats": 2,
        "facts": 11,
        "news": 0
      },
      "response": {
        "claims": [
          {
            "id": "BTC_sentiment_1756456945722_0",
            "ticker": "BTC",
            "agentRole": "sentiment",
            "claim": "HOLD",
            "confidence": 0.6,
            "evidence": [],
            "timestamp": 1756456945722,
            "riskFlags": [
              "low_freshness"
            ],
            "direction": "neutral",
            "magnitude": 0.7,
            "rationale": "Despite positive news sentiment and high social activity, the low freshness score limits the impact of the news sentiment.",
            "signals": [
              {
                "name": "sentiment_score",
                "value": 0.26
              },
              {
                "name": "news_coverage",
                "value": 20
              },
              {
                "name": "freshness_score",
                "value": 0
              },
              {
                "name": "consistency",
                "value": 0.558
              },
              {
                "name": "credibility",
                "value": 0.657
              },
              {
                "name": "coverage_norm",
                "value": 0.774
              },
              {
                "name": "market_mood_factor",
                "value": 1
              },
              {
                "name": "social_volume",
                "value": 139887
              },
              {
                "name": "galaxyscore",
                "value": 67
              },
              {
                "name": "social_engagement",
                "value": 2140099
              }
            ]
          },
          {
            "id": "ETH_sentiment_1756456945722_1",
            "ticker": "ETH",
            "agentRole": "sentiment",
            "claim": "HOLD",
            "confidence": 0.5,
            "evidence": [
              "ETH_news_1756457081549",
              "ETH_news_1756457081549",
              "ETH_news_1756457081549"
            ],
            "timestamp": 1756456945722,
            "riskFlags": [
              "low_freshness"
            ],
            "direction": "neutral",
            "magnitude": 0.6,
            "rationale": "With a slightly lower news sentiment and social activity than BTC, and a low freshness score, the impact of the news sentiment is limited.",
            "signals": [
              {
                "name": "sentiment_score",
                "value": 0.256
              },
              {
                "name": "news_coverage",
                "value": 20
              },
              {
                "name": "freshness_score",
                "value": 0
              },
              {
                "name": "consistency",
                "value": 0.521
              },
              {
                "name": "credibility",
                "value": 0.657
              },
              {
                "name": "coverage_norm",
                "value": 0.774
              },
              {
                "name": "market_mood_factor",
                "value": 1
              },
              {
                "name": "social_volume",
                "value": 99878
              },
              {
                "name": "galaxyscore",
                "value": 63.3
              },
              {
                "name": "social_engagement",
                "value": 1145145
              }
            ]
          }
        ],
        "textPart": "SUMMARIZE:\n- BTC has a final sentiment score of 0.260 with a news sentiment of 0.710. It has a high news coverage of 20 articles and a social volume of 139887. The GalaxyScore is 67 and the social engagement is 2140099.\n- ETH has a final sentiment score of 0.256 with a news sentiment of 0.640. It also has a high news coverage of 20 articles and a social volume of 99878. The GalaxyScore is 63.3 and the social engagement is 1145145.\n\nREFLECT/CRITICIZE:\n- The summary seems to focus more on the quantitative aspects of the sentiment data. It lacks a qualitative analysis of the news articles and their potential impact on market sentiment.\n- The summary does not consider the freshness of the news, which is important in determining the relevance of the sentiment data.\n\nREVISE:\n- BTC's news sentiment is generally positive, with a score of 0.710. However, the freshness score is low, indicating that the news articles may not be recent. The high social volume and engagement suggest a high level of interest and activity around BTC.\n- ETH's news sentiment is slightly lower than BTC's, with a score of 0.640. Similar to BTC, the freshness score is low. The social volume and engagement are also lower than BTC's, indicating less interest and activity around ETH.\n\nAGGREGATE:\n- The overall sentiment for BTC is neutral to slightly positive, driven by the positive news sentiment and high social activity. However, the low freshness score could limit the impact of the news sentiment.\n- The overall sentiment for ETH is neutral, with a slightly lower news sentiment and social activity than BTC. The low freshness score could also limit the impact of the news sentiment.",
        "jsonPart": {
          "claims": [
            {
              "ticker": "BTC",
              "agentRole": "sentiment",
              "claim": "HOLD",
              "confidence": 0.6,
              "direction": "neutral",
              "magnitude": 0.7,
              "rationale": "Despite positive news sentiment and high social activity, the low freshness score limits the impact of the news sentiment.",
              "signals": [
                {
                  "name": "sentiment_score",
                  "value": 0.26
                },
                {
                  "name": "news_coverage",
                  "value": 20
                },
                {
                  "name": "freshness_score",
                  "value": 0
                },
                {
                  "name": "consistency",
                  "value": 0.558
                },
                {
                  "name": "credibility",
                  "value": 0.657
                },
                {
                  "name": "coverage_norm",
                  "value": 0.774
                },
                {
                  "name": "market_mood_factor",
                  "value": 1
                },
                {
                  "name": "social_volume",
                  "value": 139887
                },
                {
                  "name": "galaxyscore",
                  "value": 67
                },
                {
                  "name": "social_engagement",
                  "value": 2140099
                }
              ],
              "riskFlags": [
                "low_freshness"
              ]
            },
            {
              "ticker": "ETH",
              "agentRole": "sentiment",
              "claim": "HOLD",
              "confidence": 0.5,
              "direction": "neutral",
              "magnitude": 0.6,
              "rationale": "With a slightly lower news sentiment and social activity than BTC, and a low freshness score, the impact of the news sentiment is limited.",
              "signals": [
                {
                  "name": "sentiment_score",
                  "value": 0.256
                },
                {
                  "name": "news_coverage",
                  "value": 20
                },
                {
                  "name": "freshness_score",
                  "value": 0
                },
                {
                  "name": "consistency",
                  "value": 0.521
                },
                {
                  "name": "credibility",
                  "value": 0.657
                },
                {
                  "name": "coverage_norm",
                  "value": 0.774
                },
                {
                  "name": "market_mood_factor",
                  "value": 1
                },
                {
                  "name": "social_volume",
                  "value": 99878
                },
                {
                  "name": "galaxyscore",
                  "value": 63.3
                },
                {
                  "name": "social_engagement",
                  "value": 1145145
                }
              ],
              "riskFlags": [
                "low_freshness"
              ]
            }
          ]
        },
        "openaiResponse": "SUMMARIZE:\n- BTC has a final sentiment score of 0.260 with a news sentiment of 0.710. It has a high news coverage of 20 articles and a social volume of 139887. The GalaxyScore is 67 and the social engagement is 2140099.\n- ETH has a final sentiment score of 0.256 with a news sentiment of 0.640. It also has a high news coverage of 20 articles and a social volume of 99878. The GalaxyScore is 63.3 and the social engagement is 1145145.\n\nREFLECT/CRITICIZE:\n- The summary seems to focus more on the quantitative aspects of the sentiment data. It lacks a qualitative analysis of the news articles and their potential impact on market sentiment.\n- The summary does not consider the freshness of the news, which is important in determining the relevance of the sentiment data.\n\nREVISE:\n- BTC's news sentiment is generally positive, with a score of 0.710. However, the freshness score is low, indicating that the news articles may not be recent. The high social volume and engagement suggest a high level of interest and activity around BTC.\n- ETH's news sentiment is slightly lower than BTC's, with a score of 0.640. Similar to BTC, the freshness score is low. The social volume and engagement are also lower than BTC's, indicating less interest and activity around ETH.\n\nAGGREGATE:\n- The overall sentiment for BTC is neutral to slightly positive, driven by the positive news sentiment and high social activity. However, the low freshness score could limit the impact of the news sentiment.\n- The overall sentiment for ETH is neutral, with a slightly lower news sentiment and social activity than BTC. The low freshness score could also limit the impact of the news sentiment.\n\n{\n  \"claims\": [\n    {\n      \"ticker\": \"BTC\",\n      \"agentRole\": \"sentiment\",\n      \"claim\": \"HOLD\",\n      \"confidence\": 0.6,\n      \"direction\": \"neutral\",\n      \"magnitude\": 0.7,\n      \"rationale\": \"Despite positive news sentiment and high social activity, the low freshness score limits the impact of the news sentiment.\",\n      \"signals\": [\n        {\"name\": \"sentiment_score\", \"value\": 0.260},\n        {\"name\": \"news_coverage\", \"value\": 20},\n        {\"name\": \"freshness_score\", \"value\": 0.000},\n        {\"name\": \"consistency\", \"value\": 0.558},\n        {\"name\": \"credibility\", \"value\": 0.657},\n        {\"name\": \"coverage_norm\", \"value\": 0.774},\n        {\"name\": \"market_mood_factor\", \"value\": 1.000},\n        {\"name\": \"social_volume\", \"value\": 139887},\n        {\"name\": \"galaxyscore\", \"value\": 67},\n        {\"name\": \"social_engagement\", \"value\": 2140099}\n      ],\n      \"riskFlags\": [\"low_freshness\"]\n    },\n    {\n      \"ticker\": \"ETH\",\n      \"agentRole\": \"sentiment\",\n      \"claim\": \"HOLD\",\n      \"confidence\": 0.5,\n      \"direction\": \"neutral\",\n      \"magnitude\": 0.6,\n      \"rationale\": \"With a slightly lower news sentiment and social activity than BTC, and a low freshness score, the impact of the news sentiment is limited.\",\n      \"signals\": [\n        {\"name\": \"sentiment_score\", \"value\": 0.256},\n        {\"name\": \"news_coverage\", \"value\": 20},\n        {\"name\": \"freshness_score\", \"value\": 0.000},\n        {\"name\": \"consistency\", \"value\": 0.521},\n        {\"name\": \"credibility\", \"value\": 0.657},\n        {\"name\": \"coverage_norm\", \"value\": 0.774},\n        {\"name\": \"market_mood_factor\", \"value\": 1.000},\n        {\"name\": \"social_volume\", \"value\": 99878},\n        {\"name\": \"galaxyscore\", \"value\": 63.3},\n        {\"name\": \"social_engagement\", \"value\": 1145145}\n      ],\n      \"riskFlags\": [\"low_freshness\"]\n    }\n  ]\n}"
      }
    },
    {
      "timestamp": "2025-08-29T08:45:10.246Z",
      "role": "technical",
      "context": {
        "universe": [
          "BTC",
          "ETH"
        ],
        "marketStats": 2,
        "facts": 11,
        "news": 0
      },
      "response": {
        "claims": [
          {
            "id": "BTC_technical_1756456945722_0",
            "ticker": "BTC",
            "agentRole": "technical",
            "claim": "HOLD",
            "confidence": 0.5,
            "evidence": [],
            "timestamp": 1756456945722,
            "riskFlags": [
              "high_volatility",
              "weak_signals"
            ],
            "direction": "neutral",
            "magnitude": 0.3,
            "rationale": "Mixed signals with bearish MACD but bullish Stochastic and Bollinger Bands",
            "signals": [
              {
                "name": "rsi",
                "value": 38.61
              },
              {
                "name": "macd",
                "value": -394.2
              },
              {
                "name": "stochastic",
                "value": 16.85
              },
              {
                "name": "bollinger_bands",
                "value": -2955.5
              },
              {
                "name": "signal_strength",
                "value": 0.192
              }
            ]
          },
          {
            "id": "ETH_technical_1756456945722_1",
            "ticker": "ETH",
            "agentRole": "technical",
            "claim": "HOLD",
            "confidence": 0.5,
            "evidence": [],
            "timestamp": 1756456945722,
            "riskFlags": [
              "high_volatility",
              "weak_signals"
            ],
            "direction": "neutral",
            "magnitude": 0.3,
            "rationale": "Mixed signals with bearish MACD but bullish Stochastic and Bollinger Bands",
            "signals": [
              {
                "name": "rsi",
                "value": 37.61
              },
              {
                "name": "macd",
                "value": -37.01
              },
              {
                "name": "stochastic",
                "value": 11.26
              },
              {
                "name": "bollinger_bands",
                "value": -232.14
              },
              {
                "name": "signal_strength",
                "value": 0.192
              }
            ]
          }
        ],
        "textPart": "TECHNICAL ANALYSIS:\nBTC shows a neutral RSI at 38.61, indicating neither oversold nor overbought conditions. The MACD is bearish at -394.20, suggesting downward momentum. However, the Stochastic indicator at 16.85 and the Bollinger Bands value at -2955.50 are both in the oversold territory, suggesting a potential upward price reversal. Volatility is moderate at 0.3, indicating potential for significant moves. The signal strength is slightly positive at 0.192, indicating weak technical momentum. Overall, the technical picture is mixed with bearish MACD but bullish Stochastic and Bollinger Bands signals.\n\nETH displays a neutral RSI at 37.61, suggesting balanced buying and selling pressure. The MACD is bearish at -37.01, indicating downward momentum. Similar to BTC, the Stochastic indicator at 11.26 and the Bollinger Bands value at -232.14 are both in the oversold territory, suggesting a potential upward price reversal. Volatility is moderate at 0.3, similar to BTC. The signal strength is slightly positive at 0.192, indicating weak technical momentum. The technical indicators suggest a cautious approach with mixed signals.\n\nCLAIMS:",
        "jsonPart": {
          "claims": [
            {
              "ticker": "BTC",
              "agentRole": "technical",
              "claim": "HOLD",
              "confidence": 0.5,
              "direction": "neutral",
              "magnitude": 0.3,
              "rationale": "Mixed signals with bearish MACD but bullish Stochastic and Bollinger Bands",
              "signals": [
                {
                  "name": "rsi",
                  "value": 38.61
                },
                {
                  "name": "macd",
                  "value": -394.2
                },
                {
                  "name": "stochastic",
                  "value": 16.85
                },
                {
                  "name": "bollinger_bands",
                  "value": -2955.5
                },
                {
                  "name": "signal_strength",
                  "value": 0.192
                }
              ],
              "evidence": [
                "1756456945722"
              ],
              "riskFlags": [
                "high_volatility",
                "weak_signals"
              ]
            },
            {
              "ticker": "ETH",
              "agentRole": "technical",
              "claim": "HOLD",
              "confidence": 0.5,
              "direction": "neutral",
              "magnitude": 0.3,
              "rationale": "Mixed signals with bearish MACD but bullish Stochastic and Bollinger Bands",
              "signals": [
                {
                  "name": "rsi",
                  "value": 37.61
                },
                {
                  "name": "macd",
                  "value": -37.01
                },
                {
                  "name": "stochastic",
                  "value": 11.26
                },
                {
                  "name": "bollinger_bands",
                  "value": -232.14
                },
                {
                  "name": "signal_strength",
                  "value": 0.192
                }
              ],
              "evidence": [
                "1756456945722"
              ],
              "riskFlags": [
                "high_volatility",
                "weak_signals"
              ]
            }
          ]
        },
        "openaiResponse": "TECHNICAL ANALYSIS:\nBTC shows a neutral RSI at 38.61, indicating neither oversold nor overbought conditions. The MACD is bearish at -394.20, suggesting downward momentum. However, the Stochastic indicator at 16.85 and the Bollinger Bands value at -2955.50 are both in the oversold territory, suggesting a potential upward price reversal. Volatility is moderate at 0.3, indicating potential for significant moves. The signal strength is slightly positive at 0.192, indicating weak technical momentum. Overall, the technical picture is mixed with bearish MACD but bullish Stochastic and Bollinger Bands signals.\n\nETH displays a neutral RSI at 37.61, suggesting balanced buying and selling pressure. The MACD is bearish at -37.01, indicating downward momentum. Similar to BTC, the Stochastic indicator at 11.26 and the Bollinger Bands value at -232.14 are both in the oversold territory, suggesting a potential upward price reversal. Volatility is moderate at 0.3, similar to BTC. The signal strength is slightly positive at 0.192, indicating weak technical momentum. The technical indicators suggest a cautious approach with mixed signals.\n\nCLAIMS:\n\n{\n  \"claims\": [\n    {\n      \"ticker\": \"BTC\",\n      \"agentRole\": \"technical\",\n      \"claim\": \"HOLD\",\n      \"confidence\": 0.5,\n      \"direction\": \"neutral\",\n      \"magnitude\": 0.3,\n      \"rationale\": \"Mixed signals with bearish MACD but bullish Stochastic and Bollinger Bands\",\n      \"signals\": [\n        {\"name\": \"rsi\", \"value\": 38.61},\n        {\"name\": \"macd\", \"value\": -394.20},\n        {\"name\": \"stochastic\", \"value\": 16.85},\n        {\"name\": \"bollinger_bands\", \"value\": -2955.50},\n        {\"name\": \"signal_strength\", \"value\": 0.192}\n      ],\n      \"evidence\": [\"1756456945722\"],\n      \"riskFlags\": [\"high_volatility\", \"weak_signals\"]\n    },\n    {\n      \"ticker\": \"ETH\",\n      \"agentRole\": \"technical\",\n      \"claim\": \"HOLD\",\n      \"confidence\": 0.5,\n      \"direction\": \"neutral\",\n      \"magnitude\": 0.3,\n      \"rationale\": \"Mixed signals with bearish MACD but bullish Stochastic and Bollinger Bands\",\n      \"signals\": [\n        {\"name\": \"rsi\", \"value\": 37.61},\n        {\"name\": \"macd\", \"value\": -37.01},\n        {\"name\": \"stochastic\", \"value\": 11.26},\n        {\"name\": \"bollinger_bands\", \"value\": -232.14},\n        {\"name\": \"signal_strength\", \"value\": 0.192}\n      ],\n      \"evidence\": [\"1756456945722\"],\n      \"riskFlags\": [\"high_volatility\", \"weak_signals\"]\n    }\n  ]\n}"
      }
    }
  ]
}