{
  "testDate": "8/27/2025, 7:14:41 PM",
  "totalAgents": 3,
  "responses": [
    {
      "timestamp": "2025-08-27T15:13:38.420Z",
      "role": "fundamental",
      "context": {
        "universe": [
          "BTC",
          "ETH"
        ],
        "marketStats": 2,
        "facts": 11,
        "news": 0
      },
      "response": {
        "claims": [
          {
            "id": "BTC_fundamental_1756307529316_0",
            "ticker": "BTC",
            "agentRole": "fundamental",
            "claim": "HOLD",
            "confidence": 0.6,
            "evidence": [],
            "timestamp": 1756307529316,
            "riskFlags": [
              "negative_trend_strength"
            ],
            "direction": "neutral",
            "magnitude": 0.3,
            "rationale": "BTC shows excellent liquidity and low volatility, suggesting a stable asset. However, the negative signal strength indicates a bearish trend, which raises concerns about the short-term direction.",
            "signals": [
              {
                "name": "liquidity_score",
                "value": 1
              },
              {
                "name": "volatility",
                "value": 0.003
              },
              {
                "name": "trend_strength",
                "value": -0.3
              }
            ]
          },
          {
            "id": "ETH_fundamental_1756307529316_1",
            "ticker": "ETH",
            "agentRole": "fundamental",
            "claim": "HOLD",
            "confidence": 0.6,
            "evidence": [],
            "timestamp": 1756307529316,
            "riskFlags": [
              "weak_trend_strength"
            ],
            "direction": "neutral",
            "magnitude": 0.1,
            "rationale": "ETH demonstrates excellent liquidity and moderate volatility, suggesting a healthy market activity. However, the weak signal strength raises concerns about the short-term direction.",
            "signals": [
              {
                "name": "liquidity_score",
                "value": 1
              },
              {
                "name": "volatility",
                "value": 0.009
              },
              {
                "name": "trend_strength",
                "value": 0.1
              }
            ]
          }
        ],
        "textPart": "FUNDAMENTAL ANALYSIS:\n\nBTC shows excellent liquidity with a score of 1.0, indicating a high volume of trading and low spreads, which contributes to more stable pricing. The volatility of 0.003 is relatively low, suggesting a lower risk profile. However, the signal strength is negative at -0.3, indicating a bearish trend. The market cap is significantly large, suggesting strong institutional interest. However, the negative trend strength raises concerns about the short-term direction of the asset. Overall, BTC shows mixed signals with strong fundamentals but weak technical momentum.\n\nETH also demonstrates excellent liquidity with a score of 1.0, suggesting a healthy market activity. The volatility of 0.009 is higher than BTC, indicating a higher risk profile. The signal strength is positive but very low at 0.1, suggesting a weak bullish trend. The market cap is smaller than BTC but still substantial, indicating solid institutional backing. The trend strength is weak, raising concerns about the short-term direction of the asset. The fundamentals of ETH are sound, but the technical momentum is weak.\n\nBased on the above analysis, here are the claims:",
        "jsonPart": {
          "claims": [
            {
              "ticker": "BTC",
              "agentRole": "fundamental",
              "claim": "HOLD",
              "confidence": 0.6,
              "direction": "neutral",
              "magnitude": 0.3,
              "rationale": "BTC shows excellent liquidity and low volatility, suggesting a stable asset. However, the negative signal strength indicates a bearish trend, which raises concerns about the short-term direction.",
              "signals": [
                {
                  "name": "liquidity_score",
                  "value": 1
                },
                {
                  "name": "volatility",
                  "value": 0.003
                },
                {
                  "name": "trend_strength",
                  "value": -0.3
                }
              ],
              "evidence": [
                "1756307529316"
              ],
              "riskFlags": [
                "negative_trend_strength"
              ]
            },
            {
              "ticker": "ETH",
              "agentRole": "fundamental",
              "claim": "HOLD",
              "confidence": 0.6,
              "direction": "neutral",
              "magnitude": 0.1,
              "rationale": "ETH demonstrates excellent liquidity and moderate volatility, suggesting a healthy market activity. However, the weak signal strength raises concerns about the short-term direction.",
              "signals": [
                {
                  "name": "liquidity_score",
                  "value": 1
                },
                {
                  "name": "volatility",
                  "value": 0.009
                },
                {
                  "name": "trend_strength",
                  "value": 0.1
                }
              ],
              "evidence": [
                "1756307529316"
              ],
              "riskFlags": [
                "weak_trend_strength"
              ]
            }
          ]
        },
        "openaiResponse": "FUNDAMENTAL ANALYSIS:\n\nBTC shows excellent liquidity with a score of 1.0, indicating a high volume of trading and low spreads, which contributes to more stable pricing. The volatility of 0.003 is relatively low, suggesting a lower risk profile. However, the signal strength is negative at -0.3, indicating a bearish trend. The market cap is significantly large, suggesting strong institutional interest. However, the negative trend strength raises concerns about the short-term direction of the asset. Overall, BTC shows mixed signals with strong fundamentals but weak technical momentum.\n\nETH also demonstrates excellent liquidity with a score of 1.0, suggesting a healthy market activity. The volatility of 0.009 is higher than BTC, indicating a higher risk profile. The signal strength is positive but very low at 0.1, suggesting a weak bullish trend. The market cap is smaller than BTC but still substantial, indicating solid institutional backing. The trend strength is weak, raising concerns about the short-term direction of the asset. The fundamentals of ETH are sound, but the technical momentum is weak.\n\nBased on the above analysis, here are the claims:\n\n{\n  \"claims\": [\n    {\n      \"ticker\": \"BTC\",\n      \"agentRole\": \"fundamental\",\n      \"claim\": \"HOLD\",\n      \"confidence\": 0.6,\n      \"direction\": \"neutral\",\n      \"magnitude\": 0.3,\n      \"rationale\": \"BTC shows excellent liquidity and low volatility, suggesting a stable asset. However, the negative signal strength indicates a bearish trend, which raises concerns about the short-term direction.\",\n      \"signals\": [\n        {\"name\": \"liquidity_score\", \"value\": 1.0},\n        {\"name\": \"volatility\", \"value\": 0.003},\n        {\"name\": \"trend_strength\", \"value\": -0.3}\n      ],\n      \"evidence\": [\"1756307529316\"],\n      \"riskFlags\": [\"negative_trend_strength\"]\n    },\n    {\n      \"ticker\": \"ETH\",\n      \"agentRole\": \"fundamental\",\n      \"claim\": \"HOLD\",\n      \"confidence\": 0.6,\n      \"direction\": \"neutral\",\n      \"magnitude\": 0.1,\n      \"rationale\": \"ETH demonstrates excellent liquidity and moderate volatility, suggesting a healthy market activity. However, the weak signal strength raises concerns about the short-term direction.\",\n      \"signals\": [\n        {\"name\": \"liquidity_score\", \"value\": 1.0},\n        {\"name\": \"volatility\", \"value\": 0.009},\n        {\"name\": \"trend_strength\", \"value\": 0.1}\n      ],\n      \"evidence\": [\"1756307529316\"],\n      \"riskFlags\": [\"weak_trend_strength\"]\n    }\n  ]\n}"
      }
    },
    {
      "timestamp": "2025-08-27T15:14:07.268Z",
      "role": "sentiment",
      "context": {
        "universe": [
          "BTC",
          "ETH"
        ],
        "marketStats": 2,
        "facts": 11,
        "news": 0
      },
      "response": {
        "claims": [
          {
            "id": "BTC_sentiment_1756307529316_0",
            "ticker": "BTC",
            "agentRole": "sentiment",
            "claim": "HOLD",
            "confidence": 0.71,
            "evidence": [],
            "timestamp": 1756307529316,
            "riskFlags": [],
            "direction": "neutral",
            "magnitude": 0.71,
            "rationale": "Mixed sentiment in the news with both positive and negative coverage",
            "signals": [
              {
                "name": "sentiment_score",
                "value": 0.71
              },
              {
                "name": "news_coverage",
                "value": 20
              },
              {
                "name": "freshness_score",
                "value": 1
              }
            ]
          },
          {
            "id": "ETH_sentiment_1756307529316_1",
            "ticker": "ETH",
            "agentRole": "sentiment",
            "claim": "HOLD",
            "confidence": 0.64,
            "evidence": [],
            "timestamp": 1756307529316,
            "riskFlags": [],
            "direction": "neutral",
            "magnitude": 0.64,
            "rationale": "Mixed sentiment in the news with both positive and negative coverage",
            "signals": [
              {
                "name": "sentiment_score",
                "value": 0.64
              },
              {
                "name": "news_coverage",
                "value": 20
              },
              {
                "name": "freshness_score",
                "value": 1
              }
            ]
          }
        ],
        "textPart": "SUMMARIZE:\n- BTC: The sentiment score is 0.71 with high coverage of 20 articles. The news is fresh but there is no consistency score provided. The news includes both positive (Sequans raising funds to buy more Bitcoin, Metaplanet's acquisition) and negative (Bitcoin's price fall amid economic uncertainty) sentiment.\n- ETH: The sentiment score is 0.64 with high coverage of 20 articles. The news is fresh but there is no consistency score provided. The news includes both positive (ETHZilla's buyback, Bitmine's acquisition) and negative (BlackRock's sale of Ethereum in ETF) sentiment.\n\nREFLECT/CRITICIZE:\n- The summaries seem to capture the overall sentiment of the news articles. However, the lack of a consistency score makes it difficult to assess the overall sentiment accurately.\n\nREVISE:\n- BTC: The sentiment score is 0.71 with high coverage of 20 articles. The news is fresh. The news includes both positive and negative sentiment.\n- ETH: The sentiment score is 0.64 with high coverage of 20 articles. The news is fresh. The news includes both positive and negative sentiment.\n\nAGGREGATE:\n- BTC: The overall sentiment is neutral due to the mix of positive and negative news.\n- ETH: The overall sentiment is neutral due to the mix of positive and negative news.\n\nSCORE:\n- BTC: sentiment_score = 0.71, news_coverage = 20, freshness_score = 1.0\n- ETH: sentiment_score = 0.64, news_coverage = 20, freshness_score = 1.0\n\nBased on the above analysis, the confidence score for both BTC and ETH is calculated as follows:\n- BTC: confidence = coverage × freshness × sentiment_score = 20 × 1.0 × 0.71 = 14.2\n- ETH: confidence = coverage × freshness × sentiment_score = 20 × 1.0 × 0.64 = 12.8\n\nHowever, since the confidence score should be between 0.1 and 1.0, we normalize the scores by dividing by the maximum possible score (20 × 1.0 × 1.0 = 20):\n- BTC: normalized_confidence = 14.2 / 20 = 0.71\n- ETH: normalized_confidence = 12.8 / 20 = 0.64\n\nHere are the final claims:",
        "jsonPart": {
          "claims": [
            {
              "ticker": "BTC",
              "agentRole": "sentiment",
              "claim": "HOLD",
              "confidence": 0.71,
              "direction": "neutral",
              "magnitude": 0.71,
              "rationale": "Mixed sentiment in the news with both positive and negative coverage",
              "signals": [
                {
                  "name": "sentiment_score",
                  "value": 0.71
                },
                {
                  "name": "news_coverage",
                  "value": 20
                },
                {
                  "name": "freshness_score",
                  "value": 1
                }
              ],
              "evidence": [],
              "riskFlags": []
            },
            {
              "ticker": "ETH",
              "agentRole": "sentiment",
              "claim": "HOLD",
              "confidence": 0.64,
              "direction": "neutral",
              "magnitude": 0.64,
              "rationale": "Mixed sentiment in the news with both positive and negative coverage",
              "signals": [
                {
                  "name": "sentiment_score",
                  "value": 0.64
                },
                {
                  "name": "news_coverage",
                  "value": 20
                },
                {
                  "name": "freshness_score",
                  "value": 1
                }
              ],
              "evidence": [],
              "riskFlags": []
            }
          ]
        },
        "openaiResponse": "SUMMARIZE:\n- BTC: The sentiment score is 0.71 with high coverage of 20 articles. The news is fresh but there is no consistency score provided. The news includes both positive (Sequans raising funds to buy more Bitcoin, Metaplanet's acquisition) and negative (Bitcoin's price fall amid economic uncertainty) sentiment.\n- ETH: The sentiment score is 0.64 with high coverage of 20 articles. The news is fresh but there is no consistency score provided. The news includes both positive (ETHZilla's buyback, Bitmine's acquisition) and negative (BlackRock's sale of Ethereum in ETF) sentiment.\n\nREFLECT/CRITICIZE:\n- The summaries seem to capture the overall sentiment of the news articles. However, the lack of a consistency score makes it difficult to assess the overall sentiment accurately.\n\nREVISE:\n- BTC: The sentiment score is 0.71 with high coverage of 20 articles. The news is fresh. The news includes both positive and negative sentiment.\n- ETH: The sentiment score is 0.64 with high coverage of 20 articles. The news is fresh. The news includes both positive and negative sentiment.\n\nAGGREGATE:\n- BTC: The overall sentiment is neutral due to the mix of positive and negative news.\n- ETH: The overall sentiment is neutral due to the mix of positive and negative news.\n\nSCORE:\n- BTC: sentiment_score = 0.71, news_coverage = 20, freshness_score = 1.0\n- ETH: sentiment_score = 0.64, news_coverage = 20, freshness_score = 1.0\n\nBased on the above analysis, the confidence score for both BTC and ETH is calculated as follows:\n- BTC: confidence = coverage × freshness × sentiment_score = 20 × 1.0 × 0.71 = 14.2\n- ETH: confidence = coverage × freshness × sentiment_score = 20 × 1.0 × 0.64 = 12.8\n\nHowever, since the confidence score should be between 0.1 and 1.0, we normalize the scores by dividing by the maximum possible score (20 × 1.0 × 1.0 = 20):\n- BTC: normalized_confidence = 14.2 / 20 = 0.71\n- ETH: normalized_confidence = 12.8 / 20 = 0.64\n\nHere are the final claims:\n{\n  \"claims\": [\n    {\n      \"ticker\": \"BTC\",\n      \"agentRole\": \"sentiment\",\n      \"claim\": \"HOLD\",\n      \"confidence\": 0.71,\n      \"direction\": \"neutral\",\n      \"magnitude\": 0.71,\n      \"rationale\": \"Mixed sentiment in the news with both positive and negative coverage\",\n      \"signals\": [\n        {\"name\": \"sentiment_score\", \"value\": 0.71},\n        {\"name\": \"news_coverage\", \"value\": 20},\n        {\"name\": \"freshness_score\", \"value\": 1.0}\n      ],\n      \"evidence\": [],\n      \"riskFlags\": []\n    },\n    {\n      \"ticker\": \"ETH\",\n      \"agentRole\": \"sentiment\",\n      \"claim\": \"HOLD\",\n      \"confidence\": 0.64,\n      \"direction\": \"neutral\",\n      \"magnitude\": 0.64,\n      \"rationale\": \"Mixed sentiment in the news with both positive and negative coverage\",\n      \"signals\": [\n        {\"name\": \"sentiment_score\", \"value\": 0.64},\n        {\"name\": \"news_coverage\", \"value\": 20},\n        {\"name\": \"freshness_score\", \"value\": 1.0}\n      ],\n      \"evidence\": [],\n      \"riskFlags\": []\n    }\n  ]\n}"
      }
    },
    {
      "timestamp": "2025-08-27T15:14:27.497Z",
      "role": "valuation",
      "context": {
        "universe": [
          "BTC",
          "ETH"
        ],
        "marketStats": 2,
        "facts": 11,
        "news": 0
      },
      "response": {
        "claims": [
          {
            "id": "BTC_valuation_1756307529316_0",
            "ticker": "BTC",
            "agentRole": "valuation",
            "claim": "HOLD",
            "confidence": 0.5,
            "evidence": [],
            "timestamp": 1756307529316,
            "riskFlags": [
              "high_volatility",
              "weak_signals"
            ],
            "direction": "neutral",
            "magnitude": 0.3,
            "rationale": "Mixed technical signals with bearish MACD but neutral RSI and Stochastic. Moderate volatility suggests potential for significant moves.",
            "signals": [
              {
                "name": "rsi",
                "value": 49.75
              },
              {
                "name": "macd",
                "value": -724.4
              },
              {
                "name": "volatility_30d",
                "value": 0.3
              },
              {
                "name": "stochastic",
                "value": 60.46
              },
              {
                "name": "signal_strength",
                "value": -0.3
              }
            ]
          },
          {
            "id": "ETH_valuation_1756307529316_1",
            "ticker": "ETH",
            "agentRole": "valuation",
            "claim": "HOLD",
            "confidence": 0.5,
            "evidence": [],
            "timestamp": 1756307529316,
            "riskFlags": [
              "high_volatility",
              "weak_signals"
            ],
            "direction": "neutral",
            "magnitude": 0.3,
            "rationale": "Mixed technical signals with bullish MACD but neutral RSI and Stochastic. Moderate volatility suggests potential for significant moves.",
            "signals": [
              {
                "name": "rsi",
                "value": 56.53
              },
              {
                "name": "macd",
                "value": 8.37
              },
              {
                "name": "volatility_30d",
                "value": 0.3
              },
              {
                "name": "stochastic",
                "value": 71.08
              },
              {
                "name": "signal_strength",
                "value": 0.1
              }
            ]
          }
        ],
        "textPart": "TECHNICAL ANALYSIS:\nBTC shows a neutral RSI at 49.75, indicating neither oversold nor overbought conditions. The MACD is bearish at -724.40, suggesting downward momentum. The Stochastic is also neutral at 60.46. Volatility is moderate at 0.3, indicating potential for significant moves. The signal strength is negative at -0.3, indicating weak technical momentum. Overall, the technical picture for BTC is mixed with bearish MACD but neutral RSI and Stochastic.\n\nETH displays a neutral RSI at 56.53, suggesting balanced buying and selling pressure. The MACD is bullish at 8.37, indicating upward momentum. The Stochastic is neutral at 71.08. Volatility is moderate at 0.3, similar to BTC. The signal strength is slightly positive at 0.1, indicating weak technical momentum. The technical indicators for ETH suggest a cautious approach with mixed signals.\n\nCLAIMS:",
        "jsonPart": {
          "claims": [
            {
              "ticker": "BTC",
              "agentRole": "valuation",
              "claim": "HOLD",
              "confidence": 0.5,
              "direction": "neutral",
              "magnitude": 0.3,
              "rationale": "Mixed technical signals with bearish MACD but neutral RSI and Stochastic. Moderate volatility suggests potential for significant moves.",
              "signals": [
                {
                  "name": "rsi",
                  "value": 49.75
                },
                {
                  "name": "macd",
                  "value": -724.4
                },
                {
                  "name": "volatility_30d",
                  "value": 0.3
                },
                {
                  "name": "stochastic",
                  "value": 60.46
                },
                {
                  "name": "signal_strength",
                  "value": -0.3
                }
              ],
              "evidence": [
                "1756307529316"
              ],
              "riskFlags": [
                "high_volatility",
                "weak_signals"
              ]
            },
            {
              "ticker": "ETH",
              "agentRole": "valuation",
              "claim": "HOLD",
              "confidence": 0.5,
              "direction": "neutral",
              "magnitude": 0.3,
              "rationale": "Mixed technical signals with bullish MACD but neutral RSI and Stochastic. Moderate volatility suggests potential for significant moves.",
              "signals": [
                {
                  "name": "rsi",
                  "value": 56.53
                },
                {
                  "name": "macd",
                  "value": 8.37
                },
                {
                  "name": "volatility_30d",
                  "value": 0.3
                },
                {
                  "name": "stochastic",
                  "value": 71.08
                },
                {
                  "name": "signal_strength",
                  "value": 0.1
                }
              ],
              "evidence": [
                "1756307529316"
              ],
              "riskFlags": [
                "high_volatility",
                "weak_signals"
              ]
            }
          ]
        },
        "openaiResponse": "TECHNICAL ANALYSIS:\nBTC shows a neutral RSI at 49.75, indicating neither oversold nor overbought conditions. The MACD is bearish at -724.40, suggesting downward momentum. The Stochastic is also neutral at 60.46. Volatility is moderate at 0.3, indicating potential for significant moves. The signal strength is negative at -0.3, indicating weak technical momentum. Overall, the technical picture for BTC is mixed with bearish MACD but neutral RSI and Stochastic.\n\nETH displays a neutral RSI at 56.53, suggesting balanced buying and selling pressure. The MACD is bullish at 8.37, indicating upward momentum. The Stochastic is neutral at 71.08. Volatility is moderate at 0.3, similar to BTC. The signal strength is slightly positive at 0.1, indicating weak technical momentum. The technical indicators for ETH suggest a cautious approach with mixed signals.\n\nCLAIMS:\n\n{\n  \"claims\": [\n    {\n      \"ticker\": \"BTC\",\n      \"agentRole\": \"valuation\",\n      \"claim\": \"HOLD\",\n      \"confidence\": 0.5,\n      \"direction\": \"neutral\",\n      \"magnitude\": 0.3,\n      \"rationale\": \"Mixed technical signals with bearish MACD but neutral RSI and Stochastic. Moderate volatility suggests potential for significant moves.\",\n      \"signals\": [\n        {\"name\": \"rsi\", \"value\": 49.75},\n        {\"name\": \"macd\", \"value\": -724.40},\n        {\"name\": \"volatility_30d\", \"value\": 0.3},\n        {\"name\": \"stochastic\", \"value\": 60.46},\n        {\"name\": \"signal_strength\", \"value\": -0.3}\n      ],\n      \"evidence\": [\"1756307529316\"],\n      \"riskFlags\": [\"high_volatility\", \"weak_signals\"]\n    },\n    {\n      \"ticker\": \"ETH\",\n      \"agentRole\": \"valuation\",\n      \"claim\": \"HOLD\",\n      \"confidence\": 0.5,\n      \"direction\": \"neutral\",\n      \"magnitude\": 0.3,\n      \"rationale\": \"Mixed technical signals with bullish MACD but neutral RSI and Stochastic. Moderate volatility suggests potential for significant moves.\",\n      \"signals\": [\n        {\"name\": \"rsi\", \"value\": 56.53},\n        {\"name\": \"macd\", \"value\": 8.37},\n        {\"name\": \"volatility_30d\", \"value\": 0.3},\n        {\"name\": \"stochastic\", \"value\": 71.08},\n        {\"name\": \"signal_strength\", \"value\": 0.1}\n      ],\n      \"evidence\": [\"1756307529316\"],\n      \"riskFlags\": [\"high_volatility\", \"weak_signals\"]\n    }\n  ]\n}"
      }
    }
  ]
}