{
  "testDate": "8/27/2025, 6:46:07 PM",
  "totalAgents": 3,
  "responses": [
    {
      "timestamp": "2025-08-27T14:45:00.883Z",
      "role": "fundamental",
      "context": {
        "universe": [
          "BTC",
          "ETH"
        ],
        "marketStats": 2,
        "facts": 11,
        "news": 0
      },
      "response": {
        "claims": [
          {
            "id": "BTC_fundamental_1756305809561_0",
            "ticker": "BTC",
            "agentRole": "fundamental",
            "claim": "HOLD",
            "confidence": 0.5,
            "direction": "bearish",
            "magnitude": 0.5,
            "rationale": "BTC shows mixed signals with strong fundamentals but weak technical momentum.",
            "signals": [
              {
                "name": "liquidity_score",
                "value": 1
              },
              {
                "name": "volatility",
                "value": 0.003
              },
              {
                "name": "trend_strength",
                "value": -0.5
              }
            ],
            "evidence": [],
            "timestamp": 1756305809561,
            "riskFlags": [
              "high_volatility",
              "low_liquidity"
            ]
          },
          {
            "id": "ETH_fundamental_1756305809561_1",
            "ticker": "ETH",
            "agentRole": "fundamental",
            "claim": "HOLD",
            "confidence": 0.6,
            "direction": "neutral",
            "magnitude": 0.5,
            "rationale": "ETH shows mixed signals with strong fundamentals but uncertain technical momentum.",
            "signals": [
              {
                "name": "liquidity_score",
                "value": 1
              },
              {
                "name": "volatility",
                "value": 0.008
              },
              {
                "name": "trend_strength",
                "value": 0.1
              }
            ],
            "evidence": [],
            "timestamp": 1756305809561,
            "riskFlags": [
              "high_volatility",
              "low_liquidity"
            ]
          }
        ],
        "textPart": "FUNDAMENTAL ANALYSIS:\n\nStarting with Bitcoin (BTC), the asset shows a neutral RSI and stochastic, suggesting the market is neither overbought nor oversold. However, the MACD and Williams %R indicators are bearish, suggesting a potential downtrend. The signal strength is negative, further supporting the bearish sentiment. Despite the bearish technical indicators, BTC has a high liquidity score, which is a positive sign. The volatility is relatively low, suggesting a stable market. The market cap is substantial, indicating strong institutional interest. However, the negative trend strength raises concerns about the short-term direction of BTC. \n\nEthereum (ETH), on the other hand, shows a neutral RSI and stochastic, similar to BTC. The MACD is bullish, suggesting a potential uptrend, but the Williams %R indicator is bearish, creating a mixed signal. The signal strength is slightly positive, indicating a possible upward trend. ETH also has a high liquidity score, which is a positive sign. The volatility is higher than BTC's, indicating a more unstable market. The market cap is substantial but smaller than BTC's, suggesting less institutional interest. The trend strength is low, indicating uncertainty about the short-term direction of ETH.\n\nBased on the above analysis, BTC shows mixed signals with strong fundamentals but weak technical momentum. ETH also demonstrates mixed signals with strong fundamentals but uncertain technical momentum.",
        "jsonPart": {
          "claims": [
            {
              "ticker": "BTC",
              "agentRole": "fundamental",
              "claim": "HOLD",
              "confidence": 0.5,
              "direction": "bearish",
              "magnitude": 0.5,
              "rationale": "BTC shows mixed signals with strong fundamentals but weak technical momentum.",
              "signals": [
                {
                  "name": "liquidity_score",
                  "value": 1
                },
                {
                  "name": "volatility",
                  "value": 0.003
                },
                {
                  "name": "trend_strength",
                  "value": -0.5
                }
              ],
              "evidence": [
                "1756305809561",
                "1756305809561"
              ],
              "riskFlags": [
                "high_volatility",
                "low_liquidity"
              ]
            },
            {
              "ticker": "ETH",
              "agentRole": "fundamental",
              "claim": "HOLD",
              "confidence": 0.6,
              "direction": "neutral",
              "magnitude": 0.5,
              "rationale": "ETH shows mixed signals with strong fundamentals but uncertain technical momentum.",
              "signals": [
                {
                  "name": "liquidity_score",
                  "value": 1
                },
                {
                  "name": "volatility",
                  "value": 0.008
                },
                {
                  "name": "trend_strength",
                  "value": 0.1
                }
              ],
              "evidence": [
                "1756305809561",
                "1756305809561"
              ],
              "riskFlags": [
                "high_volatility",
                "low_liquidity"
              ]
            }
          ]
        },
        "openaiResponse": "FUNDAMENTAL ANALYSIS:\n\nStarting with Bitcoin (BTC), the asset shows a neutral RSI and stochastic, suggesting the market is neither overbought nor oversold. However, the MACD and Williams %R indicators are bearish, suggesting a potential downtrend. The signal strength is negative, further supporting the bearish sentiment. Despite the bearish technical indicators, BTC has a high liquidity score, which is a positive sign. The volatility is relatively low, suggesting a stable market. The market cap is substantial, indicating strong institutional interest. However, the negative trend strength raises concerns about the short-term direction of BTC. \n\nEthereum (ETH), on the other hand, shows a neutral RSI and stochastic, similar to BTC. The MACD is bullish, suggesting a potential uptrend, but the Williams %R indicator is bearish, creating a mixed signal. The signal strength is slightly positive, indicating a possible upward trend. ETH also has a high liquidity score, which is a positive sign. The volatility is higher than BTC's, indicating a more unstable market. The market cap is substantial but smaller than BTC's, suggesting less institutional interest. The trend strength is low, indicating uncertainty about the short-term direction of ETH.\n\nBased on the above analysis, BTC shows mixed signals with strong fundamentals but weak technical momentum. ETH also demonstrates mixed signals with strong fundamentals but uncertain technical momentum.\n\n{\n  \"claims\": [\n    {\n      \"ticker\": \"BTC\",\n      \"agentRole\": \"fundamental\",\n      \"claim\": \"HOLD\",\n      \"confidence\": 0.5,\n      \"direction\": \"bearish\",\n      \"magnitude\": 0.5,\n      \"rationale\": \"BTC shows mixed signals with strong fundamentals but weak technical momentum.\",\n      \"signals\": [\n        {\"name\": \"liquidity_score\", \"value\": 1.0},\n        {\"name\": \"volatility\", \"value\": 0.003},\n        {\"name\": \"trend_strength\", \"value\": -0.5}\n      ],\n      \"evidence\": [\"1756305809561\", \"1756305809561\"],\n      \"riskFlags\": [\"high_volatility\", \"low_liquidity\"]\n    },\n    {\n      \"ticker\": \"ETH\",\n      \"agentRole\": \"fundamental\",\n      \"claim\": \"HOLD\",\n      \"confidence\": 0.6,\n      \"direction\": \"neutral\",\n      \"magnitude\": 0.5,\n      \"rationale\": \"ETH shows mixed signals with strong fundamentals but uncertain technical momentum.\",\n      \"signals\": [\n        {\"name\": \"liquidity_score\", \"value\": 1.0},\n        {\"name\": \"volatility\", \"value\": 0.008},\n        {\"name\": \"trend_strength\", \"value\": 0.1}\n      ],\n      \"evidence\": [\"1756305809561\", \"1756305809561\"],\n      \"riskFlags\": [\"high_volatility\", \"low_liquidity\"]\n    }\n  ]\n}"
      }
    },
    {
      "timestamp": "2025-08-27T14:45:27.828Z",
      "role": "sentiment",
      "context": {
        "universe": [
          "BTC",
          "ETH"
        ],
        "marketStats": 2,
        "facts": 11,
        "news": 0
      },
      "response": {
        "claims": [
          {
            "id": "BTC_sentiment_1756305809561_0",
            "ticker": "BTC",
            "agentRole": "sentiment",
            "claim": "HOLD",
            "confidence": 0.2,
            "direction": "neutral",
            "magnitude": 0.71,
            "rationale": "Positive sentiment but lack of consistency score",
            "signals": [
              {
                "name": "sentiment_score",
                "value": 0.71
              },
              {
                "name": "news_coverage",
                "value": 10
              },
              {
                "name": "freshness_score",
                "value": 1
              }
            ],
            "evidence": [],
            "timestamp": 1756305809561,
            "riskFlags": [
              "low_consistency"
            ]
          },
          {
            "id": "ETH_sentiment_1756305809561_1",
            "ticker": "ETH",
            "agentRole": "sentiment",
            "claim": "HOLD",
            "confidence": 0.2,
            "direction": "neutral",
            "magnitude": 0.64,
            "rationale": "Positive sentiment but lack of consistency score",
            "signals": [
              {
                "name": "sentiment_score",
                "value": 0.64
              },
              {
                "name": "news_coverage",
                "value": 10
              },
              {
                "name": "freshness_score",
                "value": 1
              }
            ],
            "evidence": [],
            "timestamp": 1756305809561,
            "riskFlags": [
              "low_consistency"
            ]
          }
        ],
        "textPart": "SUMMARIZE:\n- BTC: The sentiment score is 0.71 with 10 articles, indicating a positive sentiment. The news is fresh but there is no consistency score provided.\n- ETH: The sentiment score is 0.64 with 10 articles, indicating a slightly less positive sentiment than BTC. The news is also fresh but there is no consistency score provided.\n\nREFLECT/CRITICIZE:\n- The summaries seem to be straightforward, but the lack of a consistency score makes it difficult to fully assess the sentiment. The sentiment scores are based on a range of articles, but without knowing how consistent these articles are in their sentiment, it's hard to gauge the overall sentiment.\n\nREVISE:\n- BTC: The sentiment score is 0.71 with 10 articles, indicating a positive sentiment. The news is fresh but the lack of a consistency score makes it hard to fully assess the sentiment.\n- ETH: The sentiment score is 0.64 with 10 articles, indicating a slightly less positive sentiment than BTC. The news is also fresh but the lack of a consistency score makes it hard to fully assess the sentiment.\n\nAGGREGATE:\n- BTC: The overall sentiment is positive, but the lack of a consistency score makes it hard to fully assess the sentiment.\n- ETH: The overall sentiment is slightly less positive than BTC, but the lack of a consistency score makes it hard to fully assess the sentiment.\n\nSCORE:\n- BTC: sentiment_score = 0.71 (coverage 10 x freshness 1 x consistency 0)\n- ETH: sentiment_score = 0.64 (coverage 10 x freshness 1 x consistency 0)\n\nBased on the above analysis, the sentiment for both BTC and ETH is positive but due to the lack of a consistency score, the confidence is low. Therefore, the recommendation is to HOLD for both BTC and ETH with a confidence of 0.2.",
        "jsonPart": {
          "claims": [
            {
              "ticker": "BTC",
              "agentRole": "sentiment",
              "claim": "HOLD",
              "confidence": 0.2,
              "direction": "neutral",
              "magnitude": 0.71,
              "rationale": "Positive sentiment but lack of consistency score",
              "signals": [
                {
                  "name": "sentiment_score",
                  "value": 0.71
                },
                {
                  "name": "news_coverage",
                  "value": 10
                },
                {
                  "name": "freshness_score",
                  "value": 1
                }
              ],
              "evidence": [],
              "riskFlags": [
                "low_consistency"
              ]
            },
            {
              "ticker": "ETH",
              "agentRole": "sentiment",
              "claim": "HOLD",
              "confidence": 0.2,
              "direction": "neutral",
              "magnitude": 0.64,
              "rationale": "Positive sentiment but lack of consistency score",
              "signals": [
                {
                  "name": "sentiment_score",
                  "value": 0.64
                },
                {
                  "name": "news_coverage",
                  "value": 10
                },
                {
                  "name": "freshness_score",
                  "value": 1
                }
              ],
              "evidence": [],
              "riskFlags": [
                "low_consistency"
              ]
            }
          ]
        },
        "openaiResponse": "SUMMARIZE:\n- BTC: The sentiment score is 0.71 with 10 articles, indicating a positive sentiment. The news is fresh but there is no consistency score provided.\n- ETH: The sentiment score is 0.64 with 10 articles, indicating a slightly less positive sentiment than BTC. The news is also fresh but there is no consistency score provided.\n\nREFLECT/CRITICIZE:\n- The summaries seem to be straightforward, but the lack of a consistency score makes it difficult to fully assess the sentiment. The sentiment scores are based on a range of articles, but without knowing how consistent these articles are in their sentiment, it's hard to gauge the overall sentiment.\n\nREVISE:\n- BTC: The sentiment score is 0.71 with 10 articles, indicating a positive sentiment. The news is fresh but the lack of a consistency score makes it hard to fully assess the sentiment.\n- ETH: The sentiment score is 0.64 with 10 articles, indicating a slightly less positive sentiment than BTC. The news is also fresh but the lack of a consistency score makes it hard to fully assess the sentiment.\n\nAGGREGATE:\n- BTC: The overall sentiment is positive, but the lack of a consistency score makes it hard to fully assess the sentiment.\n- ETH: The overall sentiment is slightly less positive than BTC, but the lack of a consistency score makes it hard to fully assess the sentiment.\n\nSCORE:\n- BTC: sentiment_score = 0.71 (coverage 10 x freshness 1 x consistency 0)\n- ETH: sentiment_score = 0.64 (coverage 10 x freshness 1 x consistency 0)\n\nBased on the above analysis, the sentiment for both BTC and ETH is positive but due to the lack of a consistency score, the confidence is low. Therefore, the recommendation is to HOLD for both BTC and ETH with a confidence of 0.2. \n\n{\n  \"claims\": [\n    {\n      \"ticker\": \"BTC\",\n      \"agentRole\": \"sentiment\",\n      \"claim\": \"HOLD\",\n      \"confidence\": 0.2,\n      \"direction\": \"neutral\",\n      \"magnitude\": 0.71,\n      \"rationale\": \"Positive sentiment but lack of consistency score\",\n      \"signals\": [\n        {\"name\": \"sentiment_score\", \"value\": 0.71},\n        {\"name\": \"news_coverage\", \"value\": 10},\n        {\"name\": \"freshness_score\", \"value\": 1}\n      ],\n      \"evidence\": [],\n      \"riskFlags\": [\"low_consistency\"]\n    },\n    {\n      \"ticker\": \"ETH\",\n      \"agentRole\": \"sentiment\",\n      \"claim\": \"HOLD\",\n      \"confidence\": 0.2,\n      \"direction\": \"neutral\",\n      \"magnitude\": 0.64,\n      \"rationale\": \"Positive sentiment but lack of consistency score\",\n      \"signals\": [\n        {\"name\": \"sentiment_score\", \"value\": 0.64},\n        {\"name\": \"news_coverage\", \"value\": 10},\n        {\"name\": \"freshness_score\", \"value\": 1}\n      ],\n      \"evidence\": [],\n      \"riskFlags\": [\"low_consistency\"]\n    }\n  ]\n}"
      }
    },
    {
      "timestamp": "2025-08-27T14:45:54.785Z",
      "role": "valuation",
      "context": {
        "universe": [
          "BTC",
          "ETH"
        ],
        "marketStats": 2,
        "facts": 11,
        "news": 0
      },
      "response": {
        "claims": [
          {
            "id": "BTC_valuation_1756305809561_0",
            "ticker": "BTC",
            "agentRole": "valuation",
            "claim": "HOLD",
            "confidence": 0.4,
            "direction": "neutral",
            "magnitude": 0.3,
            "rationale": "Mixed technical signals with bearish MACD but neutral RSI and stochastic. Moderate volatility suggests potential for significant moves.",
            "signals": [
              {
                "name": "rsi",
                "value": 49.13
              },
              {
                "name": "macd",
                "value": -733.41
              },
              {
                "name": "volatility_30d",
                "value": 0.3
              },
              {
                "name": "sharpe_proxy",
                "value": -1
              },
              {
                "name": "signal_strength",
                "value": -0.3
              }
            ],
            "evidence": [],
            "timestamp": 1756305809561,
            "riskFlags": [
              "high_volatility",
              "weak_signals"
            ]
          },
          {
            "id": "ETH_valuation_1756305809561_1",
            "ticker": "ETH",
            "agentRole": "valuation",
            "claim": "HOLD",
            "confidence": 0.5,
            "direction": "neutral",
            "magnitude": 0.3,
            "rationale": "Mixed technical signals with bullish MACD but neutral RSI and stochastic. Moderate volatility suggests potential for significant moves.",
            "signals": [
              {
                "name": "rsi",
                "value": 55.55
              },
              {
                "name": "macd",
                "value": 7.28
              },
              {
                "name": "volatility_30d",
                "value": 0.3
              },
              {
                "name": "sharpe_proxy",
                "value": 0.33
              },
              {
                "name": "signal_strength",
                "value": 0.1
              }
            ],
            "evidence": [],
            "timestamp": 1756305809561,
            "riskFlags": [
              "high_volatility",
              "weak_signals"
            ]
          }
        ],
        "textPart": "TECHNICAL ANALYSIS:\nBTC shows a neutral RSI at 49.13, indicating neither oversold nor overbought conditions. The MACD is bearish at -733.41, suggesting downward momentum. However, the stochastic is also neutral at 59.56, indicating a lack of clear trend. The signal strength is negative at -0.3, indicating weak technical momentum. Volatility is moderate at 0.3, indicating potential for significant moves. Overall, the technical picture for BTC is mixed with bearish MACD but neutral RSI and stochastic.\n\nETH displays a neutral RSI at 55.55, suggesting balanced buying and selling pressure. The MACD is bullish at 7.28, indicating upward momentum. The stochastic is also neutral at 69.85, suggesting a lack of clear trend. The signal strength is slightly positive at 0.1, indicating weak technical momentum. Volatility is moderate at 0.3, similar to BTC. The technical indicators for ETH suggest a cautious approach with mixed signals.\n\nCLAIMS:",
        "jsonPart": {
          "claims": [
            {
              "ticker": "BTC",
              "agentRole": "valuation",
              "claim": "HOLD",
              "confidence": 0.4,
              "direction": "neutral",
              "magnitude": 0.3,
              "rationale": "Mixed technical signals with bearish MACD but neutral RSI and stochastic. Moderate volatility suggests potential for significant moves.",
              "signals": [
                {
                  "name": "rsi",
                  "value": 49.13
                },
                {
                  "name": "macd",
                  "value": -733.41
                },
                {
                  "name": "volatility_30d",
                  "value": 0.3
                },
                {
                  "name": "sharpe_proxy",
                  "value": -1
                },
                {
                  "name": "signal_strength",
                  "value": -0.3
                }
              ],
              "evidence": [
                "1756305809561"
              ],
              "riskFlags": [
                "high_volatility",
                "weak_signals"
              ]
            },
            {
              "ticker": "ETH",
              "agentRole": "valuation",
              "claim": "HOLD",
              "confidence": 0.5,
              "direction": "neutral",
              "magnitude": 0.3,
              "rationale": "Mixed technical signals with bullish MACD but neutral RSI and stochastic. Moderate volatility suggests potential for significant moves.",
              "signals": [
                {
                  "name": "rsi",
                  "value": 55.55
                },
                {
                  "name": "macd",
                  "value": 7.28
                },
                {
                  "name": "volatility_30d",
                  "value": 0.3
                },
                {
                  "name": "sharpe_proxy",
                  "value": 0.33
                },
                {
                  "name": "signal_strength",
                  "value": 0.1
                }
              ],
              "evidence": [
                "1756305809561"
              ],
              "riskFlags": [
                "high_volatility",
                "weak_signals"
              ]
            }
          ]
        },
        "openaiResponse": "TECHNICAL ANALYSIS:\nBTC shows a neutral RSI at 49.13, indicating neither oversold nor overbought conditions. The MACD is bearish at -733.41, suggesting downward momentum. However, the stochastic is also neutral at 59.56, indicating a lack of clear trend. The signal strength is negative at -0.3, indicating weak technical momentum. Volatility is moderate at 0.3, indicating potential for significant moves. Overall, the technical picture for BTC is mixed with bearish MACD but neutral RSI and stochastic.\n\nETH displays a neutral RSI at 55.55, suggesting balanced buying and selling pressure. The MACD is bullish at 7.28, indicating upward momentum. The stochastic is also neutral at 69.85, suggesting a lack of clear trend. The signal strength is slightly positive at 0.1, indicating weak technical momentum. Volatility is moderate at 0.3, similar to BTC. The technical indicators for ETH suggest a cautious approach with mixed signals.\n\nCLAIMS:\n\n{\n  \"claims\": [\n    {\n      \"ticker\": \"BTC\",\n      \"agentRole\": \"valuation\",\n      \"claim\": \"HOLD\",\n      \"confidence\": 0.4,\n      \"direction\": \"neutral\",\n      \"magnitude\": 0.3,\n      \"rationale\": \"Mixed technical signals with bearish MACD but neutral RSI and stochastic. Moderate volatility suggests potential for significant moves.\",\n      \"signals\": [\n        {\"name\": \"rsi\", \"value\": 49.13},\n        {\"name\": \"macd\", \"value\": -733.41},\n        {\"name\": \"volatility_30d\", \"value\": 0.3},\n        {\"name\": \"sharpe_proxy\", \"value\": -1.0},\n        {\"name\": \"signal_strength\", \"value\": -0.3}\n      ],\n      \"evidence\": [\"1756305809561\"],\n      \"riskFlags\": [\"high_volatility\", \"weak_signals\"]\n    },\n    {\n      \"ticker\": \"ETH\",\n      \"agentRole\": \"valuation\",\n      \"claim\": \"HOLD\",\n      \"confidence\": 0.5,\n      \"direction\": \"neutral\",\n      \"magnitude\": 0.3,\n      \"rationale\": \"Mixed technical signals with bullish MACD but neutral RSI and stochastic. Moderate volatility suggests potential for significant moves.\",\n      \"signals\": [\n        {\"name\": \"rsi\", \"value\": 55.55},\n        {\"name\": \"macd\", \"value\": 7.28},\n        {\"name\": \"volatility_30d\", \"value\": 0.3},\n        {\"name\": \"sharpe_proxy\", \"value\": 0.33},\n        {\"name\": \"signal_strength\", \"value\": 0.1}\n      ],\n      \"evidence\": [\"1756305809561\"],\n      \"riskFlags\": [\"high_volatility\", \"weak_signals\"]\n    }\n  ]\n}"
      }
    }
  ]
}