{
  "testDate": "8/27/2025, 9:39:01 PM",
  "totalAgents": 3,
  "responses": [
    {
      "timestamp": "2025-08-27T17:38:17.372Z",
      "role": "fundamental",
      "context": {
        "universe": [
          "BTC",
          "ETH"
        ],
        "marketStats": 2,
        "facts": 11,
        "news": 0
      },
      "response": {
        "claims": [
          {
            "id": "BTC_fundamental_1756316209729_0",
            "ticker": "BTC",
            "agentRole": "fundamental",
            "claim": "HOLD",
            "confidence": 0.4,
            "evidence": [
              "BTC_market_1756316297372",
              "BTC_market_1756316297372",
              "BTC_market_1756316297372"
            ],
            "timestamp": 1756316209729,
            "riskFlags": [
              "negative_trend_strength"
            ],
            "direction": "bearish",
            "magnitude": 0.5,
            "rationale": "Strong liquidity and market cap but negative trend strength",
            "signals": [
              {
                "name": "liquidity_score",
                "value": 1
              },
              {
                "name": "volatility",
                "value": 0.006
              },
              {
                "name": "trend_strength",
                "value": -0.5
              }
            ]
          },
          {
            "id": "ETH_fundamental_1756316209729_1",
            "ticker": "ETH",
            "agentRole": "fundamental",
            "claim": "HOLD",
            "confidence": 0.4,
            "evidence": [
              "ETH_market_1756316297372",
              "ETH_market_1756316297372",
              "ETH_market_1756316297372"
            ],
            "timestamp": 1756316209729,
            "riskFlags": [
              "negative_trend_strength"
            ],
            "direction": "bearish",
            "magnitude": 0.1,
            "rationale": "Strong liquidity and market cap but weak negative trend strength",
            "signals": [
              {
                "name": "liquidity_score",
                "value": 1
              },
              {
                "name": "volatility",
                "value": 0.008
              },
              {
                "name": "trend_strength",
                "value": -0.1
              }
            ]
          }
        ],
        "textPart": "FUNDAMENTAL ANALYSIS:\n\nStarting with BTC, the asset shows excellent liquidity, as indicated by the maximum liquidity score of 1.000. This suggests that there is a high volume of trading activity, which can facilitate large transactions without significantly impacting the price. The volatility of BTC is relatively low at 0.006, indicating a stable pricing environment. However, the signal strength is negative at -0.5, suggesting a bearish trend. The market cap is extremely large, indicating strong institutional interest. Despite the negative trend strength, the strong fundamentals in terms of liquidity and market cap may provide some support for the asset.\n\nMoving on to ETH, the asset also shows excellent liquidity with a score of 1.000. This, along with the high trading volume, suggests a healthy market activity. The volatility is slightly higher than BTC at 0.008, indicating a slightly higher risk. The signal strength is negative but less so than BTC, at -0.1, indicating a weak bearish trend. The market cap, while significantly smaller than BTC, is still substantial, suggesting solid institutional backing. Similar to BTC, the strong fundamentals may provide some support despite the weak bearish trend.\n\nBased on the above analysis, both BTC and ETH show strong fundamentals but weak technical momentum. The excellent liquidity and substantial market caps suggest a solid foundation, but the negative trend strength raises concerns about the short-term direction. Therefore, a cautious approach may be warranted for both assets.\n\nJSON CLAIMS:",
        "jsonPart": {
          "claims": [
            {
              "ticker": "BTC",
              "agentRole": "fundamental",
              "claim": "HOLD",
              "confidence": 0.4,
              "direction": "bearish",
              "magnitude": 0.5,
              "rationale": "Strong liquidity and market cap but negative trend strength",
              "signals": [
                {
                  "name": "liquidity_score",
                  "value": 1
                },
                {
                  "name": "volatility",
                  "value": 0.006
                },
                {
                  "name": "trend_strength",
                  "value": -0.5
                }
              ],
              "evidence": [
                "1756316209729"
              ],
              "riskFlags": [
                "negative_trend_strength"
              ]
            },
            {
              "ticker": "ETH",
              "agentRole": "fundamental",
              "claim": "HOLD",
              "confidence": 0.4,
              "direction": "bearish",
              "magnitude": 0.1,
              "rationale": "Strong liquidity and market cap but weak negative trend strength",
              "signals": [
                {
                  "name": "liquidity_score",
                  "value": 1
                },
                {
                  "name": "volatility",
                  "value": 0.008
                },
                {
                  "name": "trend_strength",
                  "value": -0.1
                }
              ],
              "evidence": [
                "1756316209729"
              ],
              "riskFlags": [
                "negative_trend_strength"
              ]
            }
          ]
        },
        "openaiResponse": "FUNDAMENTAL ANALYSIS:\n\nStarting with BTC, the asset shows excellent liquidity, as indicated by the maximum liquidity score of 1.000. This suggests that there is a high volume of trading activity, which can facilitate large transactions without significantly impacting the price. The volatility of BTC is relatively low at 0.006, indicating a stable pricing environment. However, the signal strength is negative at -0.5, suggesting a bearish trend. The market cap is extremely large, indicating strong institutional interest. Despite the negative trend strength, the strong fundamentals in terms of liquidity and market cap may provide some support for the asset.\n\nMoving on to ETH, the asset also shows excellent liquidity with a score of 1.000. This, along with the high trading volume, suggests a healthy market activity. The volatility is slightly higher than BTC at 0.008, indicating a slightly higher risk. The signal strength is negative but less so than BTC, at -0.1, indicating a weak bearish trend. The market cap, while significantly smaller than BTC, is still substantial, suggesting solid institutional backing. Similar to BTC, the strong fundamentals may provide some support despite the weak bearish trend.\n\nBased on the above analysis, both BTC and ETH show strong fundamentals but weak technical momentum. The excellent liquidity and substantial market caps suggest a solid foundation, but the negative trend strength raises concerns about the short-term direction. Therefore, a cautious approach may be warranted for both assets.\n\nJSON CLAIMS:\n\n{\n  \"claims\": [\n    {\n      \"ticker\": \"BTC\",\n      \"agentRole\": \"fundamental\",\n      \"claim\": \"HOLD\",\n      \"confidence\": 0.4,\n      \"direction\": \"bearish\",\n      \"magnitude\": 0.5,\n      \"rationale\": \"Strong liquidity and market cap but negative trend strength\",\n      \"signals\": [\n        {\"name\": \"liquidity_score\", \"value\": 1.000},\n        {\"name\": \"volatility\", \"value\": 0.006},\n        {\"name\": \"trend_strength\", \"value\": -0.5}\n      ],\n      \"evidence\": [\"1756316209729\"],\n      \"riskFlags\": [\"negative_trend_strength\"]\n    },\n    {\n      \"ticker\": \"ETH\",\n      \"agentRole\": \"fundamental\",\n      \"claim\": \"HOLD\",\n      \"confidence\": 0.4,\n      \"direction\": \"bearish\",\n      \"magnitude\": 0.1,\n      \"rationale\": \"Strong liquidity and market cap but weak negative trend strength\",\n      \"signals\": [\n        {\"name\": \"liquidity_score\", \"value\": 1.000},\n        {\"name\": \"volatility\", \"value\": 0.008},\n        {\"name\": \"trend_strength\", \"value\": -0.1}\n      ],\n      \"evidence\": [\"1756316209729\"],\n      \"riskFlags\": [\"negative_trend_strength\"]\n    }\n  ]\n}"
      }
    },
    {
      "timestamp": "2025-08-27T17:38:28.286Z",
      "role": "sentiment",
      "context": {
        "universe": [
          "BTC",
          "ETH"
        ],
        "marketStats": 2,
        "facts": 11,
        "news": 0
      },
      "response": {
        "claims": [
          {
            "id": "BTC_sentiment_1756316209729_0",
            "ticker": "BTC",
            "agentRole": "sentiment",
            "claim": "BUY",
            "confidence": 0.71,
            "evidence": [],
            "timestamp": 1756316209729,
            "riskFlags": [],
            "direction": "bullish",
            "magnitude": 0.71,
            "rationale": "Positive sentiment from news coverage, including significant acquisitions and potential rate cuts.",
            "signals": [
              {
                "name": "sentiment_score",
                "value": 0.71
              },
              {
                "name": "news_coverage",
                "value": 20
              },
              {
                "name": "freshness_score",
                "value": 1
              }
            ]
          },
          {
            "id": "ETH_sentiment_1756316209729_1",
            "ticker": "ETH",
            "agentRole": "sentiment",
            "claim": "BUY",
            "confidence": 0.64,
            "evidence": [
              "ETH_news_1756316308286",
              "ETH_news_1756316308286",
              "ETH_news_1756316308286"
            ],
            "timestamp": 1756316209729,
            "riskFlags": [],
            "direction": "bullish",
            "magnitude": 0.64,
            "rationale": "Positive sentiment from news coverage, including significant acquisitions and market expansion.",
            "signals": [
              {
                "name": "sentiment_score",
                "value": 0.64
              },
              {
                "name": "news_coverage",
                "value": 20
              },
              {
                "name": "freshness_score",
                "value": 1
              }
            ]
          }
        ],
        "textPart": "No text analysis available",
        "jsonPart": {
          "claims": [
            {
              "ticker": "BTC",
              "agentRole": "sentiment",
              "claim": "BUY",
              "confidence": 0.71,
              "direction": "bullish",
              "magnitude": 0.71,
              "rationale": "Positive sentiment from news coverage, including significant acquisitions and potential rate cuts.",
              "signals": [
                {
                  "name": "sentiment_score",
                  "value": 0.71
                },
                {
                  "name": "news_coverage",
                  "value": 20
                },
                {
                  "name": "freshness_score",
                  "value": 1
                }
              ],
              "evidence": [],
              "riskFlags": []
            },
            {
              "ticker": "ETH",
              "agentRole": "sentiment",
              "claim": "BUY",
              "confidence": 0.64,
              "direction": "bullish",
              "magnitude": 0.64,
              "rationale": "Positive sentiment from news coverage, including significant acquisitions and market expansion.",
              "signals": [
                {
                  "name": "sentiment_score",
                  "value": 0.64
                },
                {
                  "name": "news_coverage",
                  "value": 20
                },
                {
                  "name": "freshness_score",
                  "value": 1
                }
              ],
              "evidence": [],
              "riskFlags": []
            }
          ]
        },
        "openaiResponse": "{\n  \"claims\": [\n    {\n      \"ticker\": \"BTC\",\n      \"agentRole\": \"sentiment\",\n      \"claim\": \"BUY\",\n      \"confidence\": 0.71,\n      \"direction\": \"bullish\",\n      \"magnitude\": 0.71,\n      \"rationale\": \"Positive sentiment from news coverage, including significant acquisitions and potential rate cuts.\",\n      \"signals\": [\n        {\"name\": \"sentiment_score\", \"value\": 0.71},\n        {\"name\": \"news_coverage\", \"value\": 20},\n        {\"name\": \"freshness_score\", \"value\": 1}\n      ],\n      \"evidence\": [],\n      \"riskFlags\": []\n    },\n    {\n      \"ticker\": \"ETH\",\n      \"agentRole\": \"sentiment\",\n      \"claim\": \"BUY\",\n      \"confidence\": 0.64,\n      \"direction\": \"bullish\",\n      \"magnitude\": 0.64,\n      \"rationale\": \"Positive sentiment from news coverage, including significant acquisitions and market expansion.\",\n      \"signals\": [\n        {\"name\": \"sentiment_score\", \"value\": 0.64},\n        {\"name\": \"news_coverage\", \"value\": 20},\n        {\"name\": \"freshness_score\", \"value\": 1}\n      ],\n      \"evidence\": [],\n      \"riskFlags\": []\n    }\n  ]\n}"
      }
    },
    {
      "timestamp": "2025-08-27T17:38:47.237Z",
      "role": "valuation",
      "context": {
        "universe": [
          "BTC",
          "ETH"
        ],
        "marketStats": 2,
        "facts": 11,
        "news": 0
      },
      "response": {
        "claims": [
          {
            "id": "BTC_valuation_1756316209729_0",
            "ticker": "BTC",
            "agentRole": "valuation",
            "claim": "HOLD",
            "confidence": 0.4,
            "evidence": [],
            "timestamp": 1756316209729,
            "riskFlags": [
              "high_volatility",
              "weak_signals"
            ],
            "direction": "neutral",
            "magnitude": 0.3,
            "rationale": "Mixed signals with bearish MACD and weak signal strength but neutral RSI and Stochastic",
            "signals": [
              {
                "name": "rsi",
                "value": 51.6
              },
              {
                "name": "macd",
                "value": -589.35
              },
              {
                "name": "volatility_30d",
                "value": 0.3
              },
              {
                "name": "signal_strength",
                "value": -0.5
              }
            ]
          },
          {
            "id": "ETH_valuation_1756316209729_1",
            "ticker": "ETH",
            "agentRole": "valuation",
            "claim": "HOLD",
            "confidence": 0.4,
            "evidence": [],
            "timestamp": 1756316209729,
            "riskFlags": [
              "high_volatility",
              "weak_signals"
            ],
            "direction": "neutral",
            "magnitude": 0.3,
            "rationale": "Mixed signals with bullish MACD but overbought Stochastic and weak signal strength",
            "signals": [
              {
                "name": "rsi",
                "value": 55.21
              },
              {
                "name": "macd",
                "value": 12.94
              },
              {
                "name": "volatility_30d",
                "value": 0.3
              },
              {
                "name": "signal_strength",
                "value": -0.1
              }
            ]
          }
        ],
        "textPart": "TECHNICAL ANALYSIS:\nBTC shows a neutral RSI at 51.60, indicating neither oversold nor overbought conditions. The MACD is bearish at -589.35, suggesting downward momentum. The Stochastic is at 75.55, which is close to the overbought threshold but still within the neutral range. The signal strength is negative at -0.5, indicating weak technical momentum. Volatility is moderate at 0.3, indicating potential for significant moves. Overall, the technical picture for BTC is mixed with bearish MACD and weak signal strength but neutral RSI and Stochastic.\n\nETH displays a neutral RSI at 55.21, suggesting balanced buying and selling pressure. The MACD is bullish at 12.94, indicating upward momentum. However, the Stochastic is at 82.81, which is in the overbought territory, suggesting a potential price reversal. The signal strength is slightly negative at -0.1, indicating weak technical momentum. Volatility is moderate at 0.3, similar to BTC. The technical indicators for ETH suggest a cautious approach with mixed signals.\n\nBased on the above analysis, the recommendation for BTC would be to HOLD due to the mixed signals and weak technical momentum. For ETH, despite the bullish MACD, the overbought Stochastic suggests caution, hence a HOLD recommendation is also suggested.\n\nCLAIMS:",
        "jsonPart": {
          "claims": [
            {
              "ticker": "BTC",
              "agentRole": "valuation",
              "claim": "HOLD",
              "confidence": 0.4,
              "direction": "neutral",
              "magnitude": 0.3,
              "rationale": "Mixed signals with bearish MACD and weak signal strength but neutral RSI and Stochastic",
              "signals": [
                {
                  "name": "rsi",
                  "value": 51.6
                },
                {
                  "name": "macd",
                  "value": -589.35
                },
                {
                  "name": "volatility_30d",
                  "value": 0.3
                },
                {
                  "name": "signal_strength",
                  "value": -0.5
                }
              ],
              "evidence": [
                "1756316209729"
              ],
              "riskFlags": [
                "high_volatility",
                "weak_signals"
              ]
            },
            {
              "ticker": "ETH",
              "agentRole": "valuation",
              "claim": "HOLD",
              "confidence": 0.4,
              "direction": "neutral",
              "magnitude": 0.3,
              "rationale": "Mixed signals with bullish MACD but overbought Stochastic and weak signal strength",
              "signals": [
                {
                  "name": "rsi",
                  "value": 55.21
                },
                {
                  "name": "macd",
                  "value": 12.94
                },
                {
                  "name": "volatility_30d",
                  "value": 0.3
                },
                {
                  "name": "signal_strength",
                  "value": -0.1
                }
              ],
              "evidence": [
                "1756316209729"
              ],
              "riskFlags": [
                "high_volatility",
                "weak_signals"
              ]
            }
          ]
        },
        "openaiResponse": "TECHNICAL ANALYSIS:\nBTC shows a neutral RSI at 51.60, indicating neither oversold nor overbought conditions. The MACD is bearish at -589.35, suggesting downward momentum. The Stochastic is at 75.55, which is close to the overbought threshold but still within the neutral range. The signal strength is negative at -0.5, indicating weak technical momentum. Volatility is moderate at 0.3, indicating potential for significant moves. Overall, the technical picture for BTC is mixed with bearish MACD and weak signal strength but neutral RSI and Stochastic.\n\nETH displays a neutral RSI at 55.21, suggesting balanced buying and selling pressure. The MACD is bullish at 12.94, indicating upward momentum. However, the Stochastic is at 82.81, which is in the overbought territory, suggesting a potential price reversal. The signal strength is slightly negative at -0.1, indicating weak technical momentum. Volatility is moderate at 0.3, similar to BTC. The technical indicators for ETH suggest a cautious approach with mixed signals.\n\nBased on the above analysis, the recommendation for BTC would be to HOLD due to the mixed signals and weak technical momentum. For ETH, despite the bullish MACD, the overbought Stochastic suggests caution, hence a HOLD recommendation is also suggested.\n\nCLAIMS:\n\n{\n  \"claims\": [\n    {\n      \"ticker\": \"BTC\",\n      \"agentRole\": \"valuation\",\n      \"claim\": \"HOLD\",\n      \"confidence\": 0.4,\n      \"direction\": \"neutral\",\n      \"magnitude\": 0.3,\n      \"rationale\": \"Mixed signals with bearish MACD and weak signal strength but neutral RSI and Stochastic\",\n      \"signals\": [\n        {\"name\": \"rsi\", \"value\": 51.60},\n        {\"name\": \"macd\", \"value\": -589.35},\n        {\"name\": \"volatility_30d\", \"value\": 0.3},\n        {\"name\": \"signal_strength\", \"value\": -0.5}\n      ],\n      \"evidence\": [\"1756316209729\"],\n      \"riskFlags\": [\"high_volatility\", \"weak_signals\"]\n    },\n    {\n      \"ticker\": \"ETH\",\n      \"agentRole\": \"valuation\",\n      \"claim\": \"HOLD\",\n      \"confidence\": 0.4,\n      \"direction\": \"neutral\",\n      \"magnitude\": 0.3,\n      \"rationale\": \"Mixed signals with bullish MACD but overbought Stochastic and weak signal strength\",\n      \"signals\": [\n        {\"name\": \"rsi\", \"value\": 55.21},\n        {\"name\": \"macd\", \"value\": 12.94},\n        {\"name\": \"volatility_30d\", \"value\": 0.3},\n        {\"name\": \"signal_strength\", \"value\": -0.1}\n      ],\n      \"evidence\": [\"1756316209729\"],\n      \"riskFlags\": [\"high_volatility\", \"weak_signals\"]\n    }\n  ]\n}"
      }
    }
  ]
}