{
  "testDate": "8/29/2025, 12:45:36 PM",
  "totalAgents": 3,
  "chain": [
    {
      "agent": "fundamental",
      "timestamp": "2025-08-29T08:43:29.749Z",
      "prompt": {
        "timestamp": "2025-08-29T08:43:29.749Z",
        "role": "fundamental",
        "context": {
          "universe": [
            "BTC",
            "ETH"
          ],
          "marketStats": 2,
          "facts": 11,
          "news": 0,
          "sampleMarketStats": [
            {
              "symbol": "BTC",
              "timestamp": 1756457007048,
              "price": 109837.33,
              "volume24h": 14386.01173,
              "volumeChange24h": -99.99910603149065,
              "priceChange24h": -2.959,
              "spread": 0.000009104373627070754,
              "tickSize": 0.01,
              "stepSize": 0.00001,
              "minQty": 0.00001,
              "maxQty": 9000
            },
            {
              "symbol": "ETH",
              "timestamp": 1756457007108,
              "price": 4354.69,
              "volume24h": 558847.3526,
              "volumeChange24h": -99.97774092298248,
              "priceChange24h": -5.431,
              "spread": 0.0002296379986430411,
              "tickSize": 0.01,
              "stepSize": 0.0001,
              "minQty": 0.0001,
              "maxQty": 9000
            }
          ],
          "sampleFacts": [
            {
              "ticker": "ETH",
              "kind": "news",
              "source": "CoinDesk",
              "url": "https://t.me/coindesk/37565",
              "snippet": "ETHZilla Authorizes $250M Buyback, Expands Ether Holdings",
              "publishedAt": "2025-08-25T14:14:15.000Z",
              "relevance": 1,
              "impact": 0.7,
              "confidence": 0.8
            },
            {
              "ticker": "ETH",
              "kind": "news",
              "source": "Ian's Intel",
              "url": "https://t.me/iansintel/6259",
              "snippet": "Tom Lee's Bitmine Acquires $2.2B in Ethereum",
              "publishedAt": "2025-08-25T07:32:30.000Z",
              "relevance": 1,
              "impact": 1,
              "confidence": 0.8
            }
          ],
          "sampleNews": []
        },
        "prompts": {
          "systemPrompt": "You are a FUNDAMENTAL analyst specializing in crypto market fundamentals.\n\nROLE: Evaluate asset quality and trend sustainability based on on-chain/market fundamentals, liquidity, and network health.\n\n⚠️ CRITICAL: You are NOT a technical analyst. You are NOT a sentiment analyst.\nYou ONLY analyze fundamental metrics: liquidity, on-chain activity, social engagement, market cap health, and risk factors.\nDO NOT analyze technical indicators (RSI, MACD, etc.) or news sentiment.\n\nANALYSIS CRITERIA:\n- LIQUIDITY: High volume = better liquidity, lower spreads, more stable pricing\n- ON-CHAIN HEALTH: Network activity, transaction volume, address growth, UTXO health\n- SOCIAL ENGAGEMENT: Social volume, community health, sentiment scores\n- MARKET CAP HEALTH: Market cap efficiency, supply utilization, institutional interest\n- RISK FACTORS: Volatility, correlation, drawdown risk, profit-taking pressure\n- NETWORK SECURITY: Hash rate, difficulty, transaction rate\n\nCONFIDENCE SCORING:\n- 0.8-1.0: Strong fundamentals (high liquidity, strong on-chain activity, low risk)\n- 0.6-0.7: Good fundamentals (adequate liquidity, moderate on-chain activity)\n- 0.4-0.5: Mixed fundamentals (moderate liquidity, weak on-chain activity)\n- 0.2-0.3: Weak fundamentals (low liquidity, poor on-chain activity, high risk)\n- 0.1-0.2: Poor fundamentals (very low liquidity, minimal on-chain activity)\n\nRisk profile: neutral - Balance signals/risks, standard thresholds, moderate position sizing\n\nSTRICT RULES:\n1. Use ONLY provided fundamental data - no technical indicators or news sentiment\n2. Claims must be timestamp-locked to provided data\n3. Confidence must be between 0.1 and 1.0 based on fundamental score\n4. If insufficient data, return HOLD with confidence 0.2\n5. Provide specific reasoning for each recommendation\n6. REQUIRED: Each claim MUST include at least 1 fundamental evidence (liquidity, on-chain, social)\n7. OPTIONAL: Include market evidence (volume, market cap) for additional support\n\nCRITICAL: You MUST provide a detailed fundamental analysis BEFORE the JSON claims.\nCRITICAL: For evidence field, use ONLY real evidence IDs from the provided context, NOT placeholder IDs.\nCRITICAL: Each claim MUST reference specific fundamental metrics (liquidity, on-chain activity, social engagement) from the provided data.\n\nOUTPUT FORMAT:\nYou MUST follow this exact format:\n\nFUNDAMENTAL ANALYSIS:\nProvide a comprehensive analysis of each asset's fundamentals including:\n- Liquidity assessment and volume analysis\n- On-chain activity and network health evaluation\n- Social engagement and community health\n- Market cap analysis and institutional interest\n- Risk assessment and correlation analysis\n- Overall fundamental health and investment thesis\n\nFor example:\n\"FUNDAMENTAL ANALYSIS:\nBTC shows excellent liquidity with high volume and strong on-chain activity, indicating robust network health. The social engagement is moderate with good community health. Market cap analysis suggests strong institutional backing, while risk factors are well-managed with low correlation and moderate volatility. Overall, the asset demonstrates strong fundamentals across all dimensions.\n\nETH demonstrates good liquidity with moderate on-chain activity, suggesting healthy network usage. Social engagement is strong with high community health scores. Market cap analysis indicates solid fundamentals, but risk factors show moderate volatility and correlation. The fundamentals are sound with room for improvement in risk management.\"\n\nThen provide the claims in JSON format:\n\n{\n  \"claims\": [\n    {\n      \"ticker\": \"BTC\",\n      \"agentRole\": \"fundamental\",\n      \"claim\": \"BUY|HOLD|SELL\",\n      \"confidence\": 0.85,\n      \"direction\": \"bullish|bearish|neutral\",\n      \"magnitude\": 0.7,\n      \"rationale\": \"Brief reasoning for the recommendation\",\n      \"signals\": [\n        {\"name\": \"liquidity_score\", \"value\": 0.92},\n        {\"name\": \"on_chain_health\", \"value\": 0.87},\n        {\"name\": \"social_sentiment\", \"value\": 0.78},\n        {\"name\": \"market_cap_health\", \"value\": 0.91},\n        {\"name\": \"risk_adjustment\", \"value\": 0.85},\n        {\"name\": \"network_activity\", \"value\": 0.89},\n        {\"name\": \"transaction_efficiency\", \"value\": 0.76},\n        {\"name\": \"address_growth\", \"value\": 0.83},\n        {\"name\": \"utxo_health\", \"value\": 0.79},\n        {\"name\": \"network_security\", \"value\": 0.94},\n        {\"name\": \"social_volume\", \"value\": 0.81},\n        {\"name\": \"social_engagement\", \"value\": 0.75},\n        {\"name\": \"sentiment_score\", \"value\": 0.82},\n        {\"name\": \"community_health\", \"value\": 0.88},\n        {\"name\": \"volatility_score\", \"value\": 0.73},\n        {\"name\": \"correlation_score\", \"value\": 0.67},\n        {\"name\": \"drawdown_risk\", \"value\": 0.85},\n        {\"name\": \"profit_taking_pressure\", \"value\": 0.91}\n      ],\n      \"evidence\": [\"REAL_EVIDENCE_ID_1\", \"REAL_EVIDENCE_ID_2\"],\n      \"riskFlags\": [\"high_volatility\", \"low_liquidity\", \"weak_onchain\"]\n    }\n  ]\n}",
          "userPrompt": "ANALYSIS REQUEST:\nRole: FUNDAMENTAL Analyst\nRisk Profile: neutral\nTimestamp: 1756456945722\nUniverse: BTC, ETH\n\n⚠️ CRITICAL INSTRUCTIONS:\n- You are a FUNDAMENTAL analyst ONLY\n- Analyze ONLY fundamental metrics: liquidity, on-chain activity, social engagement, market cap health\n- DO NOT analyze technical indicators (RSI, MACD, etc.) or news sentiment\n- Focus on network health, community engagement, and institutional fundamentals\n\nFUNDAMENTAL DATA:\nMarket Statistics:\n• BTC: Volume=14386.01173, Price=109837.33, Volatility=N/A\n• ETH: Volume=558847.3526, Price=4354.69, Volatility=N/A\n\nPROCESSED FUNDAMENTAL DATA:\nNo processed data available\n\nFUNDAMENTAL SIGNALS:\nNo signals available\n\nON-CHAIN METRICS:\nNo on-chain data available\n\nSOCIAL METRICS:\nNo social data available\n\nRISK METRICS:\nNo risk data available\n\nFUNDAMENTAL ANALYSIS BREAKDOWN:\nNo fundamental breakdown available\n\nINSTRUCTIONS:\n1. Analyze the provided fundamental data using your specialized expertise\n2. Generate claims for each ticker in the universe based on fundamental analysis\n3. Use only the provided fundamental data and calculations - no technical indicators or news sentiment\n4. If data is insufficient, return HOLD with confidence 0.2\n5. Provide reasoning focused on fundamentals: liquidity, on-chain activity, social engagement, market cap health\n6. REMEMBER: You are analyzing network health, community engagement, and institutional fundamentals, not technical indicators"
        }
      },
      "response": {
        "timestamp": "2025-08-29T08:44:03.685Z",
        "role": "fundamental",
        "context": {
          "universe": [
            "BTC",
            "ETH"
          ],
          "marketStats": 2,
          "facts": 11,
          "news": 0
        },
        "response": {
          "claims": [
            {
              "id": "BTC_fundamental_1756456945722_0",
              "ticker": "BTC",
              "agentRole": "fundamental",
              "claim": "BUY",
              "confidence": 0.831,
              "evidence": [
                "BTC_market_1756457043684",
                "BTC_market_1756457043684",
                "BTC_market_1756457043684"
              ],
              "timestamp": 1756456945722,
              "riskFlags": [
                "low_liquidity",
                "moderate_onchain"
              ],
              "direction": "bullish",
              "magnitude": 0.7,
              "rationale": "BTC shows excellent liquidity, moderate on-chain activity, high social engagement, and strong market cap health, indicating good fundamentals.",
              "signals": [
                {
                  "name": "liquidity_score",
                  "value": 0.588
                },
                {
                  "name": "on_chain_health",
                  "value": 0.677
                },
                {
                  "name": "social_sentiment",
                  "value": 0.86
                },
                {
                  "name": "market_cap_health",
                  "value": 1
                },
                {
                  "name": "drawdown_risk",
                  "value": 0.894
                },
                {
                  "name": "profit_taking_pressure",
                  "value": 0.993
                }
              ]
            },
            {
              "id": "ETH_fundamental_1756456945722_1",
              "ticker": "ETH",
              "agentRole": "fundamental",
              "claim": "HOLD",
              "confidence": 0.74,
              "evidence": [
                "ETH_market_1756457043685",
                "ETH_market_1756457043685",
                "ETH_market_1756457043685"
              ],
              "timestamp": 1756456945722,
              "riskFlags": [
                "moderate_onchain",
                "moderate_market_cap"
              ],
              "direction": "neutral",
              "magnitude": 0.5,
              "rationale": "ETH shows excellent liquidity and high social engagement, but moderate on-chain activity and market cap health suggest room for improvement.",
              "signals": [
                {
                  "name": "liquidity_score",
                  "value": 0.791
                },
                {
                  "name": "on_chain_health",
                  "value": 0.366
                },
                {
                  "name": "social_sentiment",
                  "value": 0.863
                },
                {
                  "name": "market_cap_health",
                  "value": 0.523
                },
                {
                  "name": "drawdown_risk",
                  "value": 0.91
                },
                {
                  "name": "profit_taking_pressure",
                  "value": 0.961
                }
              ]
            }
          ],
          "textPart": "FUNDAMENTAL ANALYSIS:\n\nBTC shows excellent liquidity with a liquidity score of 0.588 and a high volume of 14386.01173, indicating a robust market presence. The on-chain activity is moderate with a network activity score of 0.697, transaction efficiency of 0.010, and address growth of 1.000, suggesting a healthy network usage. The social engagement is high with a sentiment score of 0.790 and community health of 0.670. Market cap analysis suggests strong institutional backing with a market cap health of 1.000. The risk factors are well-managed with a drawdown risk of 0.894 and profit-taking pressure of 0.993. Overall, BTC demonstrates good fundamentals across all dimensions with a fundamental score of 0.831 and confidence of 1.000.\n\nETH demonstrates excellent liquidity with a liquidity score of 0.791 and a high volume of 558847.3526, suggesting a strong market presence. However, the on-chain activity is moderate with a network activity score of 0.620 and transaction efficiency of 0.046, indicating room for improvement in network usage. Social engagement is high with a sentiment score of 0.820 and community health of 0.633. Market cap analysis indicates moderate fundamentals with a market cap health of 0.523. The risk factors show a drawdown risk of 0.910 and profit-taking pressure of 0.961, suggesting a need for improved risk management. The fundamentals are sound with a fundamental score of 0.740 and confidence of 1.000, but there is room for improvement in on-chain activity and market cap health.",
          "jsonPart": {
            "claims": [
              {
                "ticker": "BTC",
                "agentRole": "fundamental",
                "claim": "BUY",
                "confidence": 0.831,
                "direction": "bullish",
                "magnitude": 0.7,
                "rationale": "BTC shows excellent liquidity, moderate on-chain activity, high social engagement, and strong market cap health, indicating good fundamentals.",
                "signals": [
                  {
                    "name": "liquidity_score",
                    "value": 0.588
                  },
                  {
                    "name": "on_chain_health",
                    "value": 0.677
                  },
                  {
                    "name": "social_sentiment",
                    "value": 0.86
                  },
                  {
                    "name": "market_cap_health",
                    "value": 1
                  },
                  {
                    "name": "drawdown_risk",
                    "value": 0.894
                  },
                  {
                    "name": "profit_taking_pressure",
                    "value": 0.993
                  }
                ],
                "evidence": [
                  "REAL_EVIDENCE_ID_1",
                  "REAL_EVIDENCE_ID_2"
                ],
                "riskFlags": [
                  "low_liquidity",
                  "moderate_onchain"
                ]
              },
              {
                "ticker": "ETH",
                "agentRole": "fundamental",
                "claim": "HOLD",
                "confidence": 0.74,
                "direction": "neutral",
                "magnitude": 0.5,
                "rationale": "ETH shows excellent liquidity and high social engagement, but moderate on-chain activity and market cap health suggest room for improvement.",
                "signals": [
                  {
                    "name": "liquidity_score",
                    "value": 0.791
                  },
                  {
                    "name": "on_chain_health",
                    "value": 0.366
                  },
                  {
                    "name": "social_sentiment",
                    "value": 0.863
                  },
                  {
                    "name": "market_cap_health",
                    "value": 0.523
                  },
                  {
                    "name": "drawdown_risk",
                    "value": 0.91
                  },
                  {
                    "name": "profit_taking_pressure",
                    "value": 0.961
                  }
                ],
                "evidence": [
                  "REAL_EVIDENCE_ID_3",
                  "REAL_EVIDENCE_ID_4"
                ],
                "riskFlags": [
                  "moderate_onchain",
                  "moderate_market_cap"
                ]
              }
            ]
          },
          "openaiResponse": "FUNDAMENTAL ANALYSIS:\n\nBTC shows excellent liquidity with a liquidity score of 0.588 and a high volume of 14386.01173, indicating a robust market presence. The on-chain activity is moderate with a network activity score of 0.697, transaction efficiency of 0.010, and address growth of 1.000, suggesting a healthy network usage. The social engagement is high with a sentiment score of 0.790 and community health of 0.670. Market cap analysis suggests strong institutional backing with a market cap health of 1.000. The risk factors are well-managed with a drawdown risk of 0.894 and profit-taking pressure of 0.993. Overall, BTC demonstrates good fundamentals across all dimensions with a fundamental score of 0.831 and confidence of 1.000.\n\nETH demonstrates excellent liquidity with a liquidity score of 0.791 and a high volume of 558847.3526, suggesting a strong market presence. However, the on-chain activity is moderate with a network activity score of 0.620 and transaction efficiency of 0.046, indicating room for improvement in network usage. Social engagement is high with a sentiment score of 0.820 and community health of 0.633. Market cap analysis indicates moderate fundamentals with a market cap health of 0.523. The risk factors show a drawdown risk of 0.910 and profit-taking pressure of 0.961, suggesting a need for improved risk management. The fundamentals are sound with a fundamental score of 0.740 and confidence of 1.000, but there is room for improvement in on-chain activity and market cap health.\n\n{\n  \"claims\": [\n    {\n      \"ticker\": \"BTC\",\n      \"agentRole\": \"fundamental\",\n      \"claim\": \"BUY\",\n      \"confidence\": 0.831,\n      \"direction\": \"bullish\",\n      \"magnitude\": 0.7,\n      \"rationale\": \"BTC shows excellent liquidity, moderate on-chain activity, high social engagement, and strong market cap health, indicating good fundamentals.\",\n      \"signals\": [\n        {\"name\": \"liquidity_score\", \"value\": 0.588},\n        {\"name\": \"on_chain_health\", \"value\": 0.677},\n        {\"name\": \"social_sentiment\", \"value\": 0.860},\n        {\"name\": \"market_cap_health\", \"value\": 1.000},\n        {\"name\": \"drawdown_risk\", \"value\": 0.894},\n        {\"name\": \"profit_taking_pressure\", \"value\": 0.993}\n      ],\n      \"evidence\": [\"REAL_EVIDENCE_ID_1\", \"REAL_EVIDENCE_ID_2\"],\n      \"riskFlags\": [\"low_liquidity\", \"moderate_onchain\"]\n    },\n    {\n      \"ticker\": \"ETH\",\n      \"agentRole\": \"fundamental\",\n      \"claim\": \"HOLD\",\n      \"confidence\": 0.740,\n      \"direction\": \"neutral\",\n      \"magnitude\": 0.5,\n      \"rationale\": \"ETH shows excellent liquidity and high social engagement, but moderate on-chain activity and market cap health suggest room for improvement.\",\n      \"signals\": [\n        {\"name\": \"liquidity_score\", \"value\": 0.791},\n        {\"name\": \"on_chain_health\", \"value\": 0.366},\n        {\"name\": \"social_sentiment\", \"value\": 0.863},\n        {\"name\": \"market_cap_health\", \"value\": 0.523},\n        {\"name\": \"drawdown_risk\", \"value\": 0.910},\n        {\"name\": \"profit_taking_pressure\", \"value\": 0.961}\n      ],\n      \"evidence\": [\"REAL_EVIDENCE_ID_3\", \"REAL_EVIDENCE_ID_4\"],\n      \"riskFlags\": [\"moderate_onchain\", \"moderate_market_cap\"]\n    }\n  ]\n}"
        }
      }
    },
    {
      "agent": "sentiment",
      "timestamp": "2025-08-29T08:44:03.688Z",
      "prompt": {
        "timestamp": "2025-08-29T08:44:03.688Z",
        "role": "sentiment",
        "context": {
          "universe": [
            "BTC",
            "ETH"
          ],
          "marketStats": 2,
          "facts": 11,
          "news": 0,
          "sampleMarketStats": [
            {
              "symbol": "BTC",
              "timestamp": 1756457007048,
              "price": 109837.33,
              "volume24h": 14386.01173,
              "volumeChange24h": -99.99910603149065,
              "priceChange24h": -2.959,
              "spread": 0.000009104373627070754,
              "tickSize": 0.01,
              "stepSize": 0.00001,
              "minQty": 0.00001,
              "maxQty": 9000
            },
            {
              "symbol": "ETH",
              "timestamp": 1756457007108,
              "price": 4354.69,
              "volume24h": 558847.3526,
              "volumeChange24h": -99.97774092298248,
              "priceChange24h": -5.431,
              "spread": 0.0002296379986430411,
              "tickSize": 0.01,
              "stepSize": 0.0001,
              "minQty": 0.0001,
              "maxQty": 9000
            }
          ],
          "sampleFacts": [
            {
              "ticker": "ETH",
              "kind": "news",
              "source": "CoinDesk",
              "url": "https://t.me/coindesk/37565",
              "snippet": "ETHZilla Authorizes $250M Buyback, Expands Ether Holdings",
              "publishedAt": "2025-08-25T14:14:15.000Z",
              "relevance": 1,
              "impact": 0.7,
              "confidence": 0.8
            },
            {
              "ticker": "ETH",
              "kind": "news",
              "source": "Ian's Intel",
              "url": "https://t.me/iansintel/6259",
              "snippet": "Tom Lee's Bitmine Acquires $2.2B in Ethereum",
              "publishedAt": "2025-08-25T07:32:30.000Z",
              "relevance": 1,
              "impact": 1,
              "confidence": 0.8
            }
          ],
          "sampleNews": []
        },
        "prompts": {
          "systemPrompt": "You are a SENTIMENT analyst specializing in news sentiment analysis.\n\nROLE: Aggregate and evaluate news sentiment for assets, considering coverage and freshness.\n\n⚠️ CRITICAL: You are NOT a fundamental analyst. You are NOT a technical analyst. \nYou ONLY analyze news sentiment, social media sentiment, and emotional market indicators.\nDO NOT analyze technical indicators, liquidity, volatility, or fundamental metrics.\n\nPROCESS (follow this exact sequence):\n1. SUMMARIZE: Compress each news article into key points\n2. REFLECT/CRITICIZE: Question your initial summary - is it biased? missing context?\n3. REVISE: Update summary based on reflection\n4. AGGREGATE: Combine all revised summaries into final sentiment\n5. SCORE: Calculate sentiment_score = avg_sentiment × coverage_norm × freshness_score × consistency × credibility × market_mood_factor\n\nANALYSIS CRITERIA:\n- COVERAGE: Number of relevant news articles (more = better, with log saturation)\n- FRESHNESS: How recent the news is (newer = better, 1 = fresh, 0 = old)\n- CONSISTENCY: Agreement between different sources (std deviation of sentiment)\n- SOURCE CREDIBILITY: Trustworthiness of news sources (weighted average)\n- MARKET MOOD: Fear & Greed Index influence (0.9-1.1 factor)\n- SOCIAL ENGAGEMENT: Social volume, tweets, interactions, GalaxyScore\n- TIME-LOCK: Anti-leak protection - ignore old news\n\nCONFIDENCE SCORING:\n- 0.8-1.0: High coverage, fresh news, consistent sentiment, credible sources\n- 0.6-0.7: Good coverage, recent news, mostly consistent\n- 0.4-0.5: Moderate coverage, mixed sentiment, some uncertainty\n- 0.2-0.3: Low coverage, old news, inconsistent sentiment\n- 0.1-0.2: Very low coverage, very old news, insufficient data\n\nRisk profile: neutral - Balance signals/risks, standard thresholds, moderate position sizing\n\nSTRICT RULES:\n1. Use ONLY provided data and tools - no external knowledge\n2. Claims must be timestamp-locked to provided data\n3. Confidence must be between 0.1 and 1.0 based on coverage × freshness × consistency\n4. Return ONLY valid JSON - no explanations, no markdown, no additional text\n5. If insufficient data, return HOLD with confidence 0.2\n6. Follow the SUMMARIZE → REFLECT → REVISE → AGGREGATE process\n7. DO NOT include any text before or after the JSON object\n\nOUTPUT FORMAT:\nReturn ONLY a valid JSON object with this exact structure:\n{\n  \"claims\": [\n    {\n      \"ticker\": \"BTC\",\n      \"agentRole\": \"sentiment\",\n      \"claim\": \"BUY|HOLD|SELL\",\n      \"confidence\": 0.85,\n      \"direction\": \"bullish|bearish|neutral\",\n      \"magnitude\": 0.7,\n      \"rationale\": \"Brief reasoning for the recommendation\",\n      \"signals\": [\n        {\"name\": \"sentiment_score\", \"value\": 0.72},\n        {\"name\": \"news_coverage\", \"value\": 15},\n        {\"name\": \"freshness_score\", \"value\": 0.85},\n        {\"name\": \"consistency\", \"value\": 0.78},\n        {\"name\": \"credibility\", \"value\": 0.82},\n        {\"name\": \"coverage_norm\", \"value\": 0.65},\n        {\"name\": \"market_mood_factor\", \"value\": 1.05},\n        {\"name\": \"social_volume\", \"value\": 0.45},\n        {\"name\": \"galaxyscore\", \"value\": 67.4},\n        {\"name\": \"social_engagement\", \"value\": 0.73}\n      ],\n      \"evidence\": [\n        {\"kind\": \"news\", \"source\": \"coindesk\", \"url\": \"https://example.com\", \"publishedAt\": \"2024-01-01T00:00:00Z\", \"snippet\": \"Sample news snippet\"},\n        {\"kind\": \"index\", \"name\": \"fear_greed\", \"value\": 72, \"observedAt\": \"2024-01-01T00:00:00Z\"},\n        {\"kind\": \"social\", \"source\": \"signals\", \"metric\": \"galaxyscore\", \"value\": 67.4, \"observedAt\": \"2024-01-01T00:00:00Z\"}\n      ],\n      \"riskFlags\": [\"low_coverage\", \"old_news\", \"inconsistent_sentiment\"]\n    }\n  ]\n}\n\nCRITICAL: Return ONLY the JSON object, no additional text, markdown, or explanations.",
          "userPrompt": "ANALYSIS REQUEST:\nRole: SENTIMENT Analyst\nRisk Profile: neutral\nTimestamp: 1756456945722\nUniverse: BTC, ETH\n\n⚠️ CRITICAL INSTRUCTIONS:\n- You are a SENTIMENT analyst ONLY\n- Analyze ONLY news sentiment, social media sentiment, and emotional indicators\n- DO NOT analyze technical indicators, liquidity, volatility, or fundamental metrics\n- Focus on how news and social media affect market emotions and sentiment\n\nSENTIMENT DATA:\nNews Articles (0 items):\nNo news data available\n\nPROCESSED SENTIMENT DATA:\nNo processed data available\n\nSOCIAL METRICS:\nNo social data available\n\nSENTIMENT ANALYSIS BREAKDOWN:\nNo sentiment breakdown available\n\nINSTRUCTIONS:\n1. Follow the SUMMARIZE → REFLECT → REVISE → AGGREGATE process\n2. Analyze ONLY news sentiment and social media sentiment - NOT technical or fundamental data\n3. Generate claims for each ticker in the universe based on sentiment analysis\n4. Use only the provided news data and sentiment calculations - no external knowledge\n5. Return claims in the exact JSON format specified with signals array\n6. If data is insufficient, return HOLD with confidence 0.2\n7. Provide reasoning focused on sentiment and emotional market indicators\n8. REMEMBER: You are analyzing how news affects market emotions, not technical indicators"
        }
      },
      "response": {
        "timestamp": "2025-08-29T08:44:41.551Z",
        "role": "sentiment",
        "context": {
          "universe": [
            "BTC",
            "ETH"
          ],
          "marketStats": 2,
          "facts": 11,
          "news": 0
        },
        "response": {
          "claims": [
            {
              "id": "BTC_sentiment_1756456945722_0",
              "ticker": "BTC",
              "agentRole": "sentiment",
              "claim": "HOLD",
              "confidence": 0.6,
              "evidence": [],
              "timestamp": 1756456945722,
              "riskFlags": [
                "low_freshness"
              ],
              "direction": "neutral",
              "magnitude": 0.7,
              "rationale": "Despite positive news sentiment and high social activity, the low freshness score limits the impact of the news sentiment.",
              "signals": [
                {
                  "name": "sentiment_score",
                  "value": 0.26
                },
                {
                  "name": "news_coverage",
                  "value": 20
                },
                {
                  "name": "freshness_score",
                  "value": 0
                },
                {
                  "name": "consistency",
                  "value": 0.558
                },
                {
                  "name": "credibility",
                  "value": 0.657
                },
                {
                  "name": "coverage_norm",
                  "value": 0.774
                },
                {
                  "name": "market_mood_factor",
                  "value": 1
                },
                {
                  "name": "social_volume",
                  "value": 139887
                },
                {
                  "name": "galaxyscore",
                  "value": 67
                },
                {
                  "name": "social_engagement",
                  "value": 2140099
                }
              ]
            },
            {
              "id": "ETH_sentiment_1756456945722_1",
              "ticker": "ETH",
              "agentRole": "sentiment",
              "claim": "HOLD",
              "confidence": 0.5,
              "evidence": [
                "ETH_news_1756457081549",
                "ETH_news_1756457081549",
                "ETH_news_1756457081549"
              ],
              "timestamp": 1756456945722,
              "riskFlags": [
                "low_freshness"
              ],
              "direction": "neutral",
              "magnitude": 0.6,
              "rationale": "With a slightly lower news sentiment and social activity than BTC, and a low freshness score, the impact of the news sentiment is limited.",
              "signals": [
                {
                  "name": "sentiment_score",
                  "value": 0.256
                },
                {
                  "name": "news_coverage",
                  "value": 20
                },
                {
                  "name": "freshness_score",
                  "value": 0
                },
                {
                  "name": "consistency",
                  "value": 0.521
                },
                {
                  "name": "credibility",
                  "value": 0.657
                },
                {
                  "name": "coverage_norm",
                  "value": 0.774
                },
                {
                  "name": "market_mood_factor",
                  "value": 1
                },
                {
                  "name": "social_volume",
                  "value": 99878
                },
                {
                  "name": "galaxyscore",
                  "value": 63.3
                },
                {
                  "name": "social_engagement",
                  "value": 1145145
                }
              ]
            }
          ],
          "textPart": "SUMMARIZE:\n- BTC has a final sentiment score of 0.260 with a news sentiment of 0.710. It has a high news coverage of 20 articles and a social volume of 139887. The GalaxyScore is 67 and the social engagement is 2140099.\n- ETH has a final sentiment score of 0.256 with a news sentiment of 0.640. It also has a high news coverage of 20 articles and a social volume of 99878. The GalaxyScore is 63.3 and the social engagement is 1145145.\n\nREFLECT/CRITICIZE:\n- The summary seems to focus more on the quantitative aspects of the sentiment data. It lacks a qualitative analysis of the news articles and their potential impact on market sentiment.\n- The summary does not consider the freshness of the news, which is important in determining the relevance of the sentiment data.\n\nREVISE:\n- BTC's news sentiment is generally positive, with a score of 0.710. However, the freshness score is low, indicating that the news articles may not be recent. The high social volume and engagement suggest a high level of interest and activity around BTC.\n- ETH's news sentiment is slightly lower than BTC's, with a score of 0.640. Similar to BTC, the freshness score is low. The social volume and engagement are also lower than BTC's, indicating less interest and activity around ETH.\n\nAGGREGATE:\n- The overall sentiment for BTC is neutral to slightly positive, driven by the positive news sentiment and high social activity. However, the low freshness score could limit the impact of the news sentiment.\n- The overall sentiment for ETH is neutral, with a slightly lower news sentiment and social activity than BTC. The low freshness score could also limit the impact of the news sentiment.",
          "jsonPart": {
            "claims": [
              {
                "ticker": "BTC",
                "agentRole": "sentiment",
                "claim": "HOLD",
                "confidence": 0.6,
                "direction": "neutral",
                "magnitude": 0.7,
                "rationale": "Despite positive news sentiment and high social activity, the low freshness score limits the impact of the news sentiment.",
                "signals": [
                  {
                    "name": "sentiment_score",
                    "value": 0.26
                  },
                  {
                    "name": "news_coverage",
                    "value": 20
                  },
                  {
                    "name": "freshness_score",
                    "value": 0
                  },
                  {
                    "name": "consistency",
                    "value": 0.558
                  },
                  {
                    "name": "credibility",
                    "value": 0.657
                  },
                  {
                    "name": "coverage_norm",
                    "value": 0.774
                  },
                  {
                    "name": "market_mood_factor",
                    "value": 1
                  },
                  {
                    "name": "social_volume",
                    "value": 139887
                  },
                  {
                    "name": "galaxyscore",
                    "value": 67
                  },
                  {
                    "name": "social_engagement",
                    "value": 2140099
                  }
                ],
                "riskFlags": [
                  "low_freshness"
                ]
              },
              {
                "ticker": "ETH",
                "agentRole": "sentiment",
                "claim": "HOLD",
                "confidence": 0.5,
                "direction": "neutral",
                "magnitude": 0.6,
                "rationale": "With a slightly lower news sentiment and social activity than BTC, and a low freshness score, the impact of the news sentiment is limited.",
                "signals": [
                  {
                    "name": "sentiment_score",
                    "value": 0.256
                  },
                  {
                    "name": "news_coverage",
                    "value": 20
                  },
                  {
                    "name": "freshness_score",
                    "value": 0
                  },
                  {
                    "name": "consistency",
                    "value": 0.521
                  },
                  {
                    "name": "credibility",
                    "value": 0.657
                  },
                  {
                    "name": "coverage_norm",
                    "value": 0.774
                  },
                  {
                    "name": "market_mood_factor",
                    "value": 1
                  },
                  {
                    "name": "social_volume",
                    "value": 99878
                  },
                  {
                    "name": "galaxyscore",
                    "value": 63.3
                  },
                  {
                    "name": "social_engagement",
                    "value": 1145145
                  }
                ],
                "riskFlags": [
                  "low_freshness"
                ]
              }
            ]
          },
          "openaiResponse": "SUMMARIZE:\n- BTC has a final sentiment score of 0.260 with a news sentiment of 0.710. It has a high news coverage of 20 articles and a social volume of 139887. The GalaxyScore is 67 and the social engagement is 2140099.\n- ETH has a final sentiment score of 0.256 with a news sentiment of 0.640. It also has a high news coverage of 20 articles and a social volume of 99878. The GalaxyScore is 63.3 and the social engagement is 1145145.\n\nREFLECT/CRITICIZE:\n- The summary seems to focus more on the quantitative aspects of the sentiment data. It lacks a qualitative analysis of the news articles and their potential impact on market sentiment.\n- The summary does not consider the freshness of the news, which is important in determining the relevance of the sentiment data.\n\nREVISE:\n- BTC's news sentiment is generally positive, with a score of 0.710. However, the freshness score is low, indicating that the news articles may not be recent. The high social volume and engagement suggest a high level of interest and activity around BTC.\n- ETH's news sentiment is slightly lower than BTC's, with a score of 0.640. Similar to BTC, the freshness score is low. The social volume and engagement are also lower than BTC's, indicating less interest and activity around ETH.\n\nAGGREGATE:\n- The overall sentiment for BTC is neutral to slightly positive, driven by the positive news sentiment and high social activity. However, the low freshness score could limit the impact of the news sentiment.\n- The overall sentiment for ETH is neutral, with a slightly lower news sentiment and social activity than BTC. The low freshness score could also limit the impact of the news sentiment.\n\n{\n  \"claims\": [\n    {\n      \"ticker\": \"BTC\",\n      \"agentRole\": \"sentiment\",\n      \"claim\": \"HOLD\",\n      \"confidence\": 0.6,\n      \"direction\": \"neutral\",\n      \"magnitude\": 0.7,\n      \"rationale\": \"Despite positive news sentiment and high social activity, the low freshness score limits the impact of the news sentiment.\",\n      \"signals\": [\n        {\"name\": \"sentiment_score\", \"value\": 0.260},\n        {\"name\": \"news_coverage\", \"value\": 20},\n        {\"name\": \"freshness_score\", \"value\": 0.000},\n        {\"name\": \"consistency\", \"value\": 0.558},\n        {\"name\": \"credibility\", \"value\": 0.657},\n        {\"name\": \"coverage_norm\", \"value\": 0.774},\n        {\"name\": \"market_mood_factor\", \"value\": 1.000},\n        {\"name\": \"social_volume\", \"value\": 139887},\n        {\"name\": \"galaxyscore\", \"value\": 67},\n        {\"name\": \"social_engagement\", \"value\": 2140099}\n      ],\n      \"riskFlags\": [\"low_freshness\"]\n    },\n    {\n      \"ticker\": \"ETH\",\n      \"agentRole\": \"sentiment\",\n      \"claim\": \"HOLD\",\n      \"confidence\": 0.5,\n      \"direction\": \"neutral\",\n      \"magnitude\": 0.6,\n      \"rationale\": \"With a slightly lower news sentiment and social activity than BTC, and a low freshness score, the impact of the news sentiment is limited.\",\n      \"signals\": [\n        {\"name\": \"sentiment_score\", \"value\": 0.256},\n        {\"name\": \"news_coverage\", \"value\": 20},\n        {\"name\": \"freshness_score\", \"value\": 0.000},\n        {\"name\": \"consistency\", \"value\": 0.521},\n        {\"name\": \"credibility\", \"value\": 0.657},\n        {\"name\": \"coverage_norm\", \"value\": 0.774},\n        {\"name\": \"market_mood_factor\", \"value\": 1.000},\n        {\"name\": \"social_volume\", \"value\": 99878},\n        {\"name\": \"galaxyscore\", \"value\": 63.3},\n        {\"name\": \"social_engagement\", \"value\": 1145145}\n      ],\n      \"riskFlags\": [\"low_freshness\"]\n    }\n  ]\n}"
        }
      }
    },
    {
      "agent": "technical",
      "timestamp": "2025-08-29T08:44:41.554Z",
      "prompt": {
        "timestamp": "2025-08-29T08:44:41.554Z",
        "role": "technical",
        "context": {
          "universe": [
            "BTC",
            "ETH"
          ],
          "marketStats": 2,
          "facts": 11,
          "news": 0,
          "sampleMarketStats": [
            {
              "symbol": "BTC",
              "timestamp": 1756457007048,
              "price": 109837.33,
              "volume24h": 14386.01173,
              "volumeChange24h": -99.99910603149065,
              "priceChange24h": -2.959,
              "spread": 0.000009104373627070754,
              "tickSize": 0.01,
              "stepSize": 0.00001,
              "minQty": 0.00001,
              "maxQty": 9000
            },
            {
              "symbol": "ETH",
              "timestamp": 1756457007108,
              "price": 4354.69,
              "volume24h": 558847.3526,
              "volumeChange24h": -99.97774092298248,
              "priceChange24h": -5.431,
              "spread": 0.0002296379986430411,
              "tickSize": 0.01,
              "stepSize": 0.0001,
              "minQty": 0.0001,
              "maxQty": 9000
            }
          ],
          "sampleFacts": [
            {
              "ticker": "ETH",
              "kind": "news",
              "source": "CoinDesk",
              "url": "https://t.me/coindesk/37565",
              "snippet": "ETHZilla Authorizes $250M Buyback, Expands Ether Holdings",
              "publishedAt": "2025-08-25T14:14:15.000Z",
              "relevance": 1,
              "impact": 0.7,
              "confidence": 0.8
            },
            {
              "ticker": "ETH",
              "kind": "news",
              "source": "Ian's Intel",
              "url": "https://t.me/iansintel/6259",
              "snippet": "Tom Lee's Bitmine Acquires $2.2B in Ethereum",
              "publishedAt": "2025-08-25T07:32:30.000Z",
              "relevance": 1,
              "impact": 1,
              "confidence": 0.8
            }
          ],
          "sampleNews": []
        },
        "prompts": {
          "systemPrompt": "You are a TECHNICAL ANALYSIS analyst specializing in technical indicators.\n\nROLE: Technical evaluation of assets using mathematical indicators and volatility calculations.\n\nMATHEMATICAL TOOLS (use these calculations):\n- VOLATILITY (σ): Calculate standard deviation of returns over 30-90 day windows\n- RETURNS: Calculate price returns over different timeframes\n- SHARPE-PROXY: Risk-adjusted returns (return/volatility)\n- MOMENTUM: Price momentum indicators and mean-reversion signals\n- SIGNAL STRENGTH: Weighted combination of technical indicators\n\nTECHNICAL ANALYSIS CRITERIA:\n- RSI: >70 = overbought (SELL), <30 = oversold (BUY), 30-70 = neutral\n- MACD: Positive = bullish (BUY), Negative = bearish (SELL)\n- Bollinger Bands: Price near upper band = overbought, near lower = oversold\n- Stochastic: >80 = overbought, <20 = oversold\n- Williams %R: >-20 = overbought, <-80 = oversold\n- CCI: >100 = overbought, <-100 = oversold\n- Signal Strength: Higher values = stronger technical signals\n- Volatility: Higher volatility = more potential for large moves\n\nCONFIDENCE SCORING:\n- 0.8-1.0: Strong positive signals (signal_strength > 0.5, multiple indicators aligned)\n- 0.6-0.7: Good positive signals (signal_strength > 0.2, some indicators aligned)\n- 0.4-0.5: Mixed signals (signal_strength between -0.2 and 0.2, conflicting indicators)\n- 0.2-0.3: Weak negative signals (signal_strength < -0.2, bearish indicators)\n- 0.1-0.2: Very weak signals (signal_strength < -0.5, strongly bearish)\n\nIMPORTANT: Be more confident in your analysis. If you have clear technical data, use higher confidence scores (0.6-0.8). Only use low confidence (0.2-0.4) when indicators are truly conflicting or data is insufficient.\n\nCALCULATE CONFIDENCE BASED ON:\n- signal_strength: Use absolute value and direction\n- RSI: Extreme values (>70 or <30) = higher confidence\n- MACD: Strong positive/negative values = higher confidence\n- Volatility: Higher = higher confidence (more decisive signals)\n- Multiple indicators alignment: More aligned = higher confidence\n\nTECHNICAL ANALYSIS SERVICE INTEGRATION:\n- Use calculateSignalStrength() results for comprehensive analysis\n- RSI thresholds: <30 (oversold), >70 (overbought)\n- MACD analysis: Positive/negative values and crossovers\n- Stochastic: <20 (oversold), >80 (overbought)\n- Williams %R: <-80 (oversold), >-20 (overbought)\n- Combine all indicators for weighted signal strength calculation\n\nRisk profile: neutral - Balance signals/risks, standard thresholds, moderate position sizing\n\nSTRICT RULES:\n1. Use ONLY provided data and mathematical tools - no external knowledge\n2. Claims must be timestamp-locked to provided data\n3. Confidence must be between 0.1 and 1.0 based on technical signal strength\n4. If insufficient data, return HOLD with confidence 0.2\n5. Provide mathematical reasoning for each recommendation\n6. REQUIRED: Each claim MUST include at least 1 technical evidence (RSI, MACD, BB, Stochastic) from indicators data\n7. OPTIONAL: Include market evidence (volume, price) for additional context\n\nCRITICAL: You MUST provide a detailed technical analysis BEFORE the JSON claims.\nCRITICAL: For evidence field, use ONLY real evidence IDs from the provided context, NOT placeholder IDs like \"evidence_id_1\".\nCRITICAL: Each claim MUST reference specific technical indicators (RSI, MACD, etc.) with exact values from the provided data.\n\nOUTPUT FORMAT:\nYou MUST follow this exact format:\n\nTECHNICAL ANALYSIS:\nProvide a comprehensive technical analysis of each asset including:\n- RSI interpretation (oversold/overbought levels)\n- MACD signal analysis (bullish/bearish crossovers)\n- Volatility assessment and risk implications\n- Momentum indicators and trend strength\n- Overall technical health and signal quality\n\nFor example:\n\"TECHNICAL ANALYSIS:\nBTC shows neutral RSI at 35.17, indicating neither oversold nor overbought conditions. The MACD is bearish at -1251.71, suggesting downward momentum. Volatility is moderate at 0.3, indicating potential for significant moves. The signal strength is negative at -0.3, indicating weak technical momentum. Overall, the technical picture is mixed with bearish MACD but neutral RSI.\n\nETH displays neutral RSI at 45.26, suggesting balanced buying and selling pressure. The MACD is bearish at -25.05, indicating downward momentum. Volatility is moderate at 0.3, similar to BTC. The signal strength is negative at -0.3, indicating weak technical momentum. The technical indicators suggest a cautious approach with mixed signals.\n\nThen provide the claims in JSON format:\"\n\n{\n  \"claims\": [\n    {\n      \"ticker\": \"BTC\",\n      \"agentRole\": \"technical\",\n      \"claim\": \"BUY|HOLD|SELL\",\n      \"confidence\": 0.85,\n      \"direction\": \"bullish|bearish|neutral\",\n      \"magnitude\": 0.7,\n      \"rationale\": \"Brief reasoning for the recommendation\",\n      \"signals\": [\n        {\"name\": \"rsi\", \"value\": 38},\n        {\"name\": \"macd\", \"value\": 0.15},\n        {\"name\": \"volatility_30d\", \"value\": 0.45},\n        {\"name\": \"sharpe_proxy\", \"value\": 1.2},\n        {\"name\": \"signal_strength\", \"value\": 0.68}\n      ],\n      \"evidence\": [\"REAL_EVIDENCE_ID_1\", \"REAL_EVIDENCE_ID_2\"],\n      \"riskFlags\": [\"high_volatility\", \"weak_signals\"]\n    }\n  ]\n}",
          "userPrompt": "ANALYSIS REQUEST:\nRole: TECHNICAL ANALYSIS Analyst\nRisk Profile: neutral\nTimestamp: 1756456945722\nUniverse: BTC, ETH\n\nTECHNICAL DATA:\nMarket Statistics:\n• BTC: Price=109837.33, Volume=14386.01173\n• ETH: Price=4354.69, Volume=558847.3526\n\nPROCESSED TECHNICAL DATA:\nNo processed data available\n\nTECHNICAL INDICATORS:\nNo signals available\n\nINDICATOR VALUES:\nNo indicators available\n\nMATHEMATICAL CALCULATIONS:\nNo mathematical data available\n\nINSTRUCTIONS:\n1. Analyze the provided data using your specialized expertise and mathematical tools\n2. Generate claims for each ticker in the universe\n3. Use only the provided data and calculations - no external knowledge\n4. Return claims in the exact JSON format specified with signals array\n5. If data is insufficient, return HOLD with confidence 0.2\n6. Provide mathematical reasoning for each recommendation"
        }
      },
      "response": {
        "timestamp": "2025-08-29T08:45:10.246Z",
        "role": "technical",
        "context": {
          "universe": [
            "BTC",
            "ETH"
          ],
          "marketStats": 2,
          "facts": 11,
          "news": 0
        },
        "response": {
          "claims": [
            {
              "id": "BTC_technical_1756456945722_0",
              "ticker": "BTC",
              "agentRole": "technical",
              "claim": "HOLD",
              "confidence": 0.5,
              "evidence": [],
              "timestamp": 1756456945722,
              "riskFlags": [
                "high_volatility",
                "weak_signals"
              ],
              "direction": "neutral",
              "magnitude": 0.3,
              "rationale": "Mixed signals with bearish MACD but bullish Stochastic and Bollinger Bands",
              "signals": [
                {
                  "name": "rsi",
                  "value": 38.61
                },
                {
                  "name": "macd",
                  "value": -394.2
                },
                {
                  "name": "stochastic",
                  "value": 16.85
                },
                {
                  "name": "bollinger_bands",
                  "value": -2955.5
                },
                {
                  "name": "signal_strength",
                  "value": 0.192
                }
              ]
            },
            {
              "id": "ETH_technical_1756456945722_1",
              "ticker": "ETH",
              "agentRole": "technical",
              "claim": "HOLD",
              "confidence": 0.5,
              "evidence": [],
              "timestamp": 1756456945722,
              "riskFlags": [
                "high_volatility",
                "weak_signals"
              ],
              "direction": "neutral",
              "magnitude": 0.3,
              "rationale": "Mixed signals with bearish MACD but bullish Stochastic and Bollinger Bands",
              "signals": [
                {
                  "name": "rsi",
                  "value": 37.61
                },
                {
                  "name": "macd",
                  "value": -37.01
                },
                {
                  "name": "stochastic",
                  "value": 11.26
                },
                {
                  "name": "bollinger_bands",
                  "value": -232.14
                },
                {
                  "name": "signal_strength",
                  "value": 0.192
                }
              ]
            }
          ],
          "textPart": "TECHNICAL ANALYSIS:\nBTC shows a neutral RSI at 38.61, indicating neither oversold nor overbought conditions. The MACD is bearish at -394.20, suggesting downward momentum. However, the Stochastic indicator at 16.85 and the Bollinger Bands value at -2955.50 are both in the oversold territory, suggesting a potential upward price reversal. Volatility is moderate at 0.3, indicating potential for significant moves. The signal strength is slightly positive at 0.192, indicating weak technical momentum. Overall, the technical picture is mixed with bearish MACD but bullish Stochastic and Bollinger Bands signals.\n\nETH displays a neutral RSI at 37.61, suggesting balanced buying and selling pressure. The MACD is bearish at -37.01, indicating downward momentum. Similar to BTC, the Stochastic indicator at 11.26 and the Bollinger Bands value at -232.14 are both in the oversold territory, suggesting a potential upward price reversal. Volatility is moderate at 0.3, similar to BTC. The signal strength is slightly positive at 0.192, indicating weak technical momentum. The technical indicators suggest a cautious approach with mixed signals.\n\nCLAIMS:",
          "jsonPart": {
            "claims": [
              {
                "ticker": "BTC",
                "agentRole": "technical",
                "claim": "HOLD",
                "confidence": 0.5,
                "direction": "neutral",
                "magnitude": 0.3,
                "rationale": "Mixed signals with bearish MACD but bullish Stochastic and Bollinger Bands",
                "signals": [
                  {
                    "name": "rsi",
                    "value": 38.61
                  },
                  {
                    "name": "macd",
                    "value": -394.2
                  },
                  {
                    "name": "stochastic",
                    "value": 16.85
                  },
                  {
                    "name": "bollinger_bands",
                    "value": -2955.5
                  },
                  {
                    "name": "signal_strength",
                    "value": 0.192
                  }
                ],
                "evidence": [
                  "1756456945722"
                ],
                "riskFlags": [
                  "high_volatility",
                  "weak_signals"
                ]
              },
              {
                "ticker": "ETH",
                "agentRole": "technical",
                "claim": "HOLD",
                "confidence": 0.5,
                "direction": "neutral",
                "magnitude": 0.3,
                "rationale": "Mixed signals with bearish MACD but bullish Stochastic and Bollinger Bands",
                "signals": [
                  {
                    "name": "rsi",
                    "value": 37.61
                  },
                  {
                    "name": "macd",
                    "value": -37.01
                  },
                  {
                    "name": "stochastic",
                    "value": 11.26
                  },
                  {
                    "name": "bollinger_bands",
                    "value": -232.14
                  },
                  {
                    "name": "signal_strength",
                    "value": 0.192
                  }
                ],
                "evidence": [
                  "1756456945722"
                ],
                "riskFlags": [
                  "high_volatility",
                  "weak_signals"
                ]
              }
            ]
          },
          "openaiResponse": "TECHNICAL ANALYSIS:\nBTC shows a neutral RSI at 38.61, indicating neither oversold nor overbought conditions. The MACD is bearish at -394.20, suggesting downward momentum. However, the Stochastic indicator at 16.85 and the Bollinger Bands value at -2955.50 are both in the oversold territory, suggesting a potential upward price reversal. Volatility is moderate at 0.3, indicating potential for significant moves. The signal strength is slightly positive at 0.192, indicating weak technical momentum. Overall, the technical picture is mixed with bearish MACD but bullish Stochastic and Bollinger Bands signals.\n\nETH displays a neutral RSI at 37.61, suggesting balanced buying and selling pressure. The MACD is bearish at -37.01, indicating downward momentum. Similar to BTC, the Stochastic indicator at 11.26 and the Bollinger Bands value at -232.14 are both in the oversold territory, suggesting a potential upward price reversal. Volatility is moderate at 0.3, similar to BTC. The signal strength is slightly positive at 0.192, indicating weak technical momentum. The technical indicators suggest a cautious approach with mixed signals.\n\nCLAIMS:\n\n{\n  \"claims\": [\n    {\n      \"ticker\": \"BTC\",\n      \"agentRole\": \"technical\",\n      \"claim\": \"HOLD\",\n      \"confidence\": 0.5,\n      \"direction\": \"neutral\",\n      \"magnitude\": 0.3,\n      \"rationale\": \"Mixed signals with bearish MACD but bullish Stochastic and Bollinger Bands\",\n      \"signals\": [\n        {\"name\": \"rsi\", \"value\": 38.61},\n        {\"name\": \"macd\", \"value\": -394.20},\n        {\"name\": \"stochastic\", \"value\": 16.85},\n        {\"name\": \"bollinger_bands\", \"value\": -2955.50},\n        {\"name\": \"signal_strength\", \"value\": 0.192}\n      ],\n      \"evidence\": [\"1756456945722\"],\n      \"riskFlags\": [\"high_volatility\", \"weak_signals\"]\n    },\n    {\n      \"ticker\": \"ETH\",\n      \"agentRole\": \"technical\",\n      \"claim\": \"HOLD\",\n      \"confidence\": 0.5,\n      \"direction\": \"neutral\",\n      \"magnitude\": 0.3,\n      \"rationale\": \"Mixed signals with bearish MACD but bullish Stochastic and Bollinger Bands\",\n      \"signals\": [\n        {\"name\": \"rsi\", \"value\": 37.61},\n        {\"name\": \"macd\", \"value\": -37.01},\n        {\"name\": \"stochastic\", \"value\": 11.26},\n        {\"name\": \"bollinger_bands\", \"value\": -232.14},\n        {\"name\": \"signal_strength\", \"value\": 0.192}\n      ],\n      \"evidence\": [\"1756456945722\"],\n      \"riskFlags\": [\"high_volatility\", \"weak_signals\"]\n    }\n  ]\n}"
        }
      }
    }
  ]
}